Game Name,Package Name,Description,Icon URL,Category
"Cryptogram Letters and Numbers","com.crypt.gram.puzz","Cryptogram: Number &amp; Word Puzzles — Decode, Deduce, Conquer!<br><br>Get ready for a cerebral challenge — this is Cryptogram! Dive into a world where decoding meets conquest and discover logic games, word puzzles, crosswords, and so much more to ignite your mind and test your deduction skills.<br><br>This isn&#39;t any brain workout. Instead, it&#39;s a challenging game where you&#39;ll decipher secret codes using symbols and letters, play puzzles and unlock new levels that will keep on testing you. Are you up to the challenges? Let&#39;s see what other exciting features are waiting for you.<br><br>- Intrigue, mystery and fascinating quotes to unravel<br>- Endless challenges, including word scrambles and logic puzzles<br>- Gameplay that makes brain workouts fun, never boring<br><br>Download Cryptogram now and embark on a journey to decode, deduce, and conquer!","https://play-lh.googleusercontent.com/sIusqkBjdggTExld4-A6uegpFFn8SWaGnQjSh5tw03hUxgkJmmofTVcDLUh43jNcke8","GAME_WORD"
"Zen Word® - Relax Puzzle Game","kidultlovin.word.zen","Playing Zen Word 10 minutes a day brings you incredible, challenging, and relaxing experiences.<br><br>Zen Word® is a free word game for adults that helps to train your brain and sharpen your mind. All words in Zen Word are uncrossed, without any logical connection that can give hints to help you solve the puzzles. In Zen Word, you need to search and connect the correct letters to find 20 hidden words on average in each level to test your vocabulary. The length of the phrase is the only clue that will help you find all the words and solve the puzzles. Therefore, Zen Word has very high requirements for your vocabulary and spelling skills. <br><br>Zen Word is very different from word search games. The game&#39;s difficulty will increase sharply as you find more words in Zen Word. The rest of the words could be tough to remember and spell. <br><br>All the backgrounds and music are carefully selected in the Zen style. <br>You can fully immerse yourself in word puzzles, accompanied by beautiful and peaceful nature backgrounds and peaceful music. <br><br>Zen Word Features:<br>➤ Super challenging brain game &amp; word spelling game<br>➤ Over 6000 word puzzles that gradually increase puzzle difficulty.<br>➤ Special levels are made of rare words that can block most of the challengers.<br>➤ No countdown, no competition, no failure. Just a pure word puzzle-solving experience makes you feel relaxed.<br>➤ Immerse yourself in nature&#39;s beauty and tranquility. Leave your worries behind, loosen up, and unwind.<br>➤ Soothe the mind by listening to calming background music while solving the word puzzles<br>➤ Play daily to earn bonus rewards to help you clear the levels.<br>➤ You can log in using Facebook to sync your game progress across various devices.<br> <br>Keep in touch with Zen Word<br>Send us Emails: support@kidultlovin.com<br>Visit our website: http://www.kidultlovin.com","https://play-lh.googleusercontent.com/RnTWnDdTD5pp03w3k8re9bxDFPoIQjXJ6F-PwKGuOUNMvnQg6rqqtyTvZ8xmdRoA4yM","GAME_WORD"
"Word Search Explorer","in.playsimple.wordsearch","With Word Search Explorer embark on a wondrous quest of adventure and wisdom, where the fun never stops!<br><br>This <b>FREE TO PLAY</b> word game makes learning new words so easy and much more fun. Flex your brain, connect the letters and swipe your way through hundreds of word puzzles, while steadily growing your vocabulary and confidence for the challenges ahead!<br><br>Successfully completing each puzzle will bring you closer to your next destination!<br><br>Buckle-up and get ready to go on an endeavour that takes you through breathtaking landscapes while training your brain to become a TRUE champion of the mind!<br><br>Believe the hype, join thousands of word game enthusiasts and download Word Search Explorer today!<br><br><b>HOW TO PLAY:</b><br><br>As easy as taking a walk in the park, find words that are hidden in the letter grid related to a common theme. Swipe your fingers to form the words that are hidden in plain sight. The puzzles get trickier as you progress while gaining more wisdom!<br><br><b>GAME FEATURES:</b><br><br>- FREE TO PLAY: Get this game for FREE and put your word game skills to the test<br>- GUIDING HINTS: The game offers multiple hints which will guide and help you on your journey.<br>- PLAY ANYTIME, ANYWHERE: Take a break and play offline wherever you want!<br>- CHALLENGING PUZZLES: Easy to play, hard to master! A new challenge awaits for you after every puzzle<br>- BOOSTS YOUR VOCABULARY: Improve your vocabulary as the game exposes you to a wide variety of words that will help you in your daily life<br>- SYNC YOUR GAME PROGRESS: Login through facebook and sync your game progress across multiple devices<br><br>Pack your bags and get ready to Explore, Wander &amp; Discover. No need to wait, start playing <b>Word Search Explorer</b> and begin your voyage today!","https://play-lh.googleusercontent.com/mCfgwBA4i2DlZlcAYvghu2XMShRbDFrLRt0x7hLJKLd5dW3WnwkF8sHI2H220c1oae4","GAME_WORD"
"Braindom: Brain Games Test","com.braindom","Looking for brain games, brain tests, tricky puzzles to play and become the riddle master?<br><br>Come and solve them all and become the riddle master of the IQ games.<br><br>Enter the world of Braindom: Tricky Brain Teasers, Test, Riddle Games. This is the world of trivia crack, quiz games, riddles and brain puzzles. Come and solve, crush them all.<br><br>Discover the culprit or identify the killer in this mystery-solving challenge! Dive into Braindom, a widely played free mind game, recognized for its popularity as a brainwash and 7-second riddles mobile game.<br><br>Can you solve it and demonstrate your intelligence? It’s a game with tricky brain exercises and puzzles. Find the challenging answers to enhance your cognitive skills.<br><br>Braindom: Tricky Brain Teasers, Test, Riddle Games has many trivia, crack and tricky questions to boost your cerebral brain power.<br><br>There are hundreds of logic puzzles like “who did it” style. Prove yourself by solving smart games and mind blowing impossible answers in a brainly manner.<br><br>Braindom is an IQ game, featuring different riddles that test your thinking abilities. It will engage your mind and develop your riddle-solving skills.<br><br>These new brainly puzzle games and brain teaser games break common sense and bring you an excellent brainwash experience. Ready for the brain out in these smart games? Try this impossible mind blowing game and crush each level in this 7 second riddles game.<br><br>This game is unique, original, and creative, designed not only to push yourself with mind games but also to brainwash. You can enjoy these free iq games to brainwash . What a cool brain test and brain-teasers in this easy-game!<br><br>It’s designed with multiple brain teaser games, tricky puzzles, mind games, quiz games, idiot test, logic puzzles, riddles and cool smart games.<br><br>This free game enables your brain to think smart by thinking games and makes you a master of riddles.<br><br>The brain wash experience is unpredictable.It is a mindblowing easy-game.<br><br>Try successfully passing the stupid test, moron test, idiot test and the dumb test and get the proof that you are the riddle master of these 7 second riddles.<br><br>Our character Brian would like to call you, the king riddle master, the trivia crack and royale king, so play and crush these puzzle games.<br><br>Features:<br><br>• Very special of brain teaser games!<br>• Improve yourself with thinking games, word games!<br>• Imaginative and cool iq games!<br>• Apply real-life logic puzzles to beat the challenges.<br>• Test your savvy, imagination, and logic skills of puzzle games.<br>• Focus on the details and boost your cerebral power!<br>• Find solutions to the 7 second riddles!<br>• Tricky &amp; Mind Blowing Brain Teaser Games<br>• Great exercise for brainly.<br>• Easy-game for all, stupid test, brain games and brain puzzles for adults<br>• Great time killer, there are smart games for a brain wash experience<br>• Brain-teasers including word games, idiot test, moron test, color tricks and trivia crack<br><br>Discover that Braindom is a game with logic puzzles and brain teasers, providing an enjoyable experience. It includes tricky puzzles, making it a noteworthy brain teaser game. Engage in &quot;who is&quot; and &quot;who did it&quot; style thinking games and IQ challenges inspired by 7-second riddles.<br><br>Get ready to untangle the knots in this straightforward game and stimulate your mind while enjoying an excellent free-thinking experience.<br><br>In the levels of Braindom’s brain test tricky puzzles, brain teasers will line up on your way: mystery solving, who is lying, who did it, who is telling the truth, who’s the killer, who’s the vampire, who’s the father, who is the mother.<br><br>This is the very funny version of moron test, idiot test, quiz games, stupid test, smart games, 7 second riddles and brain puzzles!","https://play-lh.googleusercontent.com/6skyXaefYf3uMAhHL0q0jYQSvtIQiQavOMkab6m6DHuJyweNfg4TEi350baUMQ82ZHk","GAME_WORD"
"Word Collect - Word Games Fun","com.platinumplayer.word.addict","Download the best word games Free in Word Collect!<br><br>Word Collect has exciting word games Free Word Nerds! Word Collect starts as an easy word game and gets harder as you level up! <br><br>=== Enjoy Word Gameplay! ===<br>- Connect letters in any direction to form the hidden word matches!<br>- Find as many words as possible to level up and earn bonus rewards!<br>- Fill in every word block jumbles! Earn bonus coins when you discover hidden words!<br>- Can&#39;t figure out the word jumble? Use coins to get a hint and win the level!<br><br>=== Features ===<br>- Daily bonus coins for free hints!<br>- Daily Challenge gives you more free word games, more free bonus coins and more Fun Every Day!<br>- Over 900+ Levels to play word games free!<br>- Free 500 coins at the first word game login.<br>- Easy to play and difficulty increases as you go! <br>- Play Offline or Online - anytime, anywhere.<br>- Word Collect is the best free word game!<br>- For word games free single player mode, download Word Collect Word Game Now!<br><br>Get Word Collect for the best word games free for word game fans, word search addicts, and more!<br>Play word games now in Word Collect - it&#39;s so addictive!<br><br>The prizes in this word game are not exchangeable for real-world money or prizes. Having an issue with these free word games for android? For immediate support, contact us at support@superfree.com. Thanks!","https://play-lh.googleusercontent.com/-9ciW-SR0XoqVrYNo-2D8iY7IiSxViQdIkNd5qtX2Ihg5WxIwRkEP7gH7l9-ouBTxg","GAME_WORD"
"NYT Games: Word Games & Sudoku","com.nytimes.crossword","Keep your mind sharp with word and logic puzzles from New York Times Games. Free to download, the app offers new puzzles daily for every skill level.<br><br>App Features and Games:<br><br>NEW AD-FREE PUZZLES DAILY<br>There are never any ads to disrupt the fun in The New York Times Games app, so you can play without distraction.<br><br>WORDLE<br>Play the original Wordle — created by Josh Wardle — in our app. Guess the 5-letter word in 6 tries or less. Then, sharpen your everyday strategy and see how you stack up against the WordleBot, our robotic companion to the puzzle. <br><br>SPELLING BEE<br>Is scrambling your strong suit? Play the daily Spelling Bee and see how many words you can make with 7 letters. <br><br>THE CROSSWORD<br>Subscribers can play the same daily puzzle that’s printed in The New York Times, in our app. Crosswords increase in difficulty throughout the week, so there’s something for everyone.<br><br>CONNECTIONS<br>Our newest word game lets you group words with a common thread. See if you can do it with 4 mistakes or fewer.<br><br>SUDOKU<br>Looking for a numbers game, minus the math? Play Sudoku and fill each 3x3 set of boxes with numbers 1–9. Play a new puzzle every day in easy, medium or hard mode.<br><br>THE MINI CROSSWORD<br>The Mini is all the fun of The Crossword, but you can solve it in seconds. These word games don’t increase in difficulty throughout the week and feature simpler clues.<br><br>TILES<br>Unwind while you match elements in the day’s pattern — the key is to make consecutive matches. <br><br>LETTER BOXED<br>Create words using letters around the square. Letter Boxed is another fun way to test your word-making skills.<br><br>STATS<br>Track your progress for The Crossword, Wordle and Spelling Bee. For The Crossword, monitor your average solve times, see how many puzzles you can solve in a row, and more. Plus follow your streak on Wordle, and track how often you reach each level in Spelling Bee.<br><br>LEADERBOARDS<br>Start a friendly competition with The Mini leaderboards. Add up to 25 friends to see who can solve today’s Mini puzzle the fastest.<br><br>PUZZLE ARCHIVE<br>Subscribers can now solve past Spelling Bee puzzles, plus play over 10,000 crosswords in our archive.<br><br>DIGITAL SUBSCRIPTION OPTIONS:<br>You can purchase a monthly or annual New York Times Games subscription.<br><br>Enjoy unlimited gameplay, The Crossword archive and more with a monthly or annual subscription. See our subscription offers for further details.<br><br>BY DOWNLOADING THE NEW YORK TIMES GAMES APP, you agree to:<br>• The automatic renewal terms stated above.<br>• The New York Times Privacy Policy: https://www.nytimes.com/privacy/privacy-policy<br>• The New York Times Cookie Policy: https://www.nytimes.com/privacy/cookie-policy<br>• The New York Times California Privacy Notices:           https://www.nytimes.com/privacy/california-notice<br>• The New York Times Terms of Service:       https://www.nytimes.com/content/help/rights/terms/terms-of-service.html<br><br>Please note: A subscription to New York Times Games does not include access to any other New York Times products, including but not limited to nytimes.com, New York Times Cooking, Wirecutter, mobile news content and other apps on non-iOS devices.","https://play-lh.googleusercontent.com/QXDGA4zkli9V9-xPs3fT6qRjG7zSLpS0JlBWtvUP-ZxRHy7tmlIrzvzgAqgLru_brQ","GAME_WORD"
"Word Link-Connect puzzle game","words.puzzle.wordgame.free.connect","No limits, infinite tries. Play Word Link 10 mins a day to help you exercise your brain, improve your vocabulary and spelling skills, develop thinking and have fun in the process.<br><br>This text twist of a word game is tremendous brain challenging fun. Connect letters in any direction to form the hidden word matches, and you will never experience a dull moment after trying this addicting word puzzle game. Lovers of classic word games like Scrabble, crosswords,  or anagrams will love this word hunt and spell vocabulary game.<br><br>There&#39;s a whole word of wonders to explore in this free crossword puzzle. You will start with few letters as an unique clue, you can test your brain to write and create new words from scratch. And connect all of them to get the final crossword solution. There are extra words to find on each level if you want to make a puzzle more challenging.<br><br>You will travel around this fun world of word link. Immerse yourself into the beautiful scenery backgrounds to relax and escape from the stresses of daily life. Play offline, anywhere, anytime!<br><br><b>Word Link -puzzle game features:</b><br>- 🎊 Get your word hunt on more than 2000+ levels.<br>- 🎉 Free and offline game.<br>- 🧐 Sharp your mind :  power up your memory and improve your spelling skills.<br>- 🤩 Challenge everyday: solve daily puzzles to get great rewards.<br>- 🎮 Simple and accessible: fun and educational for all ages<br><br>Word Link will test your vocabulary as you discover the wonders filled with challenging levels. Join the word game community now. Test yourself with this fun and free challenging game!","https://play-lh.googleusercontent.com/yfrx5oMMa1EhYIA1A3n3HkqD-tHwRf27VFcfZj46cTbFtPTy8RrmPtYeHiFXEBuBvRY","GAME_WORD"
"Wordscapes","com.peoplefun.wordcross","💕Playing Wordscapes 10 mins a day sharpens your mind and prepares you for your daily life and challenges! 💕<br><br>This text twist of a word game is tremendous brain challenging fun. Enjoy modern word puzzles with word searching, anagrams, and crosswords! Immerse yourself into the beautiful scenery backgrounds to relax and ease your mind.<br><br>Challenge yourself to connect letters and find as many hidden words as you can! Unlock stunning landscape backgrounds to escape from home and relax your brain.<br><br>You’ll never experience a dull moment after you try this addicting word puzzle game! Play this crossword puzzle once and just you won’t be able to put it down. Enjoy word connect and word find games? This is your final destination!<br><br>►Escape and relax your brain by visiting the beautiful destinations of Wordscapes!<br>► Show your vocabulary power by connecting letters and finding all the hidden words.<br>► Get your word hunt on with over 6,000 crossword puzzles!<br>► Challenge your brain and vocabulary – this crossword puzzle starts easy and becomes challenging fast!<br>► Think you can beat these anagram word puzzles? They start simply but ramp up fast!<br>► Take each level at your own pace with unlimited tries. Simply fun and relaxation!<br><br>Wordscapes is the word hunt game that over 10 million people just can&#39;t stop playing! It&#39;s a great fit for fans of crossword, word connect and word anagram games, combining word find games and crossword puzzles. Not to mention all the gorgeous landscapes you can visit to relax yourself!<br><br>Created by the makers of Word Stacks, Word Chums, Word Flowers, Word Mocha, Wordscapes Uncrossed, and Spell Blitz.<br><br>Terms of service: https://www.peoplefun.com/terms","https://play-lh.googleusercontent.com/2TOwtdo3fcRQVnMo3Y-lqpK514490ZfztM-9J5XkbZ9E1hmxrfahQQawgH38Ojf7U9g","GAME_WORD"
"Words of Wonders: Crossword","com.fugo.wow","Welcome to Words of Wonders! In this fantastic crossword game, you will improve your vocabulary and spelling skills at the same time you travel around the world discovering the hidden secrets of the 7 wonders and also incredible cities.<br><br>In WOW you will start with few letters as an unique clue, you will have to test your brain to write and create new words from scratch and connect all of them to get the final crossword solution. Will you master this vocabulary game? Sometimes you will have the solution clear in your head, but sometimes you will have to guess the solution as there won&#39;t be more words to connect. This game is a perfect entertainment tool to improve and develop your searching, writing, and solving problem skills.<br><br>Puzzle by puzzle you will travel around the world while solving every crossword and every challenge that may arise. Connect letters to get the final solution and travel to a new country! Is there any better than discovering the world while learning new words and improving your vocabulary? <br><br>What strategy will you use? To solve the puzzle at a first sight by guessing or maybe by finding one word at a time? What will be the next city to quit from your bucket list? In this amazing crossword game, you will visit all of them!<br><br>TEST YOUR VOCABULARY<br><br>How many words do you actually know? Your alphabet may be more limited than you think...or maybe not! These puzzles are challenging and will test how broad your vocabulary is, how you combine different options, and if you can search well enough to solve the jigsaw. <br><br>FIND THE HIDDEN SECRETS<br><br>This crossword game will merge the needed skills you need to solve every riddle. You will need to master the vocabulary to go to the next levels. There are extra words to find on each level if you want to make a puzzle more challenging.<br><br>DISCOVER NEW PLACES<br><br>Join the quest and enjoy your trip around the world to visit the seven wonders! Connect them with your knowledge and you will have advanced a lot. Each monument is unique and has a different letter to guess. You will learn new vocabulary but also you are learning about how wonderful the earth is at the same time! Will you be able to create a hidden sentence? <br><br>BECOME A MASTER<br><br>Words Of Wonders (WOW) will test your vocabulary as you discover the wonders filled with challenging levels. Begin your journey with the first wonder and climb your way up to reach the top. Each wonder and level will get progressively harder and will be unique, thanks to the game’s rich database. Connect the letters without lifting your finger, find the hidden words on the board!<br>Enjoy the simple and beautiful game design and also the wide variety of levels and puzzles that will give you more fun during the play!<br><br>Words Of Wonders (WOW) is a challenging word game from the makers of Wordz. Let the adventure begin!","https://play-lh.googleusercontent.com/8Zc2SWYy3t70pvIdX9PeuaHpZZIP8sJybKiBUH2vkdxx9R2rypcIE-rN9_fbt-G7rWQ","GAME_WORD"
"Wordle!","com.vottzapps.wordle","Are you a word games master? Whether you are a fan of classic crossword puzzles or are just hopping on viral new word game trends, Wordle! will get you thinking. Take on daily brain teasers and train your mind with our fun word games.  <br><br>🧠<b> Daily Puzzles </b>🧠<br>With several unique game modes, Wordle! will Challenge your mind and spelling skills. Want a fun and viral challenge? Try Daily Puzzle mode, where you’ll have 6 guesses to solve the word of the day. Each time you get a letter correct, the tile will turn yellow if it is in the word or green if it is in the right spot. Can you solve it with one guess? Once you’ve figured it out, share your score with friends. It&#39;s just like the viral word game, but on your phone!<br><br>💡<b> Classic Wordle! </b>💡<br>Can’t get enough Wordle!? Play Unlimited Wordle! in Classic mode, and play as long as you want. No need to wait a whole day for the next puzzle. Getting stuck? Not to worry! Use a hint to get out of a sticky situation and unlock the solution!<br><br>🔥<b> Word Fever </b>🔥<br>Or take on a timed challenge in Word Fever mode, where you will test your speed and spelling skills. Spell the word before the timer runs out, each time you find the word, the timer will reset and you will have to think fast and solve the next word. How far can you go?<br><br>👀<b> Secret Word </b>👀<br>Want to test your mind for the duration? In Secret Word mode you will have 3 chances to guess each word with the letters and clue provided. Push your word association skills to the limit, and guess each word before moving on to the next. Guess wisely, 3 incorrect guesses and you will have to start over!  <br><br>Expand your adult mind and make your brain stronger with our free word games! It is like taking your brain to the gym!<br><br>Wordle! Together Mode! Choose a word and challenge your friends!<br><br>Check if they can guess it in six tries or less. Take turns solving each other’s words and earn points for solving the least amount of guesses. Enter a random match or challenge your friends to the ultimate viral battle of wits! It’s a fun and all new way to Wordle!  <br><br>⭐⭐⭐<b> Game Features </b>⭐⭐⭐<br> <br>⭐<b> Fun Word Puzzles </b>⭐<br>Play the viral word game, or try one of our fun and creative game modes for a unique challenge like you’ve never seen before <br><br>⭐<b> Unlimited Wordle!  </b>⭐<br>Solve as many Wordle! puzzles as you’d like In Classic mode. No need to wait a whole day for the next puzzle! <br><br>⭐<b> Share Your Results </b>⭐<br>Try Daily Puzzle mode, where you can solve the Wordle! of the day, then share your results and compare stats with friends<br><br>⭐<b> Special Boosters  </b>⭐<br>Having trouble? Unlock special boosters like the Dart, which will remove letters or Hint to reveal a correct letter, or use a Skip to pass a level entirely or try again if you lose. <br><br>⭐<b> Play at Your Own Pace </b>⭐<br>Whether you enjoy the pressure of a timed challenge, or want to try to go the duration in Secret Word mode. Wordle! Has several games to play at your desired pace<br><br>⭐<b> Flex Your Brain Muscles </b>⭐<br>Ready for a tougher challenge? Test your skills in more challenging levels with longer words!  Will you be the Wordle! Champion?<br><br>Visit https://lionstudios.cc/contact-us/ if have any feedback, need help on beating a level or have any awesome ideas you would like to see in the game!<br><br>From the Studio that brought you Mr. Bullet, Happy Glass, Ink Inc and Love Balls!<br><br>Follow us to get news and updates on our other Award Winning titles;<br>https://lionstudios.cc/<br>Facebook.com/LionStudios.cc<br>Instagram.com/LionStudioscc<br>Twitter.com/LionStudiosCC<br>Youtube.com/c/LionStudiosCC","https://play-lh.googleusercontent.com/_B32rGd7Hz6brMpVBOXqtNCbMpl1SA0nCHJdcXsomylGi0vUaPYmmWMrNtzQOWBmow","GAME_WORD"
