Game Name,Package Name,Description,Icon URL,Category
"Fallout Shelter","com.bethsoft.falloutshelter","** Google Play Best of 2015  **<br>Mobile Game of the Year - 2016 DICE Awards<br>Winner 2015 Golden Joystick Best Handheld/Mobile Game<br><br>&quot;Might just be the best free-to-play game out there&quot; - GamesBeat<br>&quot;Probably the best game of E3 2015” – Gizmodo <br>&quot;Fallout Shelter is simple to play and addictive as hell.&quot; - GameZone<br><br>BUILD THE PERFECT VAULT<br>Create a brighter future…underground! Select from a variety of modern-day rooms to turn an excavation beneath 2,000 feet of bedrock into the very picture of Vault Life.<br><br>OVERSEE A THRIVING COMMUNITY <br>Get to know your Dwellers and lead them to happiness. Find their ideal jobs and watch them flourish. Provide them with outfits, weapons, and training to improve their abilities.<br><br>CUSTOMIZE<br>Turn worthless junk into useful items with Crafting! Customize the look of any dweller in the Barbershop.<br><br>PROSPER<br>A well-run Vault requires a variety of Dwellers with a mix of skills. Build a Radio Room to attract new Dwellers. Or, take an active role in their personal lives; play matchmaker and watch the sparks fly! <br><br>EXPLORE THE WASTELAND <br>Send Dwellers above ground to explore the blasted surface left behind and seek adventure, handy survival loot, or unspeakable death. Find new armor and weapons, gain experience, and earn Caps. But don’t let them die!<br><br>PROTECT YOUR VAULT<br>From time to time, idyllic Vault life may be disrupted by the dangers of post-nuclear life. Prepare your Dwellers to protect against threats from the outside…and within.<br><br>Vault-Tec has provided the tools, but the rest is up to you. What are you waiting for? Get started building your Vault today for FREE.","https://play-lh.googleusercontent.com/_a6gLFB3VI3R1iP8ZH2q81VFH7YoIp6HCsyP7zkCUu4NpgnqNqKwfbMxQWyk27IeF50","GAME_SIMULATION"
"Idle Outpost: Upgrade Games","com.rockbite.zombieoutpost","Idle business simulator and tycoon game with a post-apocalyptic and zombie survival theme. The world has ended, and you&#39;re running a post-apocalyptic trading post!<br><br>Your management skills will make the difference between survival and extinction. Build your outpost, trade with survivors, and expand your empire in this thrilling mega-simple 2D game with a gritty, immersive atmosphere.<br><br>When the night comes, fight off silly zombies!<br><br>Start with a small scrapyard outpost and grow your trading empire!<br><br>Begin with just a basic outpost in the desert, then upgrade and expand as you earn resources and profits. As you progress, discover new locations, from abandoned gas stations to underground vaults, and build the most prosperous post-apocalyptic trading network in the world!<br><br>There will be a ton of post-apocalyptic locations.<br>Venture from arid deserts to lush forests, encountering bandit camps, winter hideouts, and high-tech trading hubs. With each new level, unlock stunning new locations and challenges for your trading post.<br><br>Idle Outpost is perfect for players who love:<br><br>💥 Post-apocalyptic and survival-themed games<br>💼 Business simulation and tycoon games<br>🏗️ Building and managing virtual empires<br>🎮 Engaging single-player experiences<br>🔌 Offline gameplay with no internet required<br>🆓 Free-to-play games that offer hours of entertainment<br><br>Embark on a journey of survival, commerce, and growth in Idle Outpost, the ultimate post-apocalyptic trading post simulator. Can you build the most prosperous trading empire in the new world? Download now and find out!","https://play-lh.googleusercontent.com/4-_DIaBXHv6Y2ZvYWxIPJB4dLVYNz4z4Pgd1QtMVvQqMbZ_9wKHKwzN3hbPCSV6M1g","GAME_SIMULATION"
"YOYO Decor: Doll Dress Up","com.yoyo.doll.decor.life.home.design.love.match.makeover.games","&quot;YOYO Decor&quot; Doll Dress Up Game is addictive girls makeup Game! Play the dream house &amp; Decoration Game and improve your aesthetic anytime, anywhere, and experience a warm decor life!<br><br>Click, drag and drop cute furniture and decorations to fit in every corner of the house, and decor with beautiful clothes and hairstyles to girls in the makeover game, just like you would in a classic Dress Up and decor home Game. This style game is very simple to play but very addictive. Improve your aesthetic skills with this Fashion Design Game. Of course, you will feel extremely relaxed while enjoying this House decoration game, effectively relieving and releasing your stress!<br><br>If you like playing Dress Up Games and Home Design Games, you will love this simulation Casual Game. It&#39;s easy to play, full of fun and challenge! This YOYO Decor: anime princess game combines the gameplay of Decoration Games and Dress Up Games to bring you a different Fashion Simulation Game that can both entertain and relieve stress.<br><br>🏡🏡 Create Picture - Perfect Interior Living Spaces<br>Use your creative vision to design and construct breathtaking cute furniture rooms for wonderful clients seeking your style. Craft incredible houses or gardens with chic furniture and decor for superior fashion. Choose fashion accents like rugs, wall art and bed to make every space utilized. <br><br>🎀🎀 Fabulous, On-Trend Home Decor<br>Make each room amazing with lively, vibrant decorations showing your flair and taste. Pick fun area rugs, beautiful art, cozy seating and sweet pets to give your dream house charm and personality! Endless customization options for your stylish dream house.<br><br>🛋️🛋️ Unlimited Interior Furnishings<br>Discover and collect fabulous sofas, tables, chairs and more for mixing and matching stunning colors and patterns. Thoughtfully arrange pieces to construct fully customized, designer dream house. Express your unique style with an extensive catalog of chic furniture.<br><br>📷🌟 Dress-up and other gameplay features<br>Not only can you create houses or gardens, but you can also dress up yourself with a variety of styles of clothes, and other mini-games to add more fun in this dream house decoration game. Complete daily tasks like playing with adorable pets, capturing special moments with your spouse or friendly neighbors.<br><br>💐💐 Home Decor Life Game - design to your heart&#39;s content<br>Adorn your home with lovely curtains, plants and accents. Create a welcoming oasis showcasing your personal style and vision. Make your most glamorous decor dreams into reality! <br><br>👍👍 Fun Features The Whole Family Will Love<br>- Exciting gameplay - design incredible spaces for interesting clients in a delightful story! <br>- Creativity galore - tons of on-trend decor choices for custom, fashionable rooms!<br>- Spark imagination - create your beautiful garden however you envision it!<br>- Happy decor life world - enjoy positive energy and bonding with friends! <br>- Accomplishment - manage your business and progress through fabulous chapters in decor life!<br><br>🌟🌟 Start Your Interior Design Journey Now!Download Decor life: Home Design Game and unlock possibilities for chic, stylish home design! Begin decorating your dream house immediately and live the lifestyle you&#39;ve imagined! Customize every corner of your interior home with decor options tailored to your unique taste and style - the possibilities are endless with YOYO Decor life!<br><br>【Contact Us】<br>– Discord: https://discord.gg/tSVJcaT6jU<br>– FB Page: https://www.facebook.com/profile.php?id=61553417999413<br>– Email: yoyocreations@outlook.com<br>– TikTok: https://www.tiktok.com/@iamyoyodoll<br>– Youtube: https://www.youtube.com/channel/UCSAAS6shg37jLQGd4GhqvAA","https://play-lh.googleusercontent.com/G52hCPyASjyyZkUTrlJl_QfpjzKWXCurj_9LgZTpqD5A2dbVS5GOPGdMFFmknzR-MaA","GAME_SIMULATION"
"Move People","com.paurau.MakeHer","Put her and him in shape. Control puppets in variety of situations and help them achieve the desired state!","https://play-lh.googleusercontent.com/O9P56gA7wxHVcU_TI4YRwWPdKw4czT1gMiIdz-meNWbMFrwFlhFeQ3mn0xSQqCOh1H0N","GAME_SIMULATION"
"Garden Joy: Design & Makeover","com.scopely.gardenjoy","Garden Joy is a cozy landscape design game for the fans of outdoor &amp; interior design. It is a simulation in which you will grow plants (trees, flowers, etc.) and collect outdoor furniture. Create the most charming garden designs for the front yards or terraces of beach houses, English cottage, family home, villas and more. Learn about plants with an in-game encyclopedia and save earth while playing.<br><br>In this cozy landscaping and gardening simulation, you will:<br><br>🏡Design the perfect home garden<br>🌻Decorate yards with hundreds of flowers &amp; plants<br>🎨Express yourself in garden-makeover challenges<br>🌳Plant trees in the real world while saving the earth<br>🧘‍♀️Relax in a cozy house landscaping game<br>🛋️Collect stylish furnitures for your terrasses &amp; garden lounge<br>💧Water your seeds to grow them into flowers, trees, bushes…<br>🪴Collect seeds packs and trade them to grow your collection!<br><br>Become a creative landscaper<br>Dive into the landscaping world to turn home gardens into havens with Garden Joy – the ultimate virtual gardening game. Leave interior design to embrace the great outdoors! Play your cards right to transform a house yard into the garden of your dreams. It’s time to give a complete landscape makeover to outdoor spaces!<br><br>Grow your collection<br>Collect and grow plants, trees, flowers or bushes with seed packs. Trade the seeds packs to enrich your collection of plants.  Collect stylish outdoor furniture such as sofa, bench, parasol, coffee table, etc. Be creative with your collection to design and decorate the garden of countless houses and homey residencies, make’em look royal!<br><br>Redecorate many house gardens<br>As a landscaping and home design aficionado, your mission is to decorate the garden of various houses, from beach houses to English cottages, Mediterranean villas to mountain chalets. Use your senses for interior design to beautify outdoor spaces. New challenges are added every day!<br><br>It’s a complete makeover!<br>You’ll start on the empty terrasse of a beautiful house, or you might be given free rein in the garden of a cozy home. Use your creativity and your collection of plants and furniture to come up with the best landscaping design of your life! Find the best match to design the gardens of your dreams.<br><br>Team up in multiplayer events.<br>Partner with up to 3 people for limited-time events to create stunning bouquets. Use the flower tokens from completing challenges to build these beautiful floral arrangements. The more tokens collected, the bigger the bouquet, the greater the rewards!  Additionally, seasonal events will allow you to cooperate with other players.<br><br>Protect our planet earth 🌎<br>Because ecology and preservation of the ecosystem matters more now than ever, you can do your part while playing Garden Joy. Garden Joy and One Tree planted come together in this an eco-friendly game to give you the option to plant real trees just by playing the game.<br><br>Learn about the plants<br>Learn real details about flowers, plants, and trees while decorating. How much water, or sunlight do they need? Where do they originate from? Plants will no longer keep any secret from you.<br><br>Share with the world<br>Showcase your latest garden makeover projects and receive valuable feedback from fellow landscapers through voting. Do your magic!  It&#39;s time to inspire dreams with all the plant gatherings you&#39;ve been doing! Your friends will have no words when they see your work.<br><br>If you like cozy games and interior design games, Garden Joy will be the breath of fresh air you need! People enjoying word games, puzzle games and mini games will surely like it too!<br><br>Garden Joy is not just a game; it&#39;s a celebration of life and the art of the exterior design makeover. Join our community of passionate gardeners and embark on a journey to renovate, decorate, and escape your way to a stunning virtual garden.<br><br>Download Garden Joy on Google Play now and start cultivating your dream home garden today!","https://play-lh.googleusercontent.com/Mbv9sjrHbrAiIDQxvKEwQzJXtgzS7u9QCKzZMvZG05ZTZSfpxkMU0uQWEu6DFqx261k","GAME_SIMULATION"
"Acrylic Nails!","com.crazylabs.acrylic.nails","Get ready for the ultimate nail salon experience at ASMR Acrylic Nails! Indulge in the perfect makeover for your long nails as you explore the world of nail art and design. Design and paint acrylic nails. You can make gorgeous acrylic nails and engage in beauty care with a limitless array of options for designs, pigments, and lengths. Our manicure salon, known as the top ASMR girls nail salon, offers the most satisfying gameplay. With beautiful designs, impeccable paints, and various lengths, you&#39;ll have endless possibilities to create stunning acrylic nails. Explore the latest trends and express your unique style in our girl nail salon environment, where beauty care meets fashion!<br>Features:<br><br>&gt; Complete various nail art challenges and missions<br>&gt; Unlock and collect a wide range of nail art designs<br>&gt; Customize and decorate your own long nails<br>&gt; Experiment with different nail shapes and lengths<br>&gt; Interact with virtual customers and fulfill their nail art requests<br>&gt; Upgrade your nail tech skills to unlock advanced techniques<br>&gt; Discover new trends and stay up-to-date with the latest nail art styles<br>&gt; Share your nail art creations with your friends<br>&gt; Enjoy a relaxing and immersive ASMR experience while creating stunning nail designs<br><br>Immerse yourself in the relaxing ASMR sounds as you enjoy a day at our nail salon makeover. Choose from a wide range of nail art and unleash your creativity with nail tech. Fashion lovers will love this satisfying game.<br>Acrylic Nails isn&#39;t just about aesthetics - it&#39;s about accepting beauty care as a form of self-care. That&#39;s why we&#39;ve incorporated soothing ASMR elements into our app, creating a truly satisfying experience that rejuvenates both mind and body as you pamper your nails to perfection. Join a community of fashion-forward individuals who understand that beauty is more than just skin deep. <br><br><br>To opt out of CrazyLabs sales of personal information as a California resident, please visit our Privacy Policy: https://crazylabs.com/app","https://play-lh.googleusercontent.com/hb5cZrIx3qVIZU08Xj_sj8ssMDRpiy0lL8u8QFrh5Nhmn_d-pNqR2HjRraLQ3jIDA00w","GAME_SIMULATION"
"Drill and Collect - Idle Miner","tr.com.apps.drill.and.collect","Deep beneath the earth&#39;s surface, hidden riches wait to be unearthed! In this exciting mining game planet, you&#39;ll be drilling, digging, and collecting mud, dirt, and ores to build your mining empire from scratch.<br><br>As an idle miner gold  digger, your job is to excavate the earth and uncover valuable resources that you can sell for profit. You&#39;ll need to strategize and manage your resources wisely to maximize your earnings and expand your operations.<br><br>To get started, you&#39;ll need to hire workers and equip them with the necessary tools and gear to begin your digging and drilling. As you collect mud, dirt, and ores, dig ground, you can sell them for money, which you can use to upgrade your equipment, hire more workers, and expand your coal mining operations.<br><br>If you&#39;re looking for a relaxing and addictive ifle game,offline simulator games,my hotel, minecraft, build master, mr mine, gold and goblins this planet is the one for you. With its 8dle miner and gold digger feature, you can sit back and let the machine do the work for you while you explore and build your coal mining empire. But don&#39;t forget to keep an eye on your profits, my mini mart, and make strategic decisions to ensure your game success.<br><br>As you progress, you&#39;ll encounter more challenging resources to extract, requiring more advanced 8dle miner equipment and skills like minecraft and gold and goblins. You&#39;ll need to tap, dig, explore and unlock uncharted areas to find these 8dle miner resources,like my mini mart, but watch out for unexpected offline ifle games events like cave-ins or equipment breakdowns that can set you back like simulator building games, build adventure capitalist and gold and goblins, hole io, solar smash, aquapark io, stardew valley, township, outlets rush, scratch, aquarium land, clicker,egg inc, fallout shelter, getting over it, mob control, my perfect hotel, paper toss, melon maker, snowball io, fruit ninja classic, crowd evolution, monkey mart, tiny tower, worldbox, deep rock, my little universe, ragdoll break, shell shockers, eatventure, idle egg factory.<br><br>With your idle miner profits, you can reinvest in your coal mining site to grow your operation and become an business tycoon offline games like my perfect hotel,build master,mr mine, build adventure capitalist. You can expand your team, clicker, upgrade your equipment, dig, tap and even acquire land to unlock additional idle office tycoon mining opportunities. Hire workers, like hay day, agar io, hayday, paper io 2 for money.<br><br>In this planet tycoon no wifi games, you&#39;ll experience the thrill of building and managing your gold digger clicker gold mining empire. Take control of the entire operation for money, make strategic no wifi games decisions,simulator games, and watch your empire flourish like build master and mr mine. Hire and train workers, like my mini mart, optimize your no wifi building games processes, and stay ahead of the competition just like minecraft, build adventure capitalist, gold and goblins, ground digger, my mini mart, dig deep, turmoil and lumber inc. And more like mr mine, taiko, chicken factory, frozen city, stone miner, mine rescue, bucket crusher, junkyard keeper, miners settlement, bounce and collect.<br><br>With simple yet addictive gameplay and stunning graphics, this drill game offers hours of entertainment for auto clicker players of all auto clicker idle office tycoon. Whether you&#39;re a seasoned gaming tycoon or a newcomer to the world of games, the allure of becoming a successful gold mining tycoon building games awaits you.<br><br>So what are you waiting for? Put on your hard hat, grab your pickaxe, and embark on the journey to gold mining success! Start drilling for riches and become the ultimate tycoon games in this captivating mining game.<br><br>E-mail us: dnc-support@apps.com.tr<br>Join our Discord server: https://discord.gg/DS2T37VeZF","https://play-lh.googleusercontent.com/pMUSNlZVSioiKlpuSuJvM8CKLqiTrG_9GrQMRqviPbQMZTLZRttrhllzLuyAlLOqIeg","GAME_SIMULATION"
"456 Run Challenge: Clash 3D","com.run.squid.challenges.survival.clash","🔥🏃‍♂️ Welcome to the adrenaline-fueled world of 456 Run Challenge: Clash 3D! Are you ready to embark on the ultimate test of sniper skill, strategy, and survival 3D? 🔥🏃‍♂️<br><br>💥 Dive into an action-packed survival challenge 2 gaming experience like never before, where each moment is a thrilling 456 survival challenge 2 adventure filled with heart-pounding survival challenges and intense competition. With a wide array of 456 mini-games to choose from, including the Candy Challenge 2, Throw Ball, Hunting Game 3D, Bridge Game, Red Light Green Light Shipper, Hide N Seek, Join Clash 3D, and Prison Escape, there&#39;s never a dull moment in this epic survival 3D journey.<br><br>💥💥 How to play:<br>🍬 Candy Challenge 2: players are tasked with the survival mission of cutting candies into predetermined shapes. With 456 candies laid out before them, players must carefully slice through each sweet candy treat to match the specified shape within the given time limit.<br>🎯 Throw Ball: Hone your aiming skills and unleash your inner athlete as you aim to hit targets with pinpoint accuracy, racking up points with each successful throw.<br>🏹 Hunting Game 3D: Channel your inner hunter and embark on a survival Challenge 2 to track down elusive prey, using stealth and strategy to outmaneuver your opponents and emerge victorious.<br>🌉 Bridge Game: Take on the challenge of crossing 456 perilous bridges, carefully navigating your way across while dodging pitfalls and hazards lurking at every step.<br>🚦 Red Light Green Light Shipper: Put your reflexes to the test in a high-octane race against time.<br>🕵️‍♂️ Hide N Seek: Master the art of stealth and evasion as you outwit your opponents and evade detection in a thrilling game of cat and mouse.<br>⚔️ Join Clash 3D: Team up with fellow challengers and engage in epic battles against formidable adversaries, using cunning tactics and teamwork to emerge victorious.<br>🔒 Prison Escape 3D: Use your ingenuity and resourcefulness to stage a survival breakout from a maximum-security prison, outsmarting 456 guards and overcoming level challenge to secure your freedom.<br><br>🔥🎮 Key Features:<br>🔥 Immerse yourself in an immersive gaming experience with stunning 3D graphics and dynamic sound effects that bring each mini-game to life with unparalleled realism.<br>🎮 Test your snipper skills and reflexes with intuitive controls that make it easy to jump right into the action, whether you&#39;re a seasoned gamer or a newcomer to the world of mobile casual gaming.<br>💥 Challenge yourself with a diverse range of mini-games and suvival objectives, each offering its own unique 3D set of challenges and rewards to conquer.<br>🏃‍♂️ Compete against friends and players from around the globe, or tackle the 456 game challenges solo in single-player mode to see how you stack up against the competition.<br>🏆 Unlock achievements and rewards as you progress through each mini-game, earning bragging rights and recognition for your accomplishments as you rise through the ranks and become the ultimate champion.<br><br>🔥🏆 Are you ready to test your skills and prove yourself as the ultimate champion of 456 Run Challenge: Clash 3D? Download now and prepare to embark on the adventure of a lifetime! 🔥🏆","https://play-lh.googleusercontent.com/195EbiiLN4D9di67p8Iq0ja_oczw3_sjjzx-2nUpIs8eRsPDL04QHSv-vM6zXTTGQg","GAME_SIMULATION"
"Makeup ASMR: Makeover Story","com.makeoverstory.makeupasmr","Imagine transforming a rotting mermaid into an enchanting human.<br>How to turn a scruffy beggar into a handsome man?<br>Have flies or bees ever invaded your eyes?<br>Can you still kiss your girlfriend with cracked lips?<br><br>Don&#39;t worry, we have the answers! But we offer much more—<br><br>Features:<br>1. Immersive care for your ears, armpits, lips, and hair, providing holistic stress relief!<br><br>2. Sound effects for unmatched relaxation and serenity, leaving behind worries for a stress-free beautification experience!<br><br>3. Diverse character roles for endless outfit possibilities. Create a unique style with clothing, hairstyles, and accessories!<br><br>4. Challenging organizing and tidying games await. Unlock levels and discover additional surprises!","https://play-lh.googleusercontent.com/ddOg0CpUkfN1djTDNgi4IDccVVfirX5gNGyUqmbszqAeimTVDROOeg6tY1-zxyE-Jf3i","GAME_SIMULATION"
"Super Loop","com.pooppa.superloop","Welcome to Super Loop, the ultimate roller coaster clicker merge game! Build and manage your amusement park empire by merging roller coaster elements to create thrilling rides. Upgrade with themes and decorations to attract visitors. Compete in races, complete quests, and have fun!","https://play-lh.googleusercontent.com/PlH9WxzesftkjIbkPx149JnapQmfen_db4BsUW8NWaYd8PG3p_5d61oQgp8eiYunHIND","GAME_SIMULATION"
"Zoo - Happy Animals","su.canoe.zoo.elephant","Welcome to Zoo - Happy Animals, where you&#39;ll tackle various tasks to maintain animal welfare in this colorful zoo simulator packed with entertaining mini-games.<br><br>🐊 Master zoo management skills: Feed, groom, wash, and herd animals through maze puzzles, obstacle courses, and more.<br><br>🐊 Engage in intuitive gameplay with increasing difficulty levels, offering challenges suitable for all animal enthusiasts.<br><br>🐊 Care for alpacas, elephants, monkeys, lions, hippos, and even crocodiles with occasional cute gestures and rewards.<br><br>🐊 Zoo promotes animal welfare awareness with simple gameplay and humorous elements while maintaining age-appropriate content.<br><br>Want an idle game with adorable animals, fun challenges, and quirky humor? Download Zoo – Happy Animals now!<br><br>Privacy Policy: https://say.games/privacy-policy<br>Terms of Use: https://say.games/terms-of-use","https://play-lh.googleusercontent.com/IbIFfqjHHY9qsf8UQXFUhRXYBaNuFWS-Sp3CZ33OFpxLHCOxZYUm5dX-78n8h4agAYc","GAME_SIMULATION"
"Craft City Loki","com.world.monster.builder.sun.craft","Craft City Loki is a new simulator game for everyone who wants to build their own city.<br>Explore infinite worlds and build everything from the simplest of homes to the grandest of castles. Play in creative mode with unlimited resources or mine deep into the world in survival mode, crafting weapons and armor to fend off dangerous mobs<br>The gameplay:<br>Learn how to build your house in a castle or in a mine.<br>Decorate your house with your mates &#39; furniture and your own eyes. Learn more and more, and you will never be able to build massive castles and temples!<br>Are you ready to discover all the secrets of life in a mysterious cubic World? Download Craft City Loki now.<br>Thanks for playing!","https://play-lh.googleusercontent.com/8PBQ7kTWd0ZVcbMbXvExDamP4e3ov6lFB9-9xUhNy0d_Tt3lvbHM2uQtN9fZFCVj8tE","GAME_SIMULATION"
