Game Name,Package Name,Description,Icon URL,Category
"Jenny Solitaire - Card Games","com.kidultlovin.royalsolitaire","Welcome to Jenny Solitaire, the ultimate classic card game experience! Dive into the world of free solitaire games, like Solitaire, Microsoft Solitaire Collection, and Basic Solitaire, with a focus on middle-aged and older women. Enjoy the elegance and fun of this Solitaire free for pad, while also giving your brain a workout. Embark on a journey of strategic thinking with our cute corgi pet in this unique game. Seek challenges, unwind, and enjoy an exciting adventure that awaits you!<br><br>Jenny Solitaire offers relaxing and brain-teasing free card game play. It presents classic game graphics and an elegant brand style, creating a comfortable and delightful atmosphere for all players. With classic gameplay catering to beginners and veterans, explore numerous levels in the realm of Jenny Solitaire. Meet Jenny, our adorable corgi companion, who follows you on your journey as you unwind with free solitaire card games.<br><br>In the world of Jenny Solitaire, you’ll discover various exciting and challenging modes such as Classic Solitaire alongside. Collect bonuses for Jenny while amassing diamonds to unlock beautifully designed decks of cards. Relax with free solitaire games, each moment brimming with joy in Jenny Solitaire.<br><br>Keep enjoying your beloved free solitaire games while reaping generous rewards that enhance your collection of dog food and diamonds. Join millions of players embracing the best free solitaire card game. Experience an elegant world filled with Solitaire, royal card games, and our special corgi companion, Jenny, in a soothing atmosphere.<br><br>Highlights:<br>• Elegant UI design emphasizing royal charm.<br>• Clear and large fonts/cards for effortless gaming.<br>• Classic solitaire gameplay that caters to both beginners and veterans.<br>• Classic mode: Choose between Draw1 or Draw3 cards for classic card games and savor the original fun.<br>• Daily challenges with valuable rewards.<br>• Limited-time events to collect festive tokens.<br>• Helpful tools: Undo, Hint, and Magic Wand to aid problem-solving.<br>• Generous rewards: Unlock exciting achievements in-game and win diamonds and special treasures.<br>• Adorable corgi companion Jenny offers warmth and happiness.<br>• Play offline solitaire games without internet connection anytime, anywhere.<br><br>Jenny the corgi beckons you to join the fun of Jenny Solitaire - Classic Card Game. Showcase your skills and strategies in this classic card game universe, featuring free solitaire, Solitaire, and other games echoing the thrill of casino classics. Join this relaxing card game now!<br><br>We cherish your input—feel free to email us at support@dailyinnovation.biz with your thoughts and suggestions.","https://play-lh.googleusercontent.com/pfCzaoe8A4csUvA617QNY07pIHFqa1ZBzm9632lS-2u8l4KkAhlB-jyPK1zFev3Acc0","GAME_CARD"
"Solitaire","solitaire.card.games.free.solitaire.classsic.themes","We stays true to the classic Solitaire (also known as Patience Solitaire).<br>Solitaire is funny, addictive and challenging brain games. Gameplay is very simple to start but hard to master. <br>Our game is the most easy-to-play with clean and intuitive designs. Meanwhile, we have added many beautiful themes and Daily challenges for you.<br><br>Just single tap or drag and drop to move the card, and use the shortest time and moves get the highest scores. Simple and addicting!<br><br>==============Features==============<br>♠ Unlock customizable beautiful themes<br>♠ Daily Challenge<br>♠ Unlimited free undo<br>♠ Unlimited free hints<br>♠ Draw 1 card<br>♠ Draw 3 cards<br>♠ Auto-collect cards on completion<br>♠ Auto-save game in play<br>♠ Track your records<br>♠ Left handed mode<br>♠ Tablet support<br>♠ Multiple languages supported<br><br>Train your brain as well as kill time with friends together!<br>Have fun playing Solitaire!","https://play-lh.googleusercontent.com/drBpEXMcw-mRw26cqWEa89xLoEkpAY7VCnhYMMwQpB6lZLqZSLPM4H-5bTPOxJoDGg","GAME_CARD"
"Spider Solitaire","spider.solitaire.card.games","<b>Spider Solitaire</b> is a classic and amazing solitaire card games to train your brain and relax your life! Bet you will say loudly &quot;Fantastic!&quot; when you playing this Spider Solitaire card game. If you like classic card games like Klondike Solitaire, TriPeak Solitaire, FreeCell Solitaire, Pyramid Solitaire, Spades, and Hearts, this Spider Solitaire is really for you!<br><br>The <b>Spider Solitaire</b> is classic solitaire card game but not rigid. You can choose your favorite backgrounds, card faces, card backs, and even the victory animations after you win a game. There are 100+ backgrounds and card backs in this spider solitaire.<br><br>This fantastic Spider Solitaire has daily challenges waiting for you. When you do daily challenges for several days, you will get a gift box; when you do daily challenges for a month, you will get a trophy. Daily challenges make the Spider Solitaire more interesting. You can play 1 Suit at the begining, and if you want to challenge yourself or try your luck, you can play 2 Suit and 4 Suit.<br><br>Spider Solitaire has other game play around the card games, such as sea adventure pass, designing your garden or house, collecting stars to unlock more themes, and so on.<br><br>Install Spider Solitaire now! Play this solitaire card game, it is more than you imagine!","https://play-lh.googleusercontent.com/vSu9dPABiQKdmEhK0nLW50kEm4EV-QeyarrECI_rZS0Kx14Yuda6DtJrTamKfzKZrks","GAME_CARD"
"FreeCell Solitaire: Card Games","com.mobilityware.freecell","Welcome to the ultimate destination for fans of the classic card game! Dive into the world of solitaire gaming, where strategy meets relaxation, all for free. With intuitive controls and smooth gameplay, <b>FreeCell Solitaire</b> offers an immersive experience perfect for casual players and seasoned enthusiasts.<br><br>FreeCell has a new feature. In addition to the classic FreeCell Solitaire gameplay, we&#39;re excited to introduce the Memory Card Game. Exercise your brain and memory skills as you match pairs of cards from the deck. This engaging mini-game provides a refreshing break from the main solitaire action while offering a delightful challenge that&#39;s both relaxing and mentally stimulating.<br><br>Relaxation and Brain Training: FreeCell Solitaire isn&#39;t just about entertainment; it&#39;s also a fantastic way to unwind and train your brain. Whether unwinding after a long day or seeking a mental workout, FreeCell offers the perfect balance of relaxation and brain training. Engage your mind as you strategize your moves, sharpen your memory with the Memory Card Game, and enjoy a moment of tranquility amidst the hustle and bustle of daily life.<br><br>FreeCell Solitaire adds a new element of strategy and puzzles to the classic Solitaire card game formula. Plan each move as you use the four free cell spots as placeholders to solve the puzzle of moving cards! Stack all 52 cards from a standard deck to win! Like Klondike, you must move your cards in a suit and ascending order. Precision and strategy are key in completing the FreeCell puzzle! <br><br>Immerse yourself in the timeless allure of FreeCell Solitaire, a beloved classic that has stood the test of time. Whether you&#39;re a seasoned pro or new to the world of card games, Free Cell promises endless hours of brain training, fun, and challenge.<br><br>No Wifi Needed: Our environment ensures you can focus solely on the gaming experience without distractions. Enjoy unlimited rounds of FreeCell Solitaire for free.<br><br>Classic Card Game: Rediscover a timeless classic. FreeCell Solitaire delivers the nostalgic charm of the original game with modern convenience. Experience the thrill of arranging cards in ascending order and suit while strategically using the available free cells.<br><br>Endless Gaming Fun: Challenge yourself and beat your best score or compete with friends for the top spot on the leaderboard. With FreeCell Solitaire, the gaming possibilities are endless. Whether you have a few minutes to spare or want to unwind after a long day, FreeCell is the perfect choice for gaming on the go.<br><br>Free to Play: Enjoy the complete FreeCell Solitaire experience without spending a penny. Our free-to-play model ensures that everyone can enjoy the thrill of this classic card game without any barriers.<br><br>Solitaire Mastery: Hone your skills and become a FreeCell Solitaire master. With each game, you&#39;ll refine your strategy and develop new techniques while sharpening your brain. Whether you prefer a relaxed pace or a brain-training challenge, FreeCell Solitaire offers gameplay that adapts to your style.<br><br>Immersive Gameplay: Experience the captivating world of FreeCell Solitaire with stunning graphics and smooth animations. Each card move feels natural and intuitive, allowing you to focus on the strategy.<br><br>Classic Design, Modern Convenience: Experience the best of both worlds with FreeCell Solitaire. Our classic design pays homage to the original game, while modern conveniences ensure a seamless gaming experience on your mobile device.<br><br>With thousands of possible card combinations, FreeCell Solitaire offers endless replayability, whether you&#39;re a casual player looking to unwind or a competitive gamer seeking a challenge.<br><br>Embark on your FreeCell Solitaire journey. Experience the magic of this beloved classic. With its timeless appeal and addictive gameplay, it will surely become your mobile go-to card game. Download FreeCell Solitaire by MobilityWare and become part of a vibrant gaming community.<br>http://www.mobilityware.com/support.php","https://play-lh.googleusercontent.com/InR1A4hkkmeA6Y7fKx8WQR6HtVQUxpxfswVuQpMgBoqmFavqyXdIW8_edZShVj18GfI","GAME_CARD"
"Magic: The Gathering Arena","com.wizards.mtga","Welcome to the digital Multiverse! Magic: The Gathering is the original trading card game- and now you can download and start playing for free with your friends from anywhere!  <br><br>Magic: The Gathering Arena empowers you to discover your strategy, meet the planeswalkers, explore the multiverse, and battle friends around the world. Collect, build and master your unique deck that will become its own legend. Your battle is only the beginning; duel on stunning battlefields, and enjoy Arena’s game changing battle effects and immerse yourself in the game. Start playing for free, challenge your friends, unlock cards, and feel the magic of the original fantasy CCG! <br><br>NO EXPERIENCE NECESSARY <br><br>Never played Magic before? No problem! Magic: The Gathering Arena’s tutorial system takes you through the playstyles so you can find your strategy and decide if you’re the type to overwhelm your opponent with brute strength, if subterfuge is more your style, or anything in between. Meet characters from around the multiverse and try out spells and artifacts that make learning to play the original fantasy collectible card game quick and fun. It’s never been easier to play Magic! Collect cards to build a deck that matches your personality, then master your strategy to battle friends and be part of the TCG that started them all. <br><br>GAME ON(LINE) <br><br>The original TCG is now digital! Explore the fantasy worlds of Magic: The Gathering Arena and build your deck, play a variety of game formats to collect cards, master multiple strategies, and hone your skills against friends or the AI. With multiple game formats like Draft and Brawl, 15 unlockable collectible decks, and explosive card combo effects: Your ideal Magic: The Gathering playstyle is at your fingertips! Show off eye-popping cosmetics like avatars, card sleeves, and pets and collect daily rewards to grow your collection and build powerful decks that reflect your personal strategy. <br><br>CHALLENGE AND PLAY <br><br>Duel your friends for glory or enter in-game tournaments for exciting prizes! With Draft and Brawl pairing, there is always someone to game with. Special in-game events offer exciting rewards, and with Esports qualifiers your Pro-Magic dreams are closer than you think in the Arena Premier Play League! Queue into casual battles to hone your strategy at your own pace, or battle in Esports qualifiers and frequent tournaments to flaunt your mastery. <br><br>FANTASY AND MAGIC <br><br>Dive into the fantasy planes of Magic: The Gathering and write your own legend through Magic’s immersive lore and vibrant card art. Find your path through the multiverse using only favorite characters and their most iconic spells and artifacts, or create a theme deck with a narrative that makes sense only to you. Your story is only just beginning!  <br><br>All prices inclusive of VAT. <br><br>Wizards of the Coast, Magic: The Gathering, Magic: The Gathering Arena, their respective logos, Magic, the mana symbols, the planeswalker symbol, and all character names and their distinctive likenesses are property of Wizards of the Coast LLC. ©2019-2024 Wizards. <br><br>Please visit https://company.wizards.com/legal/wizards-coasts-privacy-policy to view Wizards of the Coast&#39;s privacy policy and https://company.wizards.com/legal/terms to view Wizards of the Coast&#39;s terms of use.","https://play-lh.googleusercontent.com/qI7ggnBdfCYpT1j2SoyIVdhG-bLAgDKpgrh53oLzSO20q1OPZ8CAyR116ERyXfVOnxM","GAME_CARD"
"Solitaire - Card Game 2024","com.standard.puzzle.game.card.solitaire","Solitaire - Card Game, your one-stop destination for all the beloved traditional card games you&#39;ve cherished!<br><br>Regarded worldwide as the most adored card game, our version of the classic Solitaire, otherwise known as Patience, offers an excellent means to unwind and engage your cognitive skills. Integration of delightful cards, entertaining animations, and options for free, offline play convert our Solitaire rendition into a superior pastime option. Get indulged with random &amp; solvable Solitaire decks wrapped within striking graphics, making it one of the addictive card games worldwide.<br><br>Searching for enjoyable games to ease off? Interested in testing your perseverance through card games? Classic Solitaire is just perfect! With eye-pleasing cards &amp; seamless gameplay, immerse yourself in full deck Solitaire for hours. Opt from various game styles, including traditional, Spider, &amp; Freecell versions. Furthermore, our Classic Solitaire cards applicability comes packed with customizable features, providing you with the freedom to modify the aesthetics &amp; ambiance of your Patience games. So why wait? Download Classic Solitaire today and get immersed in our enticing card games!<br><br>Think you have the unbeatable strategy for Classic Solitaire? Explore distinct daily challenges, full deck Solitaire &amp; compelling card games. Or delve into unlimited random card games &amp; achievable solitaire decks! Assess your patience &amp; play on your own accord with a 1 card or 3 card draw, and choose between traditional Solitaire or Vegas scoring. Challenge yourself with our daily Solitaire tasks &amp; configure your Patience cards, table, &amp; Solitaire game mode according to your preference! These captivating card enigmas would undoubtedly get you glued to card games!<br><br>Classic Solitaire Games Offers:<br><br>♣ Traditional Solitaire card games<br>♣ Thrilling daily tasks keeping you engrossed in fresh Patience games<br>♣ Offline accessibility for traditional Solitaire games – Test Your Persistence Anytime!<br>♣ Statistics based insights for Solitaire card games players<br>♣ Magnetic card games and intricate Solitaire challenges<br>♣ Innumerable Patience hints &amp; revoke actions aiding you to master Solitaire<br>♣ Personalizable basic Solitaire card &amp; table aesthetics<br>♣ Vegas &amp; conventional Solitaire scoring modes<br>♣ Progressive Vegas scoring feature<br>♣ Fully equipped Solitaire options, enticing card conundrums &amp; side Patience games<br>♣ Random card games or Palpable Solitaire decks<br>♣ Availability of Left-Handed Solitaire Mode<br>♣ Attractive HD Graphics Compatible with Each Achievable Solitaire Deck &amp; Patience Puzzle<br><br>Instructions to Play Classic Solitaire Games:<br>A classic Solitaire card game or intriguing card conundrum, colloquially called Patience, might be new for some users. The game uses a customary deck of 52 cards with the objective to expose all the cards &amp; shift them to foundation stacks. Four foundation piles are there, evolving from Aces to Kings in feasible Solitaire decks. The captivating card puzzle is quick to learn allowing you to kick-start at once. The daily Solitaire keeps your mind alert &amp; brain youthful.<br><br>Basic Solitaire card games (also identified as Patience or Traditional Solitaire) contain seven tableau columns that dwindle alternately in colors. Deploy the ideal strategy to clear the rows that feed the foundation piles.<br><br>Already acquainted with playing Solitaire card games? Our traditional Solitaire can enhance cognitive functions &amp; problem-resolution abilities! Embrace the exciting card puzzle &amp; evergreen classic card game on your phone enabling you to relish Patience anytime, anywhere!<br><br>Our version of classic Solitaire games caters to teaching Solitaire techniques, helps discover captivating card puzzles, put your patience to test and develop optimal strategies for Solitaire games. Partake in easily achievable Solitaire games or challenge your Patience with more demanding levels. Get ready to get hooked with hypnotic card riddles &amp; everyday Solitaire upshots!","https://play-lh.googleusercontent.com/0DzEBugeMDsXThpfwECrIdS9fG-rsAvjj17ml3vBn3eWE4X9gpalGBpohH1DoJW_SIUe","GAME_CARD"
"Solitaire Collection - 2024","com.standard.puzzle.collection.solitaire","The classic solitaire that you played on PC is now ready to be enjoyed on your phone!<br><br>Solitaire, also known as Klondike/ Patience or Soli, is the most popular single player card games in the world. If you like classic Solitary, you&#39;re going to love this crisp and clear solitaire game for FREE, offline and online! Join over 10 million users playing our Solitaire Card Game today.<br><br>As a classic card game, Solitaire has countless card game lovers around the world. Do you still remember the first time when you open and play Solitaire? This is not only in your memory because Solitaire can be played now on phone and tablet, anywhere and anytime.<br><br>Download Solitaire today and play our fun card game – FREE!<br><br>- Solitaire Card Games Features -<br><br>+ Multiple language choices<br>+ Can choose whether one or three cards are drawn from the deck at a time<br>+ Can Choose playing by left hand or right hand<br>+ Multiple choice backgrounds and cards with different face styles.<br>+ Click &amp; Draw function, when you click on one card, it can automatically move to the right place<br>+ HINT can guide to move next<br>+ Auto save incomplete game<br>+ Unlimited UNDO<br>+ Can be played offline, without wifi<br>+ Upgrade and play with no Ads!<br><br><br>If you like classic, realistic and fun single player card games like Spider Solitaire, Pyramid Solitaire, FreeCell Solitaire, then Klondike Solitaire is for you!<br><br>Play the best FREE SOLITAIRE card game on Android now and see for yourself why so many others love this Solitaire game!","https://play-lh.googleusercontent.com/5Gq64FgLgeoL5cTSJkaBTptJkSZhBXN8w2HVS7m89WX3_6vz15o7VTt7eLG3qaFNWc4","GAME_CARD"
"Solitaire: Classic Card Game","com.newpubco.klondikesolitaire","<b>Solitaire is the real, classic Klondike solitaire card game readily available at your fingertips. This simple, rewarding classic klondike solitaire gameplay experience was designed for both basic solitaire players and pros! Install and play this relaxing, free classic Klondike Solitaire app today. It&#39;s the only free card game you&#39;ll ever need to boost your IQ!</b><br><br>♣️ <b>Solitaire is such a relaxing, classic card game</b>! Test your patience with Klondike Solitaire - this high-quality, free solitaire fun you can enjoy offline or online, whenever you need to unwind. Whether you like <b>classic solitaire</b> or Spider and Freecell, with our <b>Klondike Solitaire app</b>, you&#39;ll immediately be able to play your favorite <b>free solitaire</b> card game online, anytime, anywhere, on your mobile phone or tablet. ♣️<br><br><b>Play the classic Klondike Solitaire</b> every day and you will be rewarded with a unique <b>Daily Solitaire Challenge</b> to solve. Solving the Daily Challenge for 7 days in a row will help you add a solitaire crown to your collection, plus you get to train your brain and keep your mind sharp by frequently exercising logic.<br>With our Klondike Solitaire game app, you also have the option to play the best <b>real Solitaire card game offline or online</b>!<br><br>Check out Solitaire Klondike Features to understand why it&#39;s a real treat, a patience game app you need on your mobile device:<br>♥️ Our <b>Klondike Solitaire</b> card game has beautiful, eye-pleasing graphics <br>♥️ It&#39;s all about pure, <b>original, classic solitaire Klondike or patience gameplay</b> and it&#39;s completely free <br>♥️ <b>Fun Daily Solitaire Challenges</b> await when you play solitaire offline or online every day, giving you a chance to collect various items like gems and trophies. <br>♥️ Engage in various solitaire game tasks that, once completed, lead to higher scores and winning coins. <br>♥️ Utilize the magic wand as a tool to make the klondike solitaire game easier and the roulette for a chance to win more prizes or collectibles after completing a number of games. <br>♥️ Embark on a fun, eventful journey as you move up levels. <br>♥️ During gameplay, participate in special card collection events - collecting paws, fishes, flowers, drinks, desserts, and more. <br>♥️ Merge collection events - gather various types of gems such as citrine, ruby, sapphire, or animal items such as kittens, sweets, fruits, and more. <br>♥️ As you play longer, unlock various card faces and backs, as well as new and fun themes for your card decks.<br>♥️The end animations will evoke a nostalgic wave of fond memories from your days of playing solitaire on computers.<br><br>Spending your time indoors during breaks or spare time can be so fun - you only need a good old <b>free solitaire card game online</b>. Stress relief, brain training, focus improvement - Klondike Solitaire helps with all, as it is both a &quot;train brain&quot; type of game and a free card game of luck, exciting and fun.<br><br><u>Install Klondike Solitaire app today</u>, play and solve challenges, enjoy all the customization options, and <u>don&#39;t forget to rate &amp; review us</u> - your feedback is highly appreciated at NewPubCo! Have a great time playing <b>Klondike Solitaire</b>!","https://play-lh.googleusercontent.com/J7d3LavIQHJ47-TDVo3ydhtvriSV_3hOgi0LUxXZ3FMMGHN_Lqd21iTqUTY27EsVXQc","GAME_CARD"
"Solitaire Daily Break & Puzzle","com.sciplay.solitairepuzzle","Solitaire Daily Break is an engaging and interactive classic solitaire game. Play the classic card game you know and love completely for free- even offline! Relax and play endless levels of free classic solitaire. Gather solitaire jigsaw puzzle pieces while you play and unlock beautiful jigsaw paintings! The goal of the game is to move all the cards from the Tableau to the Foundation from Aces to Kings in the same suit.<br><br>Play solitaire games, gather jigsaw pieces, complete puzzles and earn customized backgrounds, card fronts and backs- even when you play offline.<br>Play free solitaire with the most stunning background and card themes you’ve ever seen! Enhance the experience even when you play in offline mode with fan favorite themes like anime, outer space, ancient Egypt and many more!<br>  <br>Looking for something fun to do in your spare time? Step into the Solitaire jigsaw puzzle kingdom and play a new solitaire card game! Download Solitaire Daily Break and play solitaire free even when you’re offline. Also known as the patience game, classic solitaire involves strategy, skill, and a little luck.<br><br>Keep your mind sharp by solving free solitaire games and Solitaire jigsaw puzzle games. This classic solitaire card game will help you keep your brain active during your downtime. Play these free basic solitaire card games and enjoy the best puzzle card games anytime, anywhere!<br><br> CLASSIC SOLITAIRE FEATURES:<br>♠️ Completely free solitaire!<br>♥️ Classic scoring system. Keep track of your solitaire jigsaw puzzle game performance with statistics on your current match and your all-time best score<br> ♦️ 3-card draw: 3-card settings turn the game into an even more challenging and thrilling experience. Make the most out of this solitaire puzzle game and triple the fun!<br> ♠️ Autocomplete: Quickly finish a solved game<br> ♥️ Boosters: Not sure what your next move should be? Use the ‘hint’ booster to make things easier. Regret your last move? No problem. Use the ‘Undo’ booster to take it back<br> ♦️ Stunning animations and sounds plus, a neat and responsive design with haptic feedback!<br> ♣️ New player friendly: Use our tutorial for beginners and you’ll be completing levels in no time!<br><br>So, sit back, unwind, and play Solitare Daily Break- the most engrossing solitare card game online and even offline!","https://play-lh.googleusercontent.com/8SirJAth6mbM1XgznFoydIzVYPx91H6m4Edk3Xw_cHNluCv56CVt8AWXnt0M4cskGVM","GAME_CARD"
