Game Name,Package Name,Description,Icon URL,Category
"Idle Office Tycoon- Money game","com.warrior.officebuilding.gp","Welcome to Idle Office Tycoon - an idle game for those who love to manage their own office buildings! A life from a poor young man to a wealthy successful business man, can you do it?<br><br>-Idle and clicker gameplay. Easy and relaxing!<br>-Real business management simulation with stragety needed!<br>-Choose your partners, your car, your house! Customize your lifestyle! Rich life simulation.<br>-Introduce various companies to your building. Start the story and chapters here!<br>-Upgrade facilities and decorations. Train your employees. Be the REAL tycoon!<br><br>For your world famous property tycoon dream, it&#39;s now time to try! With your business and marketing talents, you will be the one to conquer!","https://play-lh.googleusercontent.com/tpfTgY0b6CTIl7hvVjqL2xQw6kUiZh8t48I9j5ZzR0AwuqDlqgac2jtcDhc8SmCY7A","GAME_SIMULATION"
"Eatventure","com.hwqgrhhjfd.idlefastfood","Are you looking to become a restaurant millionaire? Want to manage a successful restaurant? Become a restaurant tycoon, earn money, level up, hire cooks &amp; cashiers, get rich and build the biggest business the world has ever seen in this Restaurant Simulator!<br><br>Start with a Lemonade Stand, then progress to a food truck, and then a cafe. In no time you will find yourself owning your own Diner and Drive-thru!<br><br>Expand your restaurants, automate your business and find the right strategy in order to maximise your income! Eatventure is a money game where you simulate the management of different kinds of restaurants. Use your income to buy new stations in order to start selling more kinds of foods! Become the biggest Restaurant Millionaire in the world!<br><br>Find our Terms of Service here: https://lessmore.games/games/terms-of-service/","https://play-lh.googleusercontent.com/iQkccRgYNjF0xdVFioJo0SabtPKO0nSZrP7p8zCLGYpUypROC-Boo9GN3GaHddhudkO7","GAME_SIMULATION"
"Openworld Indian Driving Game","com.openworld.indiandriving.bikes","Cellphone cheat codes:<br>Ambulance : 100<br>Cervo : 4444<br>Hummer : 3000<br>Jeep : 4000<br>Limusine : 5000<br>Police Car : 6000<br>Police Jeep : 911<br>Pregunta : 912<br>Sky Ray : 700<br>Steel Snake : 900<br>Taxi : 1100<br>Universal : 8733<br>ZBird : 5666<br>SimpleCar : 1400<br>Ferrari : 1500<br>Skull : 0200<br>Steam : 6600<br>Motocrosser : 0000<br>RateSpace : 3000<br>ShadowFighter : 9999<br>Monster : 0<br>Mister Small : 888<br>Tesla : 333<br>NimbusOver9K : 444<br>Tank : 4040<br>Helicopter : 8000<br>Bicycle : 1111<br><br>An openworld indian bikes driving action-adventure game where the player can explore a large, open environment and perform various actions including indian bike driving refers to the act of riding motorcycles or bikes. Indian Car Bike driving encompasses the unique driving experiences, Experience the thrill of being a kingpin as you drive like a gangster in the Indian Car Bike driving Simulator. Rule the road and dominate like a king in this immersive virtual experience. <br><br>The Indian driving openworld game offers players the opportunity to navigate through a vast and diverse virtual landscape, experiencing a wide range of vehicles and challenges while immersing themselves in the rich and dynamic world of Indian traffic and road conditions. In the Indian driving openworld game, players can explore a sprawling virtual world that authentically simulates the unique challenges and environments. Indian Bike driving 3D Missions is a concept that combines motorcycle riding with a 3D gaming environment, offering players the opportunity to engage in virtual missions and challenges.<br><br>Open World Bike driving 3D refers to a type of video game or simulator that offers 3D environment in which players can freely explore and ride motorcycles within an expansive and open world setting. In such games, players typically have the freedom to navigate the virtual world, engage in various activities, and experience realistic motorcycle driving in a dynamic and open gaming environment.","https://play-lh.googleusercontent.com/64U3DJWmEyfFXPq8g5ncpw5Oah2orIFHKXVpO5dUQHmjvsXcDfKv8K1dYp-qa2Qn8iCu","GAME_SIMULATION"
"Woodturning","com.BallGames.Woodturning","The best woodturning simulator.<br>Complete customer orders.<br>Turn a piece of wood into the given shape.<br>Cut (carve), polish, paint and add a stencil to your work.<br>Earn money and improve your room.","https://play-lh.googleusercontent.com/VOnvC7mOCnAzYrxDVIxGhpiwV3w8vgMJnKUJCuAivPxIhEO60DHD-sDF0oWztT53Wg","GAME_SIMULATION"
"Craftsman: Building Craft","com.craftsman.go","You are a craftsman, your task is to design houses, castles and build them.<br>You can do it alone or with your friends&#39; help.<br>Please experience our game:<br>- Stunning graphics and realistic sound.<br>- Simple, easy to play.<br>- Many game modes.<br>- Very much like the real world.<br>- A lot of interesting things","https://play-lh.googleusercontent.com/DV_l8PpGwYovkN6AyrSCxBkWQlplVjGiT3740pxs5mLruAGRrIVaTgYXyVlE__tn3cs","GAME_SIMULATION"
"DIY Paper Doll","com.cclaw.diypaperdoll","DIY Paper Doll is a sweet doll maker, dress-up, fashion game based on the classic paper arts and crafts and sticker games that we all love and remember. In this adorable teen game, you get to be the doll designer of your own yoyo doll life! In DIY Paper Doll, customize your dolls by choosing from the wide variety of clothing options, accessories, hair styles, and makeup looks. Dress up doll characters to interact with and enter unique stories and plots. This doll makeover challenge allows you to craft your own custom magic princess yoyo doll. So many cute outfits to choose from like tie dye dresses &amp; doll designer brands, shoes, &amp; makeup. Be a paper princess maker and craft your very own doll makeover. Design the perfect dreamhouse for your dolly.<br><br>DIY Paper Doll lets you become a queen of fashion and dress up your custom magic princess chibi dolls. Unleash your imagination and become an expert sweet doll maker. Upgrade your creative skills in this doll makeover teen game! My style selection, my story. <br><br>&gt; Customize your sweet doll with 1000+ items <br>&gt; Unlock fashion collections so your doll’s style stays on trend<br>&gt; Personalize your doll’s outfit, skin tone, eye color, hairstyle, &amp; makeup <br>&gt; Create diary entries with photos of your dolls in different environments and outfits<br>&gt; And so much more!<br><br>Make a perfect dreamhouse for your paper princess, in one of the adorable dress up doll games. Become a doll designer and create stunning outfits for your sweet paper princess. Dress up your lovable dolly in the latest fashion trends and create unforgettable looks. Let the makeover fun begin!<br><br>To opt out of CrazyLabs sales of personal information as a California resident, please visit our Privacy Policy: https://www.crazylabs.com/apps-privacy-policy/","https://play-lh.googleusercontent.com/So39RYw6D-Zh5uUawzaxhu0o6nwWZreHetAmRyGstTBnG1BpIDX9qKF8KfXk77mjKp-O","GAME_SIMULATION"
"Makeup Stylist: Makeup Game","diy.makeup.master.artist.stylist","Looking for an enjoyable and immersive makeup game experience for girls? Look no further than Makeup Stylist! 💄👩🎨 As a makeup artist in this game, you&#39;ll have the opportunity to assist various girls with their makeup and styling needs while improving your own skills and working towards becoming the ultimate fashion designer. 💅🎀<br><br>Why not become a DIY makeup stylist in our make up salon in beauty makeup games &amp; fashion games? Enjoy the girl games.<br><br>With your creativity and personal style, you can create a perfect makeover as a DIY makeup stylist at the make up salon in the girl games. Choose your favorite color combinations in beauty makeup games &amp; fashion games.<br><br>There are countless makeover designs to explore for a DIY makeup stylist in the make up salon. Stay up-to-date with the latest trends and use them as inspiration for your own unique beauty makeup games &amp; fashion games to get a makeover.<br>Cute and fun fashion beauty makeup games &amp; fashion games, perfect for girls who want to be a DIY makeup stylist. Create a unique makeover for girls at our make up salon in the girl games! <br><br>Beauty makeup games &amp; fashion games are divided into three parts: skincare, make-up, and dress up. The girl games gameplay is diverse and enjoyable. Essential and entertaining beauty makeup games &amp; fashion games for girls who want to be a DIY makeup stylist.<br><br>With nearly 100 different makeup kits available, you&#39;ll have endless options for creating unique and stylish looks. Mix and match different combinations of makeup and accessories in our beauty games to create over a thousand different styles, and let your creativity run wild!<br><br>Beauty makeup games &amp; fashion games Key Features:<br>Enjoy an ASMR makeover experience in the make up salon that will help you create the perfect makeover in the girl games!<br>Choose from a diverse group of male and female characters and backgrounds, ready to be a DIY makeup stylist!<br>Get inspired by a wide range of creative ideas and styles at the make up salon in the girl games.<br><br>Whether you&#39;re a fan of makeup games for girls, makeover games, or salon games, Makeup Stylist is the perfect choice. With realistic ASMR makeup effects, mix-and-match makeover games features, and a diverse cast of characters and stories, this game is sure to keep you entertained for hours on end. So why wait? <br><br>Download and enjoy the girl games with your friends! Get a complete makeover and a DIY makeup stylist in the make up salon now!","https://play-lh.googleusercontent.com/Lhx88Dyl8ZiNcVekGON3A5gyI86OhgW3SfHq6qSdb4ZyHKuiCioHu2jgoum2Fr3tyLY","GAME_SIMULATION"
"Falling Art Ragdoll Simulator","com.falling.art.ragdoll.simulator","The harder they fall, the more points they get! This is the motto of our game. <br>Jump in and enjoy the beauty of falling art! Because let’s be honest - there is nothing more satisfying than watching someone hurt themselves in the most dumb and ridiculous way. Especially when that someone is a 3d model with ragdoll physics and you don’t need to feel sorry for it at all!<br> <br>Discover new characters and crazy locations. Find new ways to break ragdoll bones in the most spectacular manner. Discover your hidden inner sadist and don’t let it out in the outside world! Just enjoy our crazy game, have fun, and stay safe!","https://play-lh.googleusercontent.com/8Qp_47Y_N1a0Z0ljOeWrkqnaahkj1cWzJ51OHEEgMyxctR_CX0VrKF4RnnlSzZAL3MA","GAME_SIMULATION"
"Drop Fit: World Flag Puzzle","com.inwave.drop.fit.flag.puzzle","Embark on a thrilling colorful journey around the globe with our addicted ASMR puzzle game, Drop Fit: World Flag Puzzle, the ultimate game for national flag and geography enthusiasts!<br><br>This is the hyper-casual game tailor-made for you where you are challenged to become the ultimate flag puzzle master. Test your knowledge and memory of different flags. Test your cognitive skills and spatial reasoning as you train your brain to solve the ASMR flag puzzles!<br><br>HOW TO PLAY:<br>- Tap to assemble blocks together<br>- Arrange each block in the correct order to complete the flag<br>- Enjoy your result<br><br>FEATURES:<br>- Very relaxing gameplay and good for killing time<br>- Easy to understand and play<br>- One finger control<br>- Countless national flags of all countries to discover<br><br>Are you ready to solve puzzles, test your brain, and master this game? Download DROP FIT: WORLD FLAG PUZZLE, take on the challenge today, and see if you have what it takes to become the ultimate flag puzzle master!","https://play-lh.googleusercontent.com/xNF3ustEPpcPWoxAPB0jDayD-jyWLd0NX1HIYnvrYWJ0Sh0i_-yVNefnVShb1eFnXQ","GAME_SIMULATION"
"Episode - Choose Your Story","com.episodeinteractive.android.catalog","Episode lets you LIVE your stories with love, romance, adventure, and drama. Wouldn’t it be amazing if YOU were a character in your favorite story? Episode lets you do just that with over 150,000 gripping stories, where you make choices that matter.<br> <br>With billions of reads and 150,000+ stories, Episode is an immense collection of interactive stories where YOU choose your destiny. Or become a creator and write your own!<br> <br>How does it work?<br>Customize your avatar and design your outfit<br>Develop relationships with your favorite characters - will they be rivals or Romeos?<br>Change fate through your choices<br>Discover all of the different endings<br>Immerse yourself in thousands of diverse worlds, the options are endless!<br> <br>Find your favorite Book Club, join in on a reading challenge with your book club members, and earn rewards!<br><br>Not only can you read your favorite stories, you can also write your own! Write and publish your very own interactive stories on Episode’s platform, amassing millions of reads yourself.<br> <br>Some of our favorites reads:<br> <br>DON’T HATE THE PLAYER: You&#39;re looking for love in a house full of singles! The catch? Not all of them are here for the right reasons. Will you fall for the person of your dreams or walk away getting played?<br> <br>THE SOULMATE GAME: Experts have found your perfect match! Find him and you’ll go home with $1 million AND a husband. The catch? You won’t get to know whether he’s THE one until you’re both at the altar.<br> <br>BOYFRIEND FOR RENT: What’s worse than receiving an invitation to your ex&#39;s wedding? Showing up dateless! Thank goodness, your best friend is here to save you! Can you resist his charm while fake-dating?<br> <br>BEAUTY AND THE MAFIA: The most feared mafia boss in town wants to marry YOU! Unfortunately, you&#39;re caught somewhere between craving and hating him. Will you give in to temptation and dare to believe love is possible?<br><br>THE BILLIONAIRE BACHELORS: You&#39;re a contestant on a new reality show starring 7 broke girls and 7 billionaires. Will you find love, or take the money and run?<br><br>PLUS… more new stories EVERY WEEK!<br><br>PRETTY LITTLE LIARS and all related characters and elements © &amp; ™ Warner Bros. Entertainment Inc. <br><br>Please note that Episode is free to play, but you are able to purchase game items with real money. If you want to limit the ability to make in-app purchases, you may create a PIN in the Settings menu from within the Google Play Store.<br><br>Your use of this application is governed by the Terms of Service available at http://pocketgems.com/episode-terms-of-service/. Collection and use of your data are subject to the Privacy Policy available at http://pocketgems.com/episode-privacy-policy/.","https://play-lh.googleusercontent.com/TGApzPMHvVrsHwnxtuTi4ylzmdZVQD78dCmnSw5_Eqd44xRZ_-SWMmSC5Gh-tBpy45w","GAME_SIMULATION"
"Train Miner: Idle Railway Game","games.flexus.trainminer","The ultimate idle adventure awaits! Embark on a unique journey where you&#39;ll master the art of resource management, strategy, and creativity. In this captivating idle game, you&#39;re in charge of constructing a dynamic train empire. Start by chopping down trees to clear land and gather essential materials. Then, dive into the heart of engineering as you build and customize your very own train from scratch.<br><br>As you progress, merge various railway carriages to enhance your train&#39;s capabilities and aesthetics. Expand your empire by laying intricate railway tracks across diverse landscapes, connecting distant lands, and unlocking new possibilities. Collect a wide range of resources along your journey, each playing a crucial role in growing and upgrading your train empire.<br><br>Train Miner offers a seamless blend of simplicity and depth, perfect for casual gamers and strategy enthusiasts alike. With its intuitive gameplay, you&#39;ll find yourself effortlessly immersed in the world of trains, resources, and endless exploration.<br><br>Game Features:<br><br>- Dynamic Train Building: Customize and build your train from a variety of parts and designs<br>- Resource Management: Strategically gather and utilize resources to expand your train empire<br>- Carriage Merging: Merge different railway carriages to improve functionality and aesthetics<br>- Expansive Railways: Design and lay out tracks across varied landscapes, creating a vast network<br>- Continuous Progression: Your empire grows continuously, offering a satisfying idle gaming experience<br>- Varied Challenges: Encounter different challenges and missions as you expand your reach<br>- Engaging Graphics: Enjoy a visually rich game with detailed trains and environments<br>- Accessible to All: Designed for both casual play and deeper strategic gaming<br><br>So, hop aboard and let your train adventure begin!","https://play-lh.googleusercontent.com/lFTCfdMctnZWW6bxsiRWoSBmCtCzuAnB2H_sAqBBbrWek3PFzPnppCC62D_B-V-RYYmC","GAME_SIMULATION"
"Blushed - Romance Choices","com.sonidorico.blushed","Blushed introduces a new dimension to interactive romance games, seamlessly integrating advanced AI with imaginative human storytelling. Here, your choices don&#39;t just influence the story; they create it.<br><br>Dive into a world where AI and talented writers collaborate to offer a variety of engaging and responsive storylines. Your decisions matter, leading the narrative in unexpected directions. Complemented by AI-generated visuals, each romantic journey is both visually striking and emotionally captivating.<br><br>KEY FEATURES OF BLUSHED<br><br>🌟 AI-Enhanced Stories: Explore stories that adapt and evolve based on your decisions.<br>🎨 Eye-Catching AI-Generated Art: Immerse yourself in stories with beautiful, expressive artwork.<br>🌐 User-Friendly UI/UX: Enjoy an intuitive interface, making your exploration of romantic narratives effortless.<br>🔥 Diverse Romantic Genres: Discover your favorite romance, from sweet first loves to intricate, heartfelt connections.<br>👗 Personal Style Customization: Dress your avatar in outfits that reflect your unique taste.<br>❤️ Build Your Ideal Partner: Shape your dream companion with our AI and embark on romantic adventures.<br>💬 Impactful Choices: Every choice you make shapes a unique path and conclusion to your story.<br><br>HIGHLIGHTED STORIES<br><br>🏎️ Racing Hearts: A romance unfolds between a dedicated lawyer and a charismatic man from a contrasting background.<br>🌟 Wish Upon a Star: Enter the world of K-pop, where working as an assistant to a superstar leads to unexpected romantic developments.<br>🔫 Bound by Rivalry: Feel the intrigue of a unique romance between leaders of rival organizations.<br><br>Join Blushed and step into a world where your decisions shape your love story, blending AI innovation with heartfelt narratives. Download now and be the author of your own romantic adventure!","https://play-lh.googleusercontent.com/bSkk7IwPoWHf9LwoXK9wmmyghOkl_pGTeIsmgdbvKN1C6_c-KpgSE7mt4PtLwTvdOqm_","GAME_SIMULATION"
"2 3 4 Player Mini Games","com.ction.playergames","Duel your friends in a variety of 4 player minigames using simple one touch controls! Play simultaneously on the same device for multiplayer action on the road, wherever you are.<br>You can play with two players but if you have more friends or family around you can battle it out with three or four players.<br>You can also play the 4 Player Cup to determine who is the best!<br>=====================<br>30 MINIGAMES TO PLAY<br>=====================<br>Snake Arena<br>Grow your snake by eating stars, but be careful, make sure your head doesn&#39;t touch an opponent&#39;s body.<br>Try to corner your opponent and be the last one standing in the arena!<br><br>Skateboard Racing<br>Tap as fast as you can to reach the finishline.<br><br>Tank Battle<br>Duel each other on the battlefield. Who’s the best shooter? <br><br>Grab the Fish<br>Test your timing skills and be the first to grab 3 goldfish!<br><br>Soccer Challenge<br>Who has the soccer skills to score a goal in one touch soccer?<br><br>Sumo Wrestling<br>Fight your opponent in the sumo wrestling arena. Don’t get pushed over the line! <br><br>Chicken Run<br>Avoid falling off the platforms by using gravity.<br><br>Rally Drifters<br>Be the quickest driver on the sandy tracks to complete 3 laps.<br><br>Micro Speed  Racers<br>Avoid  obstacles in this formula racing game and go around the corners as fast as you can!<br><br>Feed the Pigeon<br>Use your slingshot to shoot bread crumbs into the pigeon&#39;s mouth.<br><br>=======<br>Features<br>=======<br>• Simple one touch, one button controls<br>• 4-players can play using the same device<br>• 20 different games<br>• Challenge your friends and family <br>• 4 player Cup<br><br>Thank you for playing!<br><br>Credits:<br>Sumo stage music by Jobro &quot;Taiko drums&quot;","https://play-lh.googleusercontent.com/vHuenuu1GqX1BwDaYX86dsbQlmA7vCO0PEdgdXlCEZP5x2_R3pZo0xcI9Mkdn4UW7NA","GAME_SIMULATION"
"Vape 'N Pod Trick Simulator","com.htt.vape.simulator.tn","Have a go with real-life simulation experience of Gun Sound, Virtual Vape and Funny Electric Swatter - The ultimate app that simulates the real motions and sounds of all.<br><br>Are you the real fan of amazing vape trick compilation online? You love smoking and create stunning trick with vape but you don&#39;t have one, or worry that it would affect your health? This vape simulator application is surely well-made for you!<br><br>Are you a guns lover? Have you ever heard of virtual gun sounds? This is a simulator app that reproduces the same feelings of firing a weapon without endangering the surrounding people. Unlock a variety of real guns, pistols, tazer, bombs, and customized weapons in the world.<br><br>Beside Guns and Vapes, Electric Swatter is also a fun simulation you can play with your friends and family. Zap all the bugs with Simulation Electric Fly Swatter feature, customize your own racket. Let&#39;s zap all your boredom away with this amazing Electric Swatter Simulation feature.<br><br>Why would you have to download 3 different apps to use all 3 features, while you only need to download one app only?<br><br>Our app offers you:<br>- All Simulator are incredibly smooth, responsive, and simple to use and play with<br>- No wifi required, skins and features updated monthly.<br><br>Let&#39;s hang out having fun with the one and only Vape &#39;N Pod Trick Simulator","https://play-lh.googleusercontent.com/_ny2pkVYK51dm5dfcQxQHUNk0nOfTxl4TN6tlExqiKFH3YvALZqLPjiCuU6KI_JNi74","GAME_SIMULATION"
