Game Name,Package Name,Description,Icon URL,Category
"Slow Mo Run","com.paurau.SlowMoRun","Fun running game where you drag the character to advance through obstacles<br><br>Run and drag the limbs to hit, kick and punch the enemies in this unique fast paced runner. Draw your custom fighting pose to attack, dodge bullets, shoot guns and engage in variety of fighting combat. This game features many fighting styles such as boxing, karate, judo, kung fu, jiu jitsu, spider fighting and much more. Channel your inner ninja and fight people in variety of ways such as one-on-one combats, running duels, parkour challenges, and even epic boss fights. The game mechanics allow you to choose your own fighting style and pose, giving you full control over your character&#39;s moves and attacks. In addition, this game features cool parkour levels as well as an engaging story.","https://play-lh.googleusercontent.com/hKz_JLWF9r6A2WOa5OsDZ-q2eVdZda7qIfw4sKkSPWinTueeOOT7oZ7O_PynTwGxz3Sm","GAME_CASUAL"
"My Talking Angela","com.outfit7.mytalkingangelafree","Talking Angela is the super fun virtual star who can’t wait to dance and sing her way to the top.<br><br>Players help her stay happy and busy with day-to-day activities in her 3D world:<br>- Stylish makeup looks<br>- Wonderful wardrobe choices<br>- Super sweet activities<br>- Special sticker albums<br><br>She’s interactive. She’s customizable. She’s fun. And she’s always ready to make new friends.<br><br>From the creators of My Talking Tom, My Talking Tom 2 and My Talking Tom Friends comes the pet who’s a star in the making.<br><br>This app contains:<br>- Promotion of Outfit7&#39;s products and advertising;<br>- Links that direct customers to Outfit7’s websites and other apps;<br>- Personalization of content to encourage users to play the app again;<br>- YouTube integration to allow users to watch videos of Outfit7&#39;s animated characters;<br>- The option to make in-app purchases;<br>- Subscriptions which automatically renew at the end of a subscription period unless cancelled. You can manage and cancel your subscription any time via Settings in your Google Play account;<br>- Items to purchase (available in different prices) using virtual currency, depending on the player’s progress;<br>- Alternative options to access all functionalities of the app without making any in-app purchases using real money.<br><br><br>Terms of use: https://talkingtomandfriends.com/eula/en/<br>EEA privacy policy: https://talkingtomandfriends.com/eea/en/<br>US privacy policy: https://talkingtomandfriends.com/privacy/en/<br>Brazil privacy policy: https://talkingtomandfriends.com/privacy-brazil/en/<br>Rest of the world privacy policy: https://talkingtomandfriends.com/privacy/en/<br>Customer support: support@outfit7.com","https://play-lh.googleusercontent.com/qSWmjTnbgza5nOV9RzHkaT2yzKuEUpVZx2_PxJH91OQXMO3uvyntKc024848BEZHTIM","GAME_CASUAL"
"Traffic Cop 3D","com.sunsetgames.copcarscan","In the seedy underworld of the city, one dedicated police officer stands alone against the dangers of traffic and crime ahead. This town&#39;s only hero is here to protect it. Patrol the streets at night, keeping a close eye on the cars around you as a vigilant patrol officer.<br><br>Think you&#39;ve spotted a criminal? Then it&#39;s time to scan their license plate and put your instincts to the test. Don&#39;t let the crooks speed away and try to escape onto the highway! Switch on your police siren, initiate a high-speed chase, and pull them over before it&#39;s too late.<br><br>Justice is waiting for you in Traffic Cop 3D, the ultimate police simulator game. Be the best cop in town as you take on the challenge of capturing criminals on the road, fighting road rage, and mastering the art of the pullover.<br><br>Traffic Cop 3D Features:<br>* Pursuit drivers in thrilling police chases<br>* Cruise through the streets and tackle escape challenges<br>* Drive your police car with precision in traffic simulator games<br>* Experience the speed and intensity of police games<br>* Become the ultimate patrol officer and uphold the law in this police simulator<br>* Confront crime and road rage in action-packed traffic run scenarios<br>* Chase down escaping criminals in high-speed police pursuits<br>* Utilize your police siren in the heat of the chase as a dedicated police officer.<br><br>Subscribe to Traffic Cop 3D for all of the following benefits:<br><br>* Helicopter Minigame<br>* Police Dog Companion<br>* No Ads<br>* x2 Earnings<br> <br>SUBSCRIPTIONS INFORMATION:<br> <br>Traffic Cop 3D VIP Membership access offers two membership options:<br><br>1) A weekly subscription costing $5.49 per week after a 3 day FREE trial period.<br><br>2) A monthly subscription costing $14.49 per month.<br><br>After buying this subscription, you will unlock; x2 earnings for your in-game currency, obtain an exclusive police dog companion to join you, and an exclusive helicopter police chase mini game to play, and receive no ads, which removes non-optional ads from the game.<br>This is an auto-renewable subscription. The payment is charged to your account after confirmation. The subscription is renewed unless you unsubscribe 24 hours before the period ends. Your account will also be charged for renewal<br>The price notes are for United States customers. Pricing in other countries may change and actual charges may be converted to local currency.<br>End of trial and subscription renewal:<br>- The payment is charged to your iTunes account after a confirmation of purchase<br>- The subscription is renewed unless you unsubscribe 24 hours before the end of the current period<br>- The account will be charged for renewal 24 hours before the end of the current period at the standard cost of the weekly subscription<br>- The user may manage the subscription and auto-renewal by accessing the user&#39;s account settings after purchase in the store<br>- No cancellation of the current subscription is permitted during the active subscription period<br>- Any unused portion of the free trial period will be forfeited when the subscription is purchased<br>Cancelling a trial or subscription:<br>- In order to cancel a subscription during the free trial period you need to cancel it through your account in the Store. This must be done at least 24 hours before the end of the free trial period to avoid being charged.<br><br>http://privacy.servers.kwalee.com/privacy/TrafficCopEULA.html","https://play-lh.googleusercontent.com/8Pt7dLy6dzmu8nSZfHt9BiEAte5xEaCguItBMQwoACo04IswmAUtdkrwW2eDePWL_Gc","GAME_CASUAL"
"Gym Idle Clicker: Fitness Hero","com.uc.gym.clicker","Get ready to join the funniest idle clicker games. Muscle up virtually in Gym Idle Clicker: Fitness Hero!!!<br><br>HOW TO PLAY<br>- Tap to train your muscles continuously<br>- Fight against other gymers to gain experience and build up your body<br><br>GAME FEATURE<br>- Multiple modes are available<br>- New features updated monthly<br>- Captivating 3D art style<br><br>Get ready to embark on the workout adventure. DOWNLOAD FOR FREE NOW!","https://play-lh.googleusercontent.com/KkRjKYmtzoz4xgG-Qab0h85E50duAMzQNFTU5OemimReDyNzGyzBO218xNmkAPAehYc","GAME_CASUAL"
"Monster Survivors","games.rivvy.monstersurvivors","Embark on an Epic Survival Adventure! <br><br>In a world overrun by monstrous creatures, only the bravest can survive. &quot;Monster Survivors: Last Stand&quot; is a thrilling action-packed game that challenges you to outlive the hordes of terrifying monsters. With its unique blend of strategy and fast-paced combat, this game puts your survival skills to the ultimate test. <br><br>Game Features: <br><br>- Dynamic Gameplay: Every session presents new challenges and opportunities. Adapt your strategy to survive in an ever-changing environment filled with surprises. <br>- Epic Boss Fights: Face off against colossal bosses that will test your wit, agility, and strength. Victory rewards you with rare loot and advancements for your characters. <br>- Character Progression: Choose your survivors wisely. Each character comes with unique abilities and skills. Level up your survivors to unlock their full potential. <br>- Stunning Graphics and Sound: Immerse yourself in beautifully crafted environments and intense battle sounds. Experience the apocalypse like never before. <br><br>Survival is just the beginning. Are you ready to lead your team to victory and reclaim the world from the monstrous horde? <br><br>Download &quot;Monster Survivors: Last Stand&quot; now and carve your path to glory. <br>Dare to survive? Your adventure begins now!","https://play-lh.googleusercontent.com/qJYnIUTqLD6DlHURn7JP0KrY04MbDdU9h_i-yUObAjmlMAe7hCc-XmxSmc45LW_aFw","GAME_CASUAL"
"Jelly Run 2048","com.goolny.Split2048","Jelly Run 2048 is a very addictive cube runner casual game in the style of the puzzle game 2048 but with great new gameplay – merge cubes with numbers x2, gain 2048 or even more! Try to make it to the end, connecting and splitting into different cubes!<br><br>Jelly Run 2048 puzzle merge cube game has very simple controls, and all you should do is become the best by swiping swipe left or right, connecting and disconnecting cubes in this merge 2048 cube puzzle game!<br><br>Dodge different obstacles, split in half on time, or merge cubes into one to reach the finish line with 2048 number or more – all in the style of your favorite puzzle merge cube game 2048 with absolutely charming graphics and funny animation!<br><br>So, what are you waiting for? Download the Jelly Run 2048 and enjoy cube runner game!<br><br>=====================<br><strong>COMPANY COMMUNITY:</strong> <br>=====================<br>Facebook: https://www.facebook.com/AzurGamesOfficial<br>Instagram: https://www.instagram.com/azur_games<br>YouTube: https://www.youtube.com/AzurInteractiveGames","https://play-lh.googleusercontent.com/VxTYH6GiYoMygBPIm_5EzALObBs1Y1E-HXd9XQmV23D1cUwO_TirGxBvWuGBB9-RDis","GAME_CASUAL"
"Tall Man Run","com.VectorUpGames.TallManRun","Get as tall and wide as you can to take out bots and beat the level!","https://play-lh.googleusercontent.com/ZiZ3qVOZbAnpeiL5kFIcHfdyh96X0QiuxO72FSfv40z6umCkPBAvtrwgrTcq3DoXXg","GAME_CASUAL"
"Hunt & Seek","com.kwalee.transformhunt","Get ready for the epic hide &amp; seek battle with a chilling twist — pennywise, the killer clown and other monsters are coming for you! It&#39;s not just hiding; it&#39;s a survival adventure. <br><br>Disguise yourself from evil as you become a prop and hide where the monsters can&#39;t find you. Will you turn into a plant or a book? Maybe a table lamp?<br><br>Become a hunter and seek out those disguised as props. Keep a keen eye to hunt them all down and survive the creepy hide &amp; seek game.<br><br>Hunt &amp; Seek Features:<br>* Experience the thrill of hiding<br>* Object hunt in scary games with vs hunter mode<br>* Play hide &amp; seek with Freddy and other monsters<br>* Challenge yourself in hide and seek adventure<br>* Run, hide, and escape room style hunting<br>* Discover the ultimate hideout and seek in various modes<br><br>Are you ready for the ultimate hide &amp; seek adventure against monsters and the notorious pennywise? Run, hide, and seek in this chilling battle!","https://play-lh.googleusercontent.com/3zhbfUySGMMK1xp8kmkErU-l_Je0gJ5ghYSPF-dWjPKdrpNrCIDFxLMPbtw-06j-cQ","GAME_CASUAL"
"Coin Cars - Restore Customs","com.cmgames.CoinCars","Experience the most relaxing and fun game with your Facebook friends and use your skills to renovate old cars!<br><br>- Every time you start the game, it&#39;s a win!<br>Through a variety of gameplay, you can obtain various lucky fortunes, which may include large amounts of gold coins, shields, bonus gameplay, attack or raid gameplay. You can embark on a journey to restore your car and bring it back to life. Victory Shield protects your car from damage. Start the game to get more lucky fortune and unlock more vehicles!<br><br>- Attack or raid for more wealth!<br>Attack cars or raid garages, all methods help get more coins! Prosperity! Become an Avenger, crash the car hard and take back everything that belongs to you! Attack with all your strength! Search for treasure in a huge garage, it&#39;s hard to tell where the legendary treasure will appear!<br><br>-Various classic cars are waiting for you!<br>Keep your car spotless<br>Repair damaged car parts<br>Give them a fresh coat of paint<br>Replace parts to keep them looking like new<br>Check your car&#39;s performance<br><br>There’s more to come in future updates! More gameplay and more fun, advanced vehicles to play with!<br>Coin Cars is free on all devices with in-app purchases.","https://play-lh.googleusercontent.com/fypbYvC2Qhnwx1jFhw9qFcmUOt4h95fbN-hCZZUqkls4iqyNgsfr3BA-qL0qaSH82w","GAME_CASUAL"
"Perfect Lie","com.funcell.perfectlie","How good a Liar are you ?<br>Can you fool your Mom ? <br>Can you Lie to your Dad ? <br>Can you Lie to your Teachers ?<br>Can you Lie to Everyone ?<br>Can you be the Number 1 Liar in the World ! <br>Let’s find out if they find out your lie !","https://play-lh.googleusercontent.com/WQx6pExDL4xarECAMnyM_OxPHJo9AcJKmoB0fSrYF-xQEcsKFpYodbzvgklbCW8WHb4w","GAME_CASUAL"
"Yoga Workout","com.yogaworkout.flexrun3d","Let’s have some fun with Yoga Workout - Running 3D game now! 👐👐👐<br> <br>Yoga Workout - Running 3D game is an addictive running 3D game with different challenging levels that will blow your mind. 🤯🤯🤯<br><br>This game will increase your flexibility by using yoga stimulation to move your characters’ body to correct yoga positions. If you are a fan of Yoga Workout or 3D running game, do not hesitate to try Yoga Workout - Running 3D game. Let’s test how flexible you are!! 😉<br><br>Let Yoga Workout challenge you with variety of Yoga positions. You need to find out what to do to avoid upcoming obstacles and collect as much money as possible! Finding the balance is the key to solve the problem here! 💪💪💪<br><br>GAME FEATURES<br>🌟 Addictive gameplay as it gets more challenging each levels.<br>🌟 100+ various levels with beautiful graphics.<br>🌟 Boost your money after bonus levels.<br>🌟 Great experience for your hands.<br>🌟 Unexpected Yoga positions.<br>🌟 Music and sound effects.<br>🌟 Phone and tablet friendly.<br>🌟 Totally free to download and free to play. <br><br>❤️️ Each level is a challenge to test your flexibility and your patience. ❤️️😉<br>🙏 Namaste 🙏  Have fun and enjoy the game 😉","https://play-lh.googleusercontent.com/bOKdoZADhmCK09X7kbzxXxICFFRMlSZZA9iyVyqDFKlIkWh30_40mwsDpabGKVfBNaQ","GAME_CASUAL"
"Watermelon Merge：Strategy Game","com.melonmergestrategy.game","Watermelon Merge: Strategy Game is a cute and fun watermelon merging game where players combine two of the same fruits to create a larger fruit, until finally merging into a complete large watermelon. Not only do we offer classic gameplay, but we also have innovative modes for everyone to choose from. In the game, players earn points by merging fruits. The more consecutive merges, the higher the score. The game ends when the number of fruits on the field exceeds the limit. Additionally, we have a scoring system that ranks players globally, challenging them to achieve higher scores and stimulating their competitive desires, adding to the game&#39;s fun and challenge. Overall, this game is not only simple and fun but also allows players to exercise their thinking abilities while relaxing, making it well worth trying.<br><br>🍉 Classic Gameplay: The most classic endless mode, where players drop and place fruits to merge two identical fruits to earn points. The more consecutive merges, the higher the score. Players can continue dropping fruits until they exceed the limit. The highest scores are recorded on the leaderboard, engaging players in fierce competition worldwide.<br><br>🍍 Innovative Mode: Compared to the classic mode, our unique challenge mode - Weather Challenge, triggers four different weather effects during fruit merging. <br>❄️ Snowy weather brings snowflakes that occupy space of other fruits.<br>🧊 Hail weather freezes some fruits, temporarily preventing them from merging.<br>🌩 Thunderstorms shake the fruits.<br>☀️ Sunny weather is the best, as the ice and snow melt, and the frozen fruits thaw.<br>Overall, this new gameplay provides a richer gaming experience and enhances the game&#39;s fun. Come and try it!<br><br>🍈 Cute Skins:<br>We also offer a variety of skins to choose from, with many cute fruit patterns for everyone to use. We also periodically release holiday-limited skins. Our fruits are working hard to become even cuter, hoping to be liked by everyone.","https://play-lh.googleusercontent.com/FtwqGGLxpM-XZV7eDSmIDnQ9l9UfmbAlxC2DxmYdT8JQ_4faKEdgPkX7EqF9qUNKaTI","GAME_CASUAL"
"Homescapes","com.playrix.homescapes","Welcome to Homescapes, a truly heartwarming game from Playrix&#39;s Scapes™ series! Solve match-3 puzzles to restore a wonderful mansion on a verdant street. Exciting adventures start at the doorstep!<br><br>Beat colorful match-3 levels to renovate and decorate rooms in the mansion, unlocking ever more chapters in the exciting family story along the way! What are you waiting for? Make yourself at home!<br> <br>The game features:<br><br>● Unique gameplay: help Austin renovate the house by swapping and matching pieces!<br>● Interior design: you decide what the house will look like.<br>● Exciting match-3 levels: tons of fun, featuring unique boosters and explosive combinations!<br>● A huge, beautiful mansion: discover all the secrets it holds!<br>● Fantastic characters: watch them live their lives and interact with each other in the in-game social network.<br>● A cute pet: meet а naughty and fluffy cat.<br>● Invite your Facebook friends to help you create your own cozy atmosphere in the house!<br> <br>Give the old mansion a complete makeover! Show off your designer skills by furnishing and decorating the kitchen, hall, orangery, and other house areas, including the garage! Thousands of design options will give you maximum freedom to explore your creativity, change designs any time you want, and eventually create your dream house!<br><br>Homescapes is free to play, though some in-game items can also be purchased for real money. If you don&#39;t want to use this option, simply turn it off in your device&#39;s Restrictions menu.<br> <br>Enjoying Homescapes? Learn more about the game!<br>Facebook: https://www.facebook.com/homescapes/<br>Instagram: https://www.instagram.com/homescapes_mobile/<br> <br>Questions? Contact our Tech Support by sending an email to homescapes@playrix.com or check our Web Support Portal: https://plrx.me/IXKKoAp9sh<br>Privacy Policy: https://playrix.com/en/privacy/index.html<br>Terms of Service: https://playrix.com/en/terms/index.html","https://play-lh.googleusercontent.com/HWVNuIGO3NfdVBCmw_rQGTfINA7pdoedynIZbC8TcoNKvd-aAkzk7XboE0zDZE0_CF8","GAME_CASUAL"
"Minicraft City: Explore World","com.craft.roblock.city.game","Welcome to the ultimate construction simulator, where your imagination knows no bounds! In this immersive game, you become the master build of a vast square world filled with endless possibilities. From design home to construction towering castles and thriving villages, the power to shape your virtual universe lies in your hands. Best of all, it&#39;s completely free to play and you can play it with no wifi.<br><br>Step into a realm where animation comes alive, and every block is a canvas for your creative. As you embark on your construction journey, prepare to encounter a variety of challenges, including square monsters that roam the land. Defend your creations against monsters as you unleash your master build<br><br>Crafting plays a vital role in this simulator square gameplay. Collect resources, precious materials, and utilize them to build magnificent construction, both simple and complex. With each square brick you lay, your city grows, and your helpers assist you in bringing your vision to life.<br><br>But it&#39;s not all about square building. Join the lively party of fellow builders, collaborate on massive projects, and showcase your architectural prowess. Connect with friends online and embark on cooperative quests, or compete in exciting construction competitions to earn rewards and recognition.<br><br>With its intuitive controls and immersive 3D graphics, this game offers a building adventure and endless party. Unleash your creative, shape your destiny, and become the ultimate builder in this simulator. This game will satisfy your free dream, the only limit is your own imagination! Are you ready to build, craft, and conquer?<br><br>Feature:<br>Fun and creative building game: A Lot of construction castle, village is wating for you to find out<br>Simulator your best life: Empower you to live your best life<br>No wifi gameplay: You can play this game offline.<br>Beautiful 3D: Beauty graphic and animation","https://play-lh.googleusercontent.com/hWBb_PWs6rCRjOtkZTiw4J4hgb6JJh9Bsx-EIVbrH-suii412sxo6CtkNOzenvSf7A","GAME_CASUAL"
"Bricks Ball Journey","com.bricksball.journey.gp","Welcome to &quot;Bricks Ball Journey&quot;! Bricks Ball Journey is a globally popular classic brick-breaking game.<br><br>Based on the accumulation of &quot;Bricks Ball Crusher&quot;, we have improved all aspects of the experience and content of &quot;Brick Ball Journey&quot;, hoping that it will bring you more fun. The game inherits more than 300 skill blocks and skill balls from the previous game, and introduces target as the main mode of gameplay. <br><br>We also bring a new &quot;Adventure Mode&quot;, which is the adventure story of Amelia. She meets her partner - Echo, a feline creature from an alien planet that has mysterious powers.<br><br>What are you waiting for? Let&#39;s explore the journey of the brick world together. You can constantly unlock different landscapes and themes from around the world, and you can also decorate all the scenes to your liking. <br><br>Introduction to normal mode:<br>- The ball will fly in any direction you touch<br>- Find the best position and angle to hit each brick <br>- Complete levels by collecting targets<br>- When breaking bricks, never let them touch the bottom<br><br>Features:<br>- Free play<br>- Smooth and accurate aiming<br>- 4000 + levels<br>- Superb physical playing method experience <br>- More than 300 skill balls and skill blocks <br>- Support offline (no Internet access) games <br>- Support multiplayer games<br>- Support achievements and leader boards<br>- Support subscription","https://play-lh.googleusercontent.com/LjGBPSPxKjCSZnDHmiDzJeyjj_zyY5Vn10fZ5LXM-uCE-hBbH5zCVVqfI395VDcdSko","GAME_CASUAL"
"Boba DIY: Tasty Tea Simulator","com.higame.par.bubble.tea","Have fun with your friends with this simulation game by selecting interesting ingredients.<br>Features:<br>- Smooth graphics.<br>- A wide range of toppings, tea and ice.<br>- Drinking sound effects.<br><br>Tips:<br>- Don&#39;t forget to shake your mobile after the glass becomes empty.","https://play-lh.googleusercontent.com/OoznpIOtI_BDoppZEc7FGN30eOl9Uov4-SPtkGiKS9qyZ2fe_IhETk3o63YKkxggFIk","GAME_CASUAL"
"Swing Hero: Superhero Fight","com.master.of.web.heroes.fighting","Prepare to be swept into a pulse-pounding world of relentless action and stunning visuals in Swing Hero: Superhero Fight where an unlikely hero, armed with nothing but spider silk, embarks on a heart-pounding journey filled with challenges, danger, and unbridled excitement.<br><br>Meet our hero - Swing Hero, a humble stickman with extraordinary abilities. Armed with the power of spider silk, the stickman hero is on a mission to save his world from impending doom. Can you guide him through this treacherous adventure?<br><br>This Swing Hero&#39;s secret weapon is no ordinary strand of silk. It grants him incredible powers! Use it to gracefully swing through the air, dodging enemy attacks with uncanny precision. Teleport instantaneously to outmaneuver your foes, and defy gravity to avoid deadly obstacles.<br><br>Engage in fast-paced combat sequences that keep you on the edge of your seat. Utilize the Swing Hero&#39;s agility and silk powers to string together devastating combos, all while avoiding the onslaught of enemy attacks. Each encounter is a thrilling dance of skill and strategy.<br><br>Swing Hero: Superhero Fight is more than just a game; it&#39;s an immersive journey into a world of superhuman abilities, breathtaking challenges, and visually stunning graphics. Do you have the mettle to confront the most dangerous enemies, uncover the secrets of your powers, and emerge as the ultimate Stickman Hero? <br>Download Swing Hero: Superhero Fight now and swing into action!","https://play-lh.googleusercontent.com/Op7eHQyi8ggEfvJNTJIu2hdfLRl1MjALvr87RBG53hPAkRXhy0koSIxATriKqjEYP-M","GAME_CASUAL"
