Game Name,Package Name,Description,Icon URL,Category
"CodyCross: Crossword Puzzles","com.fanatee.cody","Are you tired of the same old board games - classic crossword and word puzzles?<br>CodyCross is here to introduce you to a fun new spelling puzzle and trivia crossword game.<br><br>Start your journey with CodyCross, a friendly alien from the planet COD-X who came to Earth to learn about our planet. Learn about interesting and fun facts as you play through the levels and encounter unique, themed crossword puzzles.<br><br>CodyCross: Crossword Puzzle, is the ultimate crossword game for adults! An exciting trivia mobile app that combines the fun of crossword games with the challenge of improving your vocabulary and spelling skills. Access unlimited crossword puzzles that will test your knowledge and keep you entertained.<br><br>Begin with a themed crossword puzzle board and try to guess the words that fit in the boxes, each with unique trivia clues, hints, and categories. Connect the letters you are guessing and solve the clues. All crosswords have a hidden secret word to help CodyCross attain more knowledge. Are you ready to enter this crossword universe? With crossword puzzles available daily, you&#39;ll never run out of new words and spelling challenges.<br><br>LEARN WITH TRIVIA<br>Improve your spelling as you solve each puzzle, with each correct answer you advance to the next level. Have fun and play spelling bee games that will help you improve your vocabulary and enhance your grammar skills. All crosswords have a hidden secret word to help Codycross learn more. It is a fun way to test your general knowledge and your spelling skills, especially if you&#39;re tired of playing Trivia Crack, NYT crossword, New York Times games, and other boring crossword games. On this adventure, you’ll challenge yourself and expand your word knowledge.<br><br>JOIN<br>The crossword community is already enjoying CodyCross. With its unique combination of word and spelling puzzles, it’s the perfect mobile app game for anyone who loves puzzles and wants to improve their word skills. Whether you&#39;re a fan of crossword puzzles, spelling games, or word association, CodyCross has something for you. Become part of a community of players who want to learn and start solving trivia puzzles today.<br><br>DISCOVER<br>Looking for a fun and challenging way to improve your word and spelling skills? Well, look no further than CodyCross! Explore beautiful worlds with this crossword hobby. Each map has unique words, trivia clues, crossword puzzles, and scenarios. Expand your library with different books to build your collection and learn fun facts and curiosities. With its unique combination of themed crossword unlimited puzzles and spelling games.<br><br>HAVE FUN<br>Codycross is more fun and challenging than other word search puzzles and newspaper crossword games. Start playing now, enjoy crossword free unlimited, get rid of misspelled words, and join the fun with a crossword infinite puzzle game. With this categories game, you will test your general knowledge, expand your vocabulary, and enjoy an interactive word hobby. Keep your mind sharp with the different difficulty levels and play different game modes, such as Today’s Password (Contexto, Puzzword, and Wordle fans love it) and daily themed crosswords. Show your skills with the Daily Streak and Trivia Word Missions.<br><br>SUBSCRIPTION: THE ULTIMATE WAY TO PLAY CROSSWORD PUZZLES<br><br>- No ads interrupting your crossword puzzle experience;<br>- Crossword unlimited game with more prizes and rewards;<br>- Unlimited crossword puzzle and spelling puzzle games;<br>- Access to the entire Crossword Puzzle Free Daily games with words, spelling, and letters;<br><br>CodyCross: Crossword Puzzle Free is a game from the creators of Stop, Word Lanes, and Everyday Puzzles. They’re all puzzle games for teens and adults alike. Embark on this adventure with CodyCross! Solve the clues, guess the secret word, use your trivia knowledge and have fun!<br><br>You can read our privacy policy at https://game.codycross-game.com/Terms/PrivacyPolicy<br>You can read our terms of use at https://game.codycross-game.com/Terms/TermsOfService","https://play-lh.googleusercontent.com/1kbpNtXjB2L3F0ZVw6B9rlo2hCdDAQxmGUhMBE60Srfv7cIWTZmRKgQ-nEoO0Bu0Hzs","GAME_WORD"
"English Crossword puzzle","com.appspot.orium_blog.crossword.eng","Exercise your brain every day with crossword game.<br><br>Improve your English vocabulary and learn a new language words easily.<br>Absolutely free crosswords work without internet connection in offline.<br>100+ easy levels!<br><br>TOP FEATURES:<br>- Offline crosswords levels<br>- Unlimited hints<br>- Absolutely free<br>- English language<br>- Easy levels for english language learners<br>- A fun and educational game<br>- Reveal letter hint<br>- Reveal word hint<br>- The size of the grid will adjust to your device<br>- Best way to kill time","https://play-lh.googleusercontent.com/eQVIenhbZgFuOijAn1VisNTg_s9_rVeRXc1iVMLXnVDcxaR-AisXnv6-LsQl25P3Kvs","GAME_WORD"
"Crozzle - Crossword Puzzles","se.maginteractive.crozzle","Finally, a new way to crossword! Play the fun, brand new crossword game that lets you solve puzzles at your own pace, while playing against an opponent!<br><br>• Solve Crosswords – fill in bite-sized crosswords with super fun clues<br>• Swap Letters – use the swap button to look for better letters!<br>• Play Opponents – test your skills against other crossworders!<br>• No Timer – take as much time as you need to solve clues<br><br>Ready to move on from your old black-and-white newspaper crossword? Play Crozzle!","https://play-lh.googleusercontent.com/4BdR1CbLCSny8LFzO1W9z85WhAc1R1cWLkGvdWnfuPjF7admpagPifFmImAOgpaGig","GAME_WORD"
"Midsomer Murders: Word Puzzles","com.qiiwi.midsomermurders","Dive into the captivating world of Midsomer Murders, where word puzzle meets the mystery game!Challenge yourself with thrilling crossword puzzles, discover clues in Elizabeth Barnaby&#39;s most puzzling mystery cases, and unravel mysteries in this immersive word puzzle adventure.<br><br>WORD GAME &amp; MYSTERY GAME<br><br>Swipe, spell, and solve! Engage with intriguing word puzzles that test your lexicon. As you master each crossword puzzle, you&#39;re not just filling the grid – you&#39;re gathering clues and finding evidence to help you solve Midsomer&#39;s murder cases.<br><br>INVESTIGATE WITH ELIZABETH<br><br>Step into the shoes of Detective Constable Elizabeth Barnaby. As you complete word puzzles, you also dive deep into the complex murder mysteries that she has to solve.Investigate crime scenes, question suspects, and piece together clues to uncover the truth. Every crossword puzzle takes you a step closer to becoming Midsomer&#39;s top detective.<br><br>CHALLENGE, PROGRESS, TRIUMPH<br><br>With a vast array of word puzzles spanning various difficulty levels, there&#39;s always a challenge awaiting in Midsomer Murders. Progress through engrossing stories, solve intricate crossword puzzles, and watch as the mystery game of Midsomer unravels before your eyes.<br><br>KEY FEATURES:<br>Engaging word game &amp; word puzzles that test your wit and vocabulary.<br>Mysteries and challenging crime cases.<br>Gather clues and find evidence like a real detective.<br>Rewards that ensure your efforts in the word game are always recognized.<br><br>Join Midsomer Murders mystery game and experience the ultimate word game! Dive deep into engrossing word puzzles, master every crossword puzzle, and immerse yourself in the mystery game. Join and let the crossword puzzles begin! <br><br>Follow us: https://www.qiiwi.com/midsomer-murders/  <br>Like us: https://www.facebook.com/Midsomer-Murders-Words-Crime-101074402141026","https://play-lh.googleusercontent.com/zQkWms8-8xd8oSoTjw2aiPdglEfEzvdeAgqX3gjclH9uTNoc1dSBO8jG037CZ4_d5NSG","GAME_WORD"
"Word Cookies! ®","com.bitmango.go.wordcookies","🍪 Dive into Word Cookies, where word puzzles meet the delight of cookies, offering a brain-boosting adventure! 🍪<br><br>Embark on a savory journey with Word Cookies, a delightful mix of word spelling games designed to sharpen your mind and enrich your vocabulary in just 10 minutes a day. As a unique concoction of all your favorite word challenges, this game with cookies theme is guaranteed to offers unlimited mental stimulation and fun.<br><br>Word Cookies serves up a fresh batch of letters in each level! Combine them into words by sliding your finger across, tapping into your spelling prowess and creativity. <br>Uncover hidden words and use clues to progress through our cookies!<br><br>Discover the Flavor of Word Cookies:<br><br>• Daily Brain Boost: Spending just 10 minutes daily with Word Cookies can dramatically enhance your mental flexibility and vocabulary.<br>• Spellbinding Challenges: Immerse yourself in an array of word spelling games, each designed to captivate and challenge your linguistic skills to the fullest.<br>• Free Cognitive Development: Delve into brain training and vocabulary expansion at zero cost. For word game enthusiasts, Word Cookies is a delightful new obsession.<br>• Innovative Word Crafting: Employ provided letters in a creative puzzle setup to spell out words. Slide your fingers, connect letters, and unveil secret words and puzzles.<br><br><b>HOW TO PLAY</b><br>• Swipe the alphabet cookies on the pan to spell words.<br>• Fill up Jack&#39;s cookie jar with extra words you find to earn coins!<br>• Rearrange letters in this word scramble, word games for kids &amp; adults!<br><br>With this game, you can quickly improve your vocabulary, concentration, and spelling skills.<br><br><b>SPECIAL FEATURES</b><br>• LOTS OF LEVELS: Over 2000 levels to play in Word Cookies!<br>• KEEPS YOUR BRAIN ACTIVE: Highly entertaining &amp; educational for everyone!<br>• DAILY REWARDS: Play every day to earn bonus rewards!<br>• HINTS AVAILABLE: Shuffle the letters to spark your memory, or use hints to get clues!<br>• NO TIME LIMITS: Take your time and go at your own pace!<br>• FREE TO PLAY: The word game is free, but you can pay for extra hints or to remove ads.<br>• SUPPORTED ON VARIOUS DEVICES: Enjoy word games on a smartphone or tablet!<br><br>Start your Word Cookies adventure now!<br><br>CONTACT US<br>• contactus@bitmango.com<br><br>PRIVACY POLICY<br>• https://www.bitmango.com/privacy-policy/<br><br>LIKE US ON FACEBOOK FOR UPDATES!<br>• https://www.facebook.com/wordcookiesofficial<br><br>Have fun &amp; enjoy!","https://play-lh.googleusercontent.com/G81Ds_vE_ED-3kkXKRsQ_fuMeoKjsNM5n_adR9XRZrVTYKRajB_mlrmUHECMHJwz96Q","GAME_WORD"
"Word Connect - Words of Nature","word.connect.free","Word Connect - Words of Nature: Crossword Puzzles game is a challenging word search free and word connect free game in which you try to solve amazing cross word puzzles! <br><br>Do you like word and spelling games? Embrace this word trip in the word universe of the knowledge, to improve your vocabulary and spelling skills while you discover beautiful natural elements, natural wonders and word scapes.<br><br>It’s simple: connect the different letters to find all the words and complete each level! You will say &quot;wow&quot; several times!<br><br>If you are a crosswords or word search games fan you will love this connect words&#39; game. Word Connect - Words of Nature: Crossword Puzzles has a modern design, beautiful images, many gameplay options, and thousands of challenging levels, so you will never be bored!<br><br>Some levels have special words that give you rewards, which are bonus words that are not present in the crossword puzzle free but that are worth extra coins, and many other surprises.<br><br>If you feel up to the challenge, try the daily word finder challenge to win rewards. Got stuck? Use the power-ups to help you find the missing words!<br><br>Are you looking to improve or learn new vocabulary from different languages? Word Connect - Words of Nature: Crossword Puzzles is available in 16 different languages with a robust dictionary: US English, UK English, French, Spanish, Brazilian Portuguese, European Portuguese, German, Italian, Turkish, Swedish, Romanian, Hungarian, Indonesian, Malay, Czech and Dutch. So, you will have word connect in English, word connect in Spanish, word connect in French,... <br><br>Train your brain everyday with daily word games, crosswords puzzles, word guess, and spelling games!<br><br>Download now and play this great word game!<br><br>Key Features<br><br>- Thousands of levels: with beautiful layouts;<br>- Campaign mode: with increasing difficulty (words from 3 to 7 letters);<br>- Daily Word Challenge: complete it to win rewards;<br>- 3 Power-ups available: hint, target, and multi-hint;<br>- Special words: available in special levels;<br>- Bonus words: for extra rewards;<br>- Shuffle the letters;<br>- Daily rewards;<br>- Available in 16 different languages.<br><br>Can you master this vocabulary &amp; spelling game?<br>Play and have fun with Word Connect - Words of Nature: Crossword Puzzles!","https://play-lh.googleusercontent.com/dFPebM7f8-AdhFmyhAS_ra1Qx_UlYh_IJQOxNJOaR4942yH4FCdFcjm3v8Q7vQu8bA","GAME_WORD"
"Riddle Test: Brain Teaser Game","com.matchingham.braindom3","Tricky brain puzzle game! Can you solve them all? Hundreds of tricky puzzles &amp; adventures!  <br><br>Embark on the mind-bending journey of Riddle Test: Brain Teaser Game, a revolutionary creation by RC Games captivating 90 million players of all ages! Join hero Brian in this fusion of fun mind games for all ages and critical thinking puzzles. Brace yourself for true brain teasers and IQ challenges that aim to transform you into a riddle master.<br><br><br>Dive into original and creative levels that promise an anticipation-filled quest to solve brain games for all ages. Riddle Test: Brain Teaser Game offers multiple brain teaser games, tricky puzzles, and mind-bending challenges, making it the ultimate destination for aspiring riddle masters.<br><br><br>Solve intriguing &quot;who is&quot; questions and IQ tests, from determining the culprit who kill the bride to aiding a mother in finding her children. The game ensures a stimulating experience with an embedded IQ test. Enjoy the adventure with your child or partner, engaging in games for all ages for a delightful time together.<br><br><br>Become a clue-hunting detective, conquering smart games with picture puzzles that demand an eagle eye to crack. The included IQ test pushes your cognitive boundaries, compelling you to think outside the box for the legendary brain test.<br><br><br>Riddle Test: Brain Teaser Game transforms thinking games into an enjoyable brain workout for players of all ages. With hundreds of puzzles and quizzes, mysteries to crack, and challenging clues to uncover, the game elevates the joy of thinking games to new heights.<br><br><br>Experience the thrill of challenging, free smart games designed for all ages to work their brains out! Clues are cleverly hidden in words, photos, and questions, merging smart games with logic puzzles.<br><br><br>Merging smart games with logic puzzles, Riddle Test: Brain Teaser Game is a treasure trove of tricks and riddles challenging you to reach the pinnacle of being a riddle master. Victory awaits as you crack levels by answering &quot;who is&quot; type questions!<br><br><br>Prepare for the most original brain challenge with Riddle Test: Brain Teaser Game – a game dedicated to fun, developed by RC Games. Are you ready to become the brightest riddle master?<br><br><br>___<br>This game has a subscription-based premium feature package, it enables users to use the app without advertisements and with extra features. It&#39;s an auto-renewable subscription. The subscription period is weekly. Payment is charged to the App Store account at confirmation. Subscription is renewed unless turned off 24 hours before the end of the period, and the account will be automatically charged for renewal as well. You may turn it off in your Account Settings anytime.","https://play-lh.googleusercontent.com/pn-K0gqkTmq2dVzkkp24a2T3JvWkQkVT-woxoQDoxhz3wo4CXivFLccKI0AWc5iZ65M","GAME_WORD"
"Word Search","com.tellmewow.senior.word.search","<b>Word Search puzzle in English</b> is a free game for the whole family where you will have to find the hidden words in the letter boards. Ideal for older people who want to practice the language, vocabulary and train their brain. <br><br><b>HOW TO PLAY</b><br><br>Find the mixed words of different themes. The words can be hidden diagonally, horizontally, vertically or in the opposite direction. Sharpen your visual agility and discover all the scramble words!<br><br><b>FREE WORD SEARCHES</b><br><br>- Thousands of word search challenges to solve<br>- 4 levels of difficulty for all ages: 7X7, 8X8, 9X9, 10X10<br>- More than 50 word categories<br>- Available in 8 languages: Spanish - Sopa de letras, Portuguese - Caça Plavras, English - Word Searches, French - Mots Mêlés, Russian - Поиск Слова, Italian - Parole Intrecciate, Indonesian and German - Wortsuche.<br>- Fun designs and simple interface.<br>- Words search is totally free.<br>- Adapted for senior players and the elderly.<br><br><b>WORD CATEGORIES</b><br><br>- Animals<br>- Food<br>- Sports<br>- Professions<br>- Cities<br>- Countries<br>and many more!<br><br><b>STIMULATE YOUR COGNITIVE DEVELOPMENT</b><br><br>Word Search in English is a suitable game to train the brain and stimulate cognitive areas such as attention. Word search games help to focus attention, work on it and teach comprehensive search techniques for seniors and people of all ages, helping both selective and sustained attention.<br><br><b>ACTIVE EXERCISE</b><br><br>For older and little ones, there is no age limit to play word search. This type of mental games are great puzzles to train the brain of those who do it habitually, one of the keys to maintain a healthy mind.<br><br><b>ABOUT TELLMEWOW</b><br><br>Tellmewow is a mobile game development studio specialized in easy adaptation and basic usability which makes our games ideal for the elderly or young people who simply want to play an occasional game without major complications.<br><br><b>CONTACT</b><br><br>If you have any suggestions for improvement or want to stay informed about upcoming games, follow us on our social networks.<br><br>@tellmewow","https://play-lh.googleusercontent.com/rFW4-QuYJNkdpl3t6HuXRrDJihMEFM_lwrdP2CIqcwv4yxlhH7FZ6f0WjWHOHwPlXbM","GAME_WORD"
"Millionaire Quiz: Trivia Games","com.wk.trivia.quiz","Millionaire Quiz is a fun and entertaining game where you can test your IQ, memory, and general knowledge, show off your intelligence, education, and prove that you are clever!<br>Play Millionaire Quiz is a Logic Brain Game. Questions &amp; Answers - general knowledge trivia is a very interesting and popular trivia game. In this game you can proof that you are clever and train your brain! Choose the correct answer from 4 possible ones. Tons of questions are waiting.<br><br>Where is the highest mountain in the world? Or what bird has wings but can&#39;t fly?  In this trivia game, you will find answers for many interesting, curious and rare questions.<br>Millionaire Quiz is especially fun to play with the whole family.  Learn general knowledge lets you experience the thrilling excitement of fighting for the grand prize of one million through 15 challenging trivia puzzles. Game is ready for all world languages.<br>If you don&#39;t know answer then don&#39;t worry we will help you by help options. So you can keep learning in our trivia game. Our main aim is play &amp; learn.<br>GAME FEATURES:<br>• More than 10,000 questions and answers from many areas, categories and difficulty levels that are updated weekly.<br>• Practice concentration, memory and attention skills.<br>• Learn a lot of new knowledge with daily challenges that only the smartest people can do.<br>• Standard four lifelines: public help, hide two wrong answers, celebrity advice, and question replacement.<br>• Unlock new cities and travel the world for new Millionaire Quiz experiences!<br>• Play &amp; win Millionaire Quiz on the go with our offline mode!<br>It is the best quiz game available so far.<br>Best trivia quiz game for the whole world. Play &amp; Improve your general knowledge. Challenge game.<br>Enjoy the Millionaire Quiz. Good luck! Be a star, trivia star!<br>Note: We don&#39;t offer real cash through this game.","https://play-lh.googleusercontent.com/k2iqVRNmARt2LkAiVVg8tcJaWQOoS6u0EZueCD5BWimIYbS1uAg1NLdDNReaLRRG6sA","GAME_WORD"
"Words with Friends Word Puzzle","com.zynga.words","Come enjoy The Original Word Play! Grab your mobile device and prove you have what it takes to best your friends and family in this addictive multiplayer game. Whether you need to relax after a long day, or are looking to train your brain, this word game is perfect for you! Make sure to keep your mind sharp as you choose the perfect move on the board, as one word can be the difference between victory and defeat!<br>Are you looking for a way to build your vocabulary by yourself? Our Solo Challenge is the answer! There is no better way to train your brain than against our fiendish word masters. Looking for new friends with whom to play puzzle games? You can practice your crossword skills with our random opponent matchmaking. No matter if you play with friends old or new, stay connected with our in-game chat, and track your progress with unlockable stats.<br>Think you&#39;re the best at word games of all your friends? Prove it by racking up points and beating your Weekly Challenge!<br><br>For more information, see our Terms of Service: https://www.zynga.com/legal/terms-of-service and Privacy Policy: https://www.zynga.com/privacy/policy&quot;<br><br>“The game is free to play; however, in-app purchases are available for additional content and in-game currency.”<br><br>Just another title from Zynga’s Games With Friends™","https://play-lh.googleusercontent.com/DQL0RwV5C-knAA8JjqMkIwuyZ0GxFxRFgm9dAiBYV4jAomEF2VwSHF5-zS470QTdXWlk","GAME_WORD"
"Word Search: Word Find","com.wordconnect.word.games.search.find","<b>Addicting and FREE TO PLAY word search puzzles and classic word games on mobile and tablet!</b><br><br>Explore new word categories of various difficulties to learn new vocabulary on your quest to train your mind while playing FUN spelling word games in english. <br>To play word search games, find and spell english words on the letter grid horizontally, vertically or diagonally to complete the word search.<br><br>Features of Word Search:<br>- 100% FREE TO PLAY word search for seniors and adults of all ages<br>- 5,000+ levels and categories, easy word search, hard search for your word search quest<br>- Complete word search puzzles by finding the words<br>- Fun high quality word search games<br>- Unlimited word games!!!<br>- No timers! Play at your own pace!<br>- No lives! Play unlimited word puzzles!<br>- Challenge and improve your english by playing in word games in timed or classic mode<br>- No Ads word search available, enjoy word search online or offline with pen and paper anywhere!<br><br>Word Search is a popular spelling game for learning english around the world. Play Word Search for brain training by solving addicting word puzzles!","https://play-lh.googleusercontent.com/xM8trNKnxPD6gfqFxcRhNDLiKIQOcBmTxEMfLyl8S9QpoKAeO_4bQpcsmIRqG2JtkQ","GAME_WORD"
"Word Kitchen","com.gimica.wordkitchen","Use your puzzle solving and vocabulary knowledge to serve up some tasty dishes in the hottest kitchen in town.<br><br>Great for stress relief and brain training and if you do run into some trouble our hint system is there to help.<br><br>Service!","https://play-lh.googleusercontent.com/j5wDQUTWrJ0bpKZkRe8G5-bo1j3wvwAus9A5RVpLxF1laYDW6UcWX9pfVPdGaBTefOc","GAME_WORD"
"كلمات كراش - لعبة تسلية وتحدي ","com.zytoona.wordscrush","استكشف خارطة العالم العربي عن طريق حل المراحل المتنوعة والشيقة,<br>بدون منازع أفضل لعبة كلمات عربية شاملة وبجودة عالية من زيتونة.<br>تجمع بين المنافسة والتعاون بين الاصدقاء وافراد العائلة. <br><br>تسابق مع اصدقائك في الفيسبوك , الخارطة تشمل مئات المراحل, بانواع مختلفة,  اكتشف المثل وكلمة السر وكلمات متقاطعة و لعبة الكنز. لعبة مليئة بالتسلية والتشويق, وتحتاج لحدة في التفكير ودقة ملاحظة","https://play-lh.googleusercontent.com/6eXjWA5R0IYsSQdSzdCw_fYqCPy0cP8LauA1HhbhrDnxBDz5VG8g1za1j3H8vOa6aQ","GAME_WORD"
