Game Name,Package Name,Description,Icon URL,Category
"Crossword Deluxe: Word Puzzles","com.playvalve.crossword","Meet Crosswords Deluxe - Your Ultimate Daily Themed Crossword Experience! Do you want to expand your vocabulary by learning new English words daily? You&#39;ll find a different topic to discover word by word 🧐<br><br>Embark on a delightful journey of word exploration with Crosswords Deluxe, the newest crossword game in English for Android! With a vast collection of captivating puzzles full of words, each day connected to a unique theme, this game is designed to keep your brain active, your mind sharp, and your entertainment levels soaring!<br><br>Unleash your inner wordsmith and choose from an extensive range of topics like Movies, Sports, Technology, Games, History, Architecture, and more. With hundreds of puzzles at your fingertips, you can enjoy the thrill of solving crosswords whenever and wherever you desire since you can play them offline.<br><br>Features that make Crosswords Deluxe the ultimate words game:<br><br>🔠 Fun daily word puzzles in English for everyone, from beginners to seasoned experts.<br><br>🗓️ A new crossword puzzle awaits you every day, 365 days a year, ensuring a constant challenge.<br><br>🏆 Get rewarded for your crosswords dedication and perseverance as you play daily and achieve milestones. The more words you get, the higher the rewards will be!<br><br>💡 Need a nudge? Hints are available to guide you past those tricky words.<br><br>📅 Each day of the week is attached to a captivating theme, keeping your crossword journey fresh and exciting.<br><br>⏳ The puzzles strike the perfect balance between being engagingly challenging and comfortably accessible. You&#39;ll always want more!<br><br>🧠 Expand your vocabulary in English by learning new words and deepen your general knowledge as you explore famous personalities, significant events, remarkable discoveries, and many new words.<br><br>Join the vibrant community of English crossword enthusiasts and experience the addictive allure of Crosswords Deluxe. Download it now and discover why countless players worldwide are hooked on this exhilarating word game!<br><br>Get ready to exercise your brain, sharpen your wit, and unravel the joy of daily themed crosswords. Crosswords Deluxe - Your key to endless hours of fun and mental stimulation.","https://play-lh.googleusercontent.com/-Zgnc1_U5I5KXnXJAg6NfI0ftrQrl6UVecZr82UtdtGgm9DJfG2k9GWa75cLoiJmWKMH","GAME_WORD"
"Hangman Words:Two Player Games","hang.man.word.guessing.games","Hangman Words is the perfect word games and 2 player games for those who love to test their spelling skills while having fun in hangman word search. 🎉<br><br>Challenge your friends to the thrilling 2 player games and save a hangman from being hanged by guessing the correct word. Play against your friends or random opponents in two player games and enjoy a fast-paced and engaging hangman free game.<br><br>Hangman Words features various levels of word search and crossword puzzles, where you can showcase your spelling prowess in the hangman words game and save the hangman via word search. The 2 player games hangman gameplay is simple yet challenging - input the correct words quickly to help the hangman before it&#39;s too late.<br><br>As you progress in the 2 player games through different hangman words levels, the two player game&#39;s difficulty increases, requiring the use of your word search brainpower to its fullest potential. Hangman Words is ideal for word search and hangman free enthusiasts, as well as anyone who loves 2 player games.<br><br><br>Hangman Words is the classic word games with a fun new twist! Choose from hundreds of words and try to guess the word letter by letter. For every wrong guess in hangman 2 player, another part is added to the hangman drawing. Can you solve the word puzzle games before the full hangman is complete? With colorful graphics and addictive gameplay, Hangman Words will have you hooked for hours of word games fun!<br><br>Challenge your skills and expand your vocabulary with Hangman Words! With hundreds of words across multiple languages, you&#39;ll be guessing for days. Track your stats, compete against friends in two player mode, and customize your game for a unique experience every time. Simple to learn but hard to master, Hangman Words takes the classic hangman 2 player game we all know and adds new words, new themes, and multiplayer modes. Stop guessing and start playing with the definitive hangman word games!<br><br>🎉The two player game&#39;s graphics of hangman words are simple and fun, with interactive hangman animations that respond to every words you enter. Download Hangman Words now and start playing this addictive and challenging 2 player word game today!","https://play-lh.googleusercontent.com/3vU01hZIomX95xALi7bH1l2OEHFLZYvYsEx0OIjUS1FIPNrIua56phuSd8Fy4Yg9mMM","GAME_WORD"
"Vita Word Search for Seniors","com.vitastudio.wordsearch","Vita Word Search is an Exclusive Word Puzzle Game for Senior Citizens. We are thrilled to present Vita Word Search, an innovative word puzzle game with big letters and an easy-to-use, eye-friendly interface that caters to both pad devices and mobile phones of all shapes and sizes. Our goal is to ensure a gaming experience that is both relaxing and mentally engaging, with a particular focus on older adults.<br><br>At Vita Studio, we have always been dedicated to crafting mobile games designed for seniors that bring back relaxation, fun, and joy. Our repertoire includes popular titles like Vita Solitaire, Vita Color, Vita Jigsaw, Vita Word Search, Vita Block, and more.<br><br>Why Choose Vita Word Search?<br>Studies have shown that mentally stimulating activities, such as word puzzles, can aid in preserving mental acuity. However, many word games like wordscapes, crossword, word stacks, word cookies, word connect and wordle are not equipped to suit the unique needs of senior citizens. Recognizing this gap, we identified the necessity for a game that addresses seniors&#39; specific requirements and preferences. This game combines mental stimulation with accessibility and ease of use.<br><br>How to Play Vita Word Search:<br>Playing Vita Word Search is made simple. Just find words that are hidden in the letter grid related to a common theme. Swipe your fingers to form the words that are hidden in plain sight. The puzzles get trickier as you progress while gaining more wisdom.<br><br>Exclusive Vita Word Search Game Features:<br>•    Accessibility and Ease of Use: Acknowledging that not all seniors are tech-savvy, we have placed great importance on creating a fun game that is easy to comprehend and navigate.<br>•    Large-Scale Design: Our puzzles feature large, easily readable text sizes to alleviate the strained eyes caused by small fonts. This critical feature ensures easy engagement for all, especially seniors.<br>•    Tranquil Backgrounds: Our puzzles are set against serene and visually pleasing backgrounds, creating a calm gaming environment. These peaceful backdrops enhance the overall experience and reduce stress.<br>•    Mental Stimulation: Alongside ease of use, Vita Word Search is invaluable for enriching the mind. Engaging in our word puzzles provides an excellent opportunity to break a mental sweat and keep the mind sharp.<br>•    Graduated Difficulty Levels: To ensure continuous mental engagement, our game adjusts its difficulty as the players progress. Advancing through the levels gradually presents more challenging puzzles, providing a consistent cognitive workout tailored to each player&#39;s ability.<br>•    Helpful Hints: While our game encourages independent problem-solving, we recognize that extra assistance can be beneficial. Therefore, we offer useful hints within the game to guide players when needed.<br>•    Offline Mode: Full offline support ensures users enjoy Vita Word Search anytime, anywhere, without worrying about Wi-Fi or other internet connectivity.<br>•    Multi-device: Optimized for both smartphones and pad devices, Vita Word Search is a versatile word puzzle game made for those who love a challenge.<br><br>By emphasizing accessibility and ease of use alongside elements of mental stimulation, Vita Word Search offers seniors a game that is tailor-made for their unique preferences. It&#39;s a carefully curated experience to promote relaxation, mental agility, and vocabulary enhancement. <br><br>Embark on this amazing word-finding adventure in Vita Word Search today!<br><br>Contact us via: support@vitastudio.ai<br>For more information, you can:<br>Join our Facebook group: https://www.facebook.com/groups/vitastudio<br>Visit our website: https://www.vitastudio.ai/","https://play-lh.googleusercontent.com/34XFK2BXq6V22Zt5TGOVEm3Wc9bx6YKKRC1NFeM9bkTKxmK8eJlMeIGG5yOng7iEpSk","GAME_WORD"
"Brain Who? Tricky Riddle Tests","com.braindom2riddle","Engage your mind with Brain Who? Tricky Riddle Tests, the ultimate puzzle and thinking game experience! Immerse yourself in a world of mind-bending challenges that will test your intelligence and creativity. <br><br><br>Embark on a journey through puzzledom, where thinking games and riddles will twist your mind, challenging you to unravel each level&#39;s mysteries. Dive into Brain Who? Tricky Riddle Tests, the best of thinking games and brain teasers, designed to provide the brightest minds with a satisfying mental workout.<br><br><br>Wash your brain with mind games and puzzle games that are strategically crafted to trick and challenge you. Solve intricate riddles to unveil the truth - who is who, who is lying, and who is the culprit? This brain app brings you an unprecedented blend of tricky puzzles and brain games that guarantee hours of entertainment and intellectual stimulation.<br><br><br>These riddle games, suitable for teens and adults, cover a broad spectrum of topics. From challenging quizzes that test your IQ to cracking riddles and trivia games, Brain Who? Tricky Riddle Tests positions you as the champion of smart games. Train your brain daily to become the riddle master amongst your friends, conquering each level with wit and wisdom.<br><br><br>Unlike conventional IQ games, Brain Who? Tricky Riddle Tests stands out with its unique concept, ensuring your brain gets a comprehensive workout. The game combines logic puzzles with trivia, providing clues hidden in words, photos, and questions. Elevate your IQ as you navigate through tricky puzzles that engage and challenge your thinking habits in a ludic way.<br><br><br>Brain Who? Tricky Riddle Tests encourage daily brain training with tricky puzzles and trivia tests. With hundreds of fun trivia games, riddle games, tricky puzzles, brain tests, IQ tests, and quiz games, this brain app promises an unrivaled brainwash experience.<br><br><br>Embrace the funniest of puzzle games and brain teaser games with Brain Who? Tricky Riddle Tests, breaking common sense to bring you an excellent brainwash experience. Are you ready for the brain out in the best of smart games and riddle games? Take on this impossible mind-blowing game and crush each level in this 7-second riddles game.<br><br><br>Brain Who? Tricky Riddle Tests Features<br><br><br>Tricky Games:<br>- Engaging brain teasers for teens and adults of all ages!<br>- Solve the mystery: Who is who? Who did it? Can you succeed in all these puzzle games?<br>- Abundance of mind games: Hundreds of quizzes to solve<br>- Mysteries await: Find the clues and have fun<br>- Prove your skills: Are you a riddle master?<br><br><br>Brain Workout:<br>- Intense brain training to think outside of the box<br>- Tricky games that will blow your mind<br>- IQ test challenges for you or your friends!<br>- Innovative thinking to solve mind puzzles<br>- Crack trivia questions to master smart games<br>- Refresh your brain with this unique brain app!<br><br><br>Riddles with Easy &amp; Intuitive Gameplay: <br>- Logic games that require sleuthing!<br>- Develop critical thinking by finding clues within the pictures<br>- Make choices: This or that, just a couple of options!<br>- Enhance your thinking abilities with these games<br>—----<br>This game has a subscription-based premium feature package, it enables users to use the app without advertisements and with extra features. It&#39;s an auto-renewable subscription. The subscription period is weekly. Payment is charged to the App Store account at confirmation. Subscription is renewed unless turned off 24 hours before the end of the period, and the account will be automatically charged for renewal as well. You may turn it off in your Account Settings anytime.","https://play-lh.googleusercontent.com/W_nYli-ltT7iV4RNLKFf9HQabAdEI_48LtSe-oy2IBD3_U2B4Qd_bh8q3dmu-AVL0w","GAME_WORD"
"Word Crush - Fun Puzzle Game","com.tangramgames.gourddoll.wordcrush","🔠 <b>Welcome to Word Crush - Fun Puzzle Game: Your Ultimate Word Adventure of Classic Word Puzzle Game 2024!</b> 🎉<br><br><h2><b>Embark on an Exciting Journey Through Fun Word Games!</b></h2> <br>💕 Ready to dive into the captivating world of one of the best word search crossword puzzle games? 💕 <b>Word Crush - Fun Puzzle Game</b> offers various thrilling game modes to satisfy your word-crushing and word-hunting cravings. Meanwhile, except for word-hunting online, set off on a quest across enchanting minigames in Jam Crush, Tile Crush, Bingo, and so on. Word Crush also provides various themes for you. From bustling cities 🏙️ to serene countryside 🌄, solve brain word puzzles and uncover hidden treasures as you journey through diverse environments in this free word puzzle game for adults and children. 🧩🧠<br><br><h2><b>Offline Fun Games, Anytime, Anywhere! </b></h2><br>No internet? No problem! <b>Word Crush - Fun Puzzle Game</b> offers seamless offline gameplay, allowing you to indulge in brain word puzzles anytime, anywhere. Whether you&#39;re on a long journey 🚂 or relaxing at home 🛋️, sharpen your vocabulary and improve your word spelling skills at your own pace without interruptions, and enjoy your own game time of word searching, word connecting, and word-hunting online. Let&#39;s see who is the next word master! 🏆<br><br><h2><b>Engaging Gameplay &amp; Charming Visuals</b></h2> <br>Let the immersive gameplay and charming visuals accompany you on your word search crossword puzzle journey. With delightful graphics 🎨 and intuitive controls ✨, <b>Word Crush - Fun Puzzle Game</b> promises hours of addictive entertainment for players of all ages. Try the popular &amp; addictive brain word puzzle game 2024 NOW!<br><br><h2><b>How to Play:</b></h2><br><br>👆 Connect Letters: Swipe your finger across adjacent letters to form words and crush the letter stack. Find letters through word searching and word connecting. Match words and pass all fun word puzzle games for adults and children, the best word games for your brain training. 🧠<br><br>🎯 Strategic Word Formation: Strategically form words to clear the board and earn points. You’d better find letters strategically, or you may lose at the final steps. Let’s test your word brain, and start word-hunting online. <br><br>🔍 Find Letters: Search for hidden words within the letter stack to earn bonus points and unlock special rewards. 🎁<br><br><h2><b>Enhanced Gaming Features:</b></h2><br><br>💥 Exciting Power-Ups: Unleash special abilities to crush the letter stack and earn extra points! 🚀<br>🎉 Daily Challenges: Test your word skills with new challenges every day and earn rewards.<br>🌈 Colorful Themes: Customize your word Scrabble gaming experience with vibrant themes. 🎨<br>🏆 Achievements: Unlock achievements and showcase your word-crushing prowess.<br>📊 Tournaments &amp; Events: Join the exclusive limited-time events to win big rewards which can help you pass the classic word scrabble puzzle games easily and be a word master. <br><br>🔓 <b>Become a Word Master!</b> Unlock the secrets to success in <b>Word Crush</b>, a fun word puzzle game 2024 by mastering the art of word connecting. <b>Word Crush - Fun Puzzle Game</b> offers a rewarding and addictive word Scrabble gaming experience for all. 🌟🧠<br><br>🌟 <b>Join the Word Revolution!</b> If you&#39;re in search of a free word puzzle game for adults and children that challenges your mind and delights your senses, look no further than <b>Word Crush - Fun Puzzle Game</b>. Download one of the best word games now and join millions of players worldwide who have fallen in love with this addictive and immersive word matching adventure. Share it with friends and family and embark on a free classic word puzzle game journey like no other! 🧠💖<br><br>🔄 Contact us: <a href=""http://WordCrushFeedback@gmail.com"">WordCrushFeedback@gmail.com</a><br>🌐 Follow our Facbook page: <a href=""https://www.google.com/url?q=https%3A%2F%2Fwww.facebook.com%2FWordCrushGameOfficial%253Cbr%253E&amp;sa=D&amp;sntz=1&amp;usg=AOvVaw0xEnGHF467uKJCAAkigk2e"">https://www.facebook.com/WordCrushGameOfficial<br></a>","https://play-lh.googleusercontent.com/pcaUJjHClrRih_xMRWhjpWq-iJeiCaO3nVoUO17Mes0GYyYUSokVGF4jOw0HcMZ7AHo","GAME_WORD"
"Word Search Block Puzzle Game","com.word.block.puzzle.free.relax","If you love to find words, try word crush games designed to assist train your brain, relieve stress, and expand your vocabulary！<br><br>These incredibly addicting word crush puzzle game are brain blasting fun!  Every puzzle you complete will help you study vocabulary and relax!<br><br>Find words on board &amp; connect  letters to solve tons of word puzzle levels. Word crush is no doubt an easy and handy way to sharpen your mind.<br><br>WORD CRUSH FEATURES:<br>-Swipe up, down, left or right to connect letters. Simple!<br>-CHALLENGE your vocabulary.<br>-Great brain training exercises!<br>-Lots of word game levels. Play 1000s puzzle board levels.<br>-EARN POWER-UPS. Use boosters to find  words when you get stuck.<br>-These word crush are easy at the start, but get challenging fast!<br><br>WHY WORD CRUSH?<br><br>If you like to relax and unwind with word puzzle game —you’ll love this word crush game! It’s easy at first, but gets challenging fast. Are you able to beat the word crush game? Start playing and find out!<br><br>Words crush game could be a modern twist on classic word search puzzles, combining the features of crossword, scrabble style, word find, and word connect puzzle games. This innovative word crush game is expecting you to join.","https://play-lh.googleusercontent.com/oMw1jCCymT429xzICFK33JcvHg5J-Lhd2zCOfHypZWsFVmWB_Sv_7ff8w9uLKXYkVhTW","GAME_WORD"
"Party Charades: Guessing Game","com.partycharades.wordguessinggame.party","🎉Welcome to <b>Party Charades: Guessing Game!</b> Heads-up the phone and play the game ️🎉<br><br>Get ready for a blast of laughter and excitement with family games - Party Charades: Guessing Game. Classic party charades game is designed for all ages, ensuring a riotous time at family gatherings, parties, or any social event<br><br>️🎉<b>How to play classic party, group games party charades</b><br>- Heads-up, divide the group into two teams.<br>- The player selects a deck including words and phrases, heads up the phone on the forehead.<br>- Teammates will act, dance, sing, or sketch to describe the words and phrases. Let&#39;s guess the word.<br>- If the answer is correct, tilt your phone down and guess the next word. If wrong or can&#39;t guess, tilt the phone up to switch the next words or phrases.<br>- Time Limited: Challenge your wit and quick thinking as you race against the clock to guess the word on the screen. <br><br>️🎉<b>Features of party charades:</b><br>- Guess the word, take the challenge: Helps you exercise your brain, think and come up with accurate solutions. Increased creativity and challenge makes players excited.<br>- Connect, communicate, celebrate: There is nothing better than being able to connect with family, friends, and relatives through a game. Enjoy your wonderful vacation with your wonderful people.<br>- Unlimited topics: You can freely choose the topics you like, we have enough topics for every holiday, event, party. Topics will be updated regularly.<br>- Simple graphics and sound, easy to use.<br><br>️🎉<b>Party Charades: Guessing Game</b> is more than just a game - it&#39;s an experience that brings people together, sparks laughter, and creates lasting memories. With its innovative combination of party charades, and party dynamics, this family and group games is a must-have for anyone who loves a good time. Get ready to elevate your gatherings and let the charades party begin!","https://play-lh.googleusercontent.com/ulxa1D5mTR4h-mLqIYOf-RJO0f-X9K7Kla1W4_2O2mVZqDnB0PaMrRmXHcJwWIpBPp4","GAME_WORD"
"Easy Words - Word Puzzle Games","com.easybrain.word.puzzle.game","Easy Words is a fun and addictive word game to train your brain. Make words with letters to get as many points as you can! Take a break and show off your logic skills while competing with opponents for a higher score!<br><br>In this word puzzle game, players take turns to compose words with the letters from their deck. Each letter has its own points. The main goal of the word game is to reach the highest score by making words on the board with your letters. Play word games for free and sharpen your mind, anytime and anywhere.<br><br>The rules of Easy Words are quite simple:<br><br>- This word puzzle game is played on a 13x13 board.<br>- You and your opponent receive 7 tiles with letters on them from a tile bag that contains 80 letters in total. You have to connect letters in different ways and place the tiles on the board to make a word.<br>- Words can be formed either horizontally or vertically.<br>- The player who starts the word game should place a word containing at least two letters onto the board with at least one tile placed in the central square.<br>- There are 44 bonus cells on the board. They allow you to multiply the points you receive either for a letter or the whole word if a tile with a letter is placed on one of them.<br>- If you receive a tile with a joker, lucky you! It can substitute any letter you need while playing word puzzle games.<br>- The game is over when either player uses the last tile, or both of them skip two moves in a row, or if either player has no possible moves left. Also, it is possible to resign from the word game. However, this means that your opponent wins.<br>- The user with the higher score at the end of the game wins.<br><br>Easy Words features:<br><br>- Word definition. The built-in dictionary provides the definition of all the words added onto the board. This is an excellent opportunity to enrich your vocabulary while playing free word games for adults!<br>- Hints. If you are stuck solving word puzzles, simply use a hint. It will compose the best possible word with the letters you have, taking into account bonus cells to maximize the number of points you can receive during your turn.<br>- Swap. If you have run out of ideas and don’t know what you can create with the tiles you have, just swap the tiles in your deck. You’ll receive a few random letters from the tile bag. This is a classic way to get some inspiration and compose words with your new letters!<br>- Shuffle. This is one of the word games that offer an opportunity to shuffle the tiles in your deck. Get a fresh perspective on your letters to form a new word!<br><br>If you have ever tried to unscramble words or played other classic free word puzzles, Easy Words is a great option for a pleasant and fun pastime. Solve your first word puzzle and dive into the immersive game experience. Accept the challenge, make as many words as you can and train your brain!<br><br>Terms of Use:<br>https://easybrain.com/terms<br><br>Privacy Policy:<br>https://easybrain.com/privacy","https://play-lh.googleusercontent.com/4tlxhkg2S_S41APUs57W_EkXJB-dLYGFQ_8MImvJAh4Ufy5znmWwHN7oGY9HZii4Cg","GAME_WORD"
