Game Name,Package Name,Description,Icon URL,Category
"Crossword Jam","in.playsimple.tripcross","Word Jam - A word search &amp; word guess brain game. WordJam is a fun and relaxing word game in a crossword-style format made for the smartest brains! <br><br>Swipe the letters to find and guess the hidden words in a crossword-style grid<br><br>Word Jam - A word search word guess brain game is the first of its kind.<br><br>Solve the anagram puzzles as you travel around the world on this word trip unlocking new levels.<br><br>Guess and search letters on the word plate to find different words. Solve the anagram puzzles by searching for all the words to make your way to a new country. As you progress in the game, the anagram puzzles get trickier!<br><br>Word Jam is a free word search brain game that tests your vocabulary, spelling, word guessing and anagram puzzle solving skills - just search and guess the words! Get a fun brain exercise in your free time and improve your vocabulary!<br><br>If you are a word game lover and like to play brain games to improve your vocabulary or simply enjoy word search games to casually swipe and guess the hidden words, Word Jam - A Word Search &amp; Word Guess Brain game is the perfect choice for the best brain game lovers!<br><br>How to Play:<br>The rules are simple. Search and swipe the letters on the plate to guess the hidden words<br><br>Game Features:<br><br>• FREE TO PLAY GAME – Download this for FREE and play without wifi.<br><br>• &quot;EASY TO LEARN&quot; HARD TO MASTER – The easy game play gets you going from the first word search anagram puzzle and keeps your brain engaged for hours. However, the game gets trickier as you progress with more complicated words and tougher levels.<br><br>• CHALLENGING PUZZLES – Free anagram puzzles range from 2 letters to 7 letters. It starts easy and gets challenging quickly as you progress further.<br><br>• IMPROVE YOUR VOCABULARY – Search &amp; find hidden words or guess them from the same set of letters. Flex your brain muscles in your free time and improve your spelling skills all while increasing<br>your vocabulary by discovering new words.<br><br>• PLAY ANYTIME – No internet or wifi needed for this game. You can play offline too for free!<br><br>• SYNC YOUR GAME PROGRESS – You can login using Facebook to sync your game progress across various devices.<br><br>So, why wait? Play the game now and start guessing the hidden words!<br><br>FEATURES:<br><br>• Search and guess the words from mixed letters.<br><br>• Guess new words using the crossword grid and develop your brain, anagram puzzle solving vocabulary skills.<br><br>• Feel a sense of achievement as you go around the world, to become a Word Finder!<br><br>• Simple and Easy!<br>• Daily bonus rewards<br>• 250 free coins to get you started!<br>• Great exercise for the brain<br>• Supports both Phones and Tablets.<br>• FREE Update!<br>- Easy to learn and fun to master gameplay<br>- Enjoy playing the game anytime, anywhere. No wifi required to play the game<br>- More than 100s of levels with thousands of anagram puzzles. Updates will be regular and free!<br><br>NOTES<br>• Enjoy the game with various devices (Phones and Tablets).<br>• &quot;Word Jam&quot; contains ads like banners, interstitials and videos.<br>• &quot;Word Jam&quot; is free to play, but you can purchase in-app items like an ad-free account and attractive packages.","https://play-lh.googleusercontent.com/pIA4XnE1awND0YkkHvUYpcVb1ZNz3rl-buoOZ7E9dE5OEJvf9a7fYRgAf_jIlRlN7pI","GAME_WORD"
"Crossword Puzzle Explorer","in.daily_puzzle.crossword","Are you ready to embark on a journey of brain-boosting fun? Immerse yourself in the captivating world of wordplay with Crossword Puzzle Explorer, the definitive crossword puzzle experience that&#39;s not only fun but also educational! Best of all, this game is completely free to play! Whether you&#39;re a seasoned crossword enthusiast looking for a new challenge or someone just beginning their crossword journey, Crossword Puzzle Explorer has something special for you. Dive into our vast crossword puzzle collection, featuring a diverse range of themes, sizes, and difficulty levels. There&#39;s a puzzle for every mood and skill level. 🌟 Key Features 🌟 🔠 Endless Puzzles: Challenge yourself with an impressive collection of thousands of crossword puzzles that span the spectrum from easy to expert. Whether you have a few minutes or hours to spare, Crossword Explorer always has a puzzle to keep your mind in tip-top shape. 🏆 Daily Challenges: Are you up for a daily challenge? Crossword Puzzle Explorer offers fresh crossword puzzles every day. Solve them to earn fantastic rewards, hone your crossword-solving skills, and prove your word mastery. 📈 Track Your Progress: Keep tabs on your crossword conquests! Unlock a variety of achievements as you conquer crossword after crossword and climb the ranks of wordplay greatness. 🎨 Themes &amp; Customization: Make your crossword-solving experience uniquely yours! Explore a delightful selection of themes and beautiful backgrounds! 💡 Hints &amp; Tips: No one likes getting stuck on a tricky word or clue. That&#39;s why we&#39;ve got you covered with a range of hints and tips to nudge you in the right direction. Keep the crossword-solving momentum going and conquer those challenging puzzles! 📚 Educational Fun: Enhance your vocabulary, sharpen your language skills, and boost your knowledge while having an absolute blast! Don&#39;t miss out on the crossword puzzle adventure of a lifetime. Download Crossword Puzzle Explorer now and start exploring the world of words like never before. Challenge yourself, have fun, and let your word-play journey begin!","https://play-lh.googleusercontent.com/d74AHPIB9oEguFHUASKLmbg50B4abwvVx2JhamOMyXuTQ6osDXTkrnhXY22K94lhQb8","GAME_WORD"
"Word Connect","com.wordgame.words.connect","💕Do you enjoy the excitement of classic word games? Are you a real puzzle game master? DOWNLOAD Word Connect for FREE! Start your word story and enjoy the brainstorm NOW! 💕<br> <br>Simply swipe the letter blocks and build words to collect coins! Find the clues to solve the crossword puzzles! DOWNLOAD Word Connect NOW to begin training your brain and become a word master!<br> <br>It’s time to uncover hidden words and build as many words as possible! Come and begin your word story!<br> <br>What makes Word Connect so special?<br> <br><b>• Authoritative Dictionaries!</b> The game is powered by Oxford Dictionaries.<br><b>• Addictive gameplay!</b> Simply swipe the letters to build words! <br><b>• Tons of words!</b> 13596 levels in total await!<br><b>• Different Modes!</b> You can choose from normal mode, crossword mode and the daily challenge! Come and solve different puzzles!<br><b>• Daily Bonuses!</b> Log in every day to play exciting daily puzzles to collect big bonuses!<br><b>• Alternative Themes!</b> Up to 11 cool themes for you to choose from!<br><b>• Vintage Style!</b> Our wooden block graphics will bring back nostalgic childhood memories!<br><b>• Hidden Bonus!</b> Extra words are waiting to be discovered! Find extra words to collect bigger bonuses!<br><b>• Play Together!</b> Ask your family members and friends for help to solve the puzzles and send coins to each other on Facebook!<br><b>• No time limits!</b> You can use your time wisely to find new words at your own pace!<br><b>• Level List!</b> Want to check previous levels? Go back to the Level List and play again!<br><b>• Offline Mode!</b> No wifi? Don’t worry, you can play Word Connect anytime, anywhere even without a network connection!<br><b>• Multiple Choices!</b> Supported on both phone and tablet.<br> <br>Word Connect is an app designed to train your brain and learn new words all while having a great time. Share the fun with your family &amp; friends and enjoy Word Connect together!<br><br>This year, we are going to have a series of updates to bring you a better game experience! Get ready for the new era of Word Connect and enjoy your own word story!","https://play-lh.googleusercontent.com/erNt5utVXtq-0tC5Jf0n3WdJgtog9vZtdFMZGNIIcpEiBllURx30Gie6CuVGnsEOyg","GAME_WORD"
"Crostic Crossword－Word Puzzles","com.severex.cross.word.puzzle.logic","<b>Up for some brain games and mental workout?</b><br>We’ve got a perfect brain puzzle machine for you here! Crostic Game will get you hooked on crossword puzzles and logic puzzles! These awesome word puzzle games can train brain muscles like you wouldn&#39;t believe, if you keep solving crossword puzzles and logic puzzles one after another.<br><br>Our game has many exciting and challenging wordsearch and crossword puzzles to decipher, hidden proverbs to find, famous quotes to read, secret words to decipher, and much more!! Playing Crostic brain games is a perfect way to spend your relaxing time-off with friends and family!<br><br><b>Want to know what else you’ll find in the Crostic brain games?</b><br>Crostic doesn’t have your typical old-school crossword puzzles with just plain text, which can get kind of boring after a while. Yes, our logic puzzles have a classic figgerits style, but they’ve been created with the cutest graphics and special effects that will blow your mind!<br><br><b>Awesome game’s features:</b><br>⚡ Great crossword explorer games that can get easier to play with word search<br>⚡ Basic Classic mode and more easier Relax mode with completely unique levels to have a great time<br>⚡ Hidden proverbs, fascinating quotes, witty historical facts, etc.<br>⚡ Endless challenging &amp; dazzling word scramble and cross logic puzzles to solve with friends for fun<br>⚡ All kinds of difficulty levels from easy to complex<br>⚡ Mind-captivating logic riddle and brain teasers<br>⚡ Awesomely user-friendly &amp; intuitive game’s interface<br>⚡ 4 NEW daily goals with every new gameplay<br>⚡ Winning points are credited once you accomplish each daily crossword goal successfully<br>⚡ The more points you score, the further ahead you’re going to be from other players on the leaderboard. It’s not a secret!<br><br>Crostic word finder mini crossword puzzles work perfectly for learning how to find and follow clues to start decrypting lots of mind-dazzling and association like brain puzzles easily. Never tried it before? Not a problem! Our game will let you pick a level to get you all set for the most relaxing wordsearch and crossword puzzles gaming experience.<br><br><b>Some easy steps to follow and decipher word puzzles like a pro:</b><br>💥 Match letters with numbers<br>💥 Move letters right into solution dashes<br>💥 Make sure each letter matches the correct number<br>💥 Fill the dashes in the wordlist<br>💥 Solve as many puzzles as you can with definitions<br>💥 Complete each level easily!<br>💥 Complete 4 daily crosswords goals, then complete additional topics and break into the lead!<br><br><b>Play Crostic crossword puzzles</b> and fuel your brain with power, train logic, and boost your dopamine level. Spread the word about Crostic brain games and play with friends to let them have fun too!<br>Get your brain tickled and teased with these awesome classic figgerits word search games with a modern twist and dive into some of the most addicting gaming experiences ever.<br><b>Are you ready to rock these nifty crosswords?</b>","https://play-lh.googleusercontent.com/eIrfE0N1_m6sCYOmqCym9K20bZFOG8vmMctmND4PlRBwoS0mG6YU5qvqiAJ2_GbUC8U","GAME_WORD"
"Spelling Quiz - Word Trivia","spelling.quiz.trivia.question.answer.correct.word.learn.language.puzzle","Millions of adults are unable to spell basic everyday words, a study suggests. Some words seem to be easy but people hesitate when spelling them. In response to this situation, we need to keep learning spelling to solve this problem.<br><br>It’s proven fact that learning new things in proper way helps you remember things quickly and for long-term! SpellingQuiz is a new educational English spelling game that will check and improve your spelling skills in an entertaining and challenging way!<br><br>HOW TO PLAY<br>Choose the correct word from 4 similar spelling options before time runs out.<br>Try a HINT to help you remove a wrong spelling option.<br>Use +20s to add 20 seconds if you want more time.<br>Find 3 correct words to pass a level.<br>You will get a gift every time you complete 4 levels.<br><br>Features:<br>Challenging word game with thousands of questions!<br>Daily bonus gems for free hints!<br>Multiple question categories!<br>Play free spelling games OFFLINE or ONLINE - anytime, anywhere.<br>Expand your knowledge by playing game!<br>Improve your vocabulary and dictionary!<br>A must game for all the spelling bee game fans!<br><br>Are you good enough in spelling?<br>Just download and start your quest now!","https://play-lh.googleusercontent.com/pyGL1pmcO0Rd8yWLLytv5CGBm0ZhV4LQf7Pf9HSzAOZ_dxMLql9BlzLqmt_bfAWOMg8","GAME_WORD"
"Heads Up!","com.wb.headsup","It’s the game The New York Times called a “Sensation,” and Cosmopolitan said “will be the best dollar you’ve spent.” Heads Up! is the fun and hilarious game by Ellen DeGeneres that she plays on the Ellen show, and is one of the best fun games to play with friends!<br><br>Love playing charades games? Looking to play games on Zoom with friends? Heads Up is one of the best word guessing games you’ll ever play! From naming celebrities, to singing, to silly accents - it’s a perfect house party game and a fun charades app to play at your next family game night. Just guess the word on the card that’s on your head from your friends’ clues before the timer runs out!<br><br>Guess the word in one of our popular categories, including fun game decks like Harry Potter, Friends, and Marvel, or create a category all your own! <br><br>How to play Heads Up:<br>Pick a card deck category - check! One player holds the phone to their glorious forehead like a headband, and 3, 2, 1! Go! Try to guess the words with friends excitedly shouting clues! Got an answer right? Ding! Tilt your head down and keep on ruling this guessing game, you genius! Can’t guess what it is? Don’t stress! Just tilt your head up and skip to a new catch phrase. So get your head on straight, and enjoy one of the best party games!<br><br>Looking for guessing word games to play with friends? Play Heads Up and enjoy this hilarious charades game, your favorite humans shouting clues your way as you enter 60 seconds of guessing glory!<br>Stuck at home and looking for some fun quarantine games to play with your kids? Heads up free app  is a game for all ages and it’s the best charades app online for your next houseparty! <br><br>Cool Game Features:<br>🙌 A Nonstop fun games to play with friends at the next dinner party and at family game night (dad jokes welcomed)<br>🙌 Draw a new game card simply by tilting your phone &amp; head up! <br>🙌 Guess what! You can keep videos of your hilarious game play for your own amusement, or share them right to Facebook! Keep those hilarious family game night memories forever<br>🙌 Want to play games on Zoom with friends? Take it online and enjoy some fun quarantine games with friends or with hundreds of players at once!<br>🙌 Diverse categories let you challenge your smartypants friends and entertain your kids for hours, all from one app <br><br>Who am I? Guess! Ok, I’ll tell you. I’m your house party game that all your friends will love! Raise your hands up in the air, tighten your headbands, guess the words with friends and let the houseparty begin!<br>It’s time for some dinner party games with 40+ themed decks so the fun games never have to stop! <br><br>Card Decks include: <br>👩‍🎤  How well do you think you know Celebrities and Superstars? Try guessing Icon Legends &amp; Stars<br>🎬 Movie fan? Try guessing some Blockbuster Movies <br>🎧  Hey Mr. DJ!  Turn the music up and guess the song! <br>🦊 Heard what the fox said? Come guess the Animals gone WILD deck!<br>💃 Hablas español? Come guess the gibberish in Accents and Impressions  deck!<br>🎭 Want some no-volume fun? Mimic it your way in Act it Out deck!<br>🤳 Feeling Trendy? Check out Pop Culture   and stay flashy<br>🙌 And lots more!<br><br>From the talented developers that brought you multiple Warner Bros fun games such as Psych! and Game of Games - Heads Up! will get EVERYONE excited for family games! Other party games won’t stand a chance once you and your friends start playing these ridiculously fun word guessing games!<br><br>Seriously, we mean it. Get your headbands on, stretch your head up, head down, and side to side. Now you’re ready to play! Guess the word and WIN!<br><br>✨ Game night fans, your new favorite charades app is here! ✨<br><br>1. Ad Choices: policies.warnerbros.com/privacy/en-us/#adchoice<br>2. Terms of Use: policies.warnerbros.com/terms/en-us<br>3. Do Not Sell My Personal Information: privacycenter.wb.com/do-not-sell<br>Embedded webview is needed to display the opened hyperlink to the Privacy Center","https://play-lh.googleusercontent.com/0JRLrt7TXmuZBWnPi1XbOUoI6flxOCUFPesFitWiQxctmw3wZ08yNf4Yog3jaioFzQ","GAME_WORD"
"Associations - Word Games","com.hitapps.associations","Looking for word puzzle and word games? Meet free word game Associations! A completely new and unique free word game Associations. Get free word puzzles for your android phone and tablet to play word association games to get relaxed! Associations is one of the free word games that can be enjoyed anywhere - at home, on vacation or in nature, while waiting or before going to bed. Whenever you start to play Association, it&#39;s always the right time.<br><br>How to play a word association game? The rules of this free word puzzle game are not that tricky, yet challenging:<br>● each word game level opens a set of words<br>● connect words from one group<br>● build a strategy for completing the level<br>● find all connected words from each topic<br>● words from the same free word association can be far apart, pay attention<br>● complete word puzzle<br><br>In the Associations free word game is no need to guess the word, you search for the right word, connect words and complete the association row.<br>With each level the puzzle game becomes more difficult, there are more word riddles. Switch on logic and ingenuity to win! Playing a fun casual game Association is free, and you will improve your logic skills, enrich vocabulary and have lots of fun.<br><br>Our word game helps:<br>● To improve logical thinking<br>● To build logical word connections<br>● To strategize word game<br>● To expand words knowledge &amp; vocabulary<br>● To improve spelling skills<br><br>The Associations free word puzzle game provides you with a fun way to flex your brain. Use your knowledge, erudition and vocabulary to succeed.<br><br>Why you will love Associations:<br>● multiple word game levels to play<br>● tons of free word riddles to solve<br>● word association from different topics and areas<br><br>Wait no more! Let’s dive into Associations and play the amazing word game for free.","https://play-lh.googleusercontent.com/Zmo3LaDwtQiHXfRP68HtuEy0qo7pm4VKVho_n7igEUv7FEAXkYAufquS7401jgBg2v69","GAME_WORD"
"Bible Word Puzzle - Word Games","bible.wordgame.words.connect.crossword.cookies","Play this fun Bible word game! DOWNLOAD this easy Bible Word Puzzle Game!<br><br>It is a word connect game that you will learn Bible words, unlock Bible verses, pass Bible quiz and solve Bible puzzles with friends. Bible Verse Collect starts as an easy word game but gets difficult as playing more word puzzle and Bible quiz challenges. DOWNLOAD Bible Verse Collect, the easy, yet, ADDICTIVE word connect game！<br><br>How to play?<br>- Connect letters to build a valid word<br>- Search for all the hidden words to get tons of extra coins<br>- Shuffle it or get a hint to find various words<br>- Take a screenshot and play with your friends on Facebook!<br><br>Why Bible Verse Collect?<br>- A featuring Biblical word puzzle game<br>- Play word games OFFLINE anywhere anytime<br>- Play word puzzle games with friends<br><br>Features<br>- Collect words and verses to unlock word games and bible quiz<br>- Daily rewards and coins every day<br>- Over 900 levels to play word games<br>- Challenging Bible quiz and fun word puzzles<br>- Bible word games are perfect for christians and Bible quiz designed for christians<br><br>Bible Verse Collect is a word connect game for christians. The more words found, the more fun it gets. It starts easy but gets harder! Play Bible Verse Collect, solve word game puzzles, share Bible word game experience with friends!<br><br>Get Bible Verse Collect for fun Bible word games! Bible Verse Collect is perfect for word games fans, word connect addicts, and word puzzle game masters!<br><br>Play Bible word connect games and word puzzles now in Bible Verse Collect. The good way to study the Bible and learn Bible words while playing bible quiz game! Bible Verse Collect includes Bible educational games, Bible word search games, and Bible games for christians<br><br>Enjoy word games and solve word puzzles in Bible Verse Collect.<br><br>Bible Verse Collect requests access to your pictures when you use Setting-Contact Us-Upload pictures, and uploads the pictures you choose to our server, so that your feedback can be resolved faster.<br>We do not sell any personal information you provide us, nor do we share your private information without your consent.<br><br>Keep in touch with Bible Verse Collect<br>Send us Email: game_support@idailybread.org<br>Follow our page: https://www.facebook.com/bibleVerseCollect/<br>Visit our website: https://oakevergames.com/","https://play-lh.googleusercontent.com/gDr8pWNMTFzAKVqBjK2oDDnmsla8mmanO8a6SkaZvMUcJhZw4AaLG3L1UUy72BRlRQ","GAME_WORD"
"Word Yatzy - Fun Word Puzzler","com.funcraft.whamzee","Word Yatzy is your new favorite word game. What happens when you combine classic scrabble board and add the amazing gameplay of Yahtzee? Meet Word Yatzy - the best new game to train your brain.<br><br>Word Yatzy is more than just a scrabble game with friends. How good are you at spotting words from a random set of letters? Do you have the Yahtzee skills to fill all 5 slots and score big?! Get ready to test your word and strategy skills on this new addictive word game!<br>In this game, you have unlimited games and unlimited boards. Play as much as you want, as long as you want, against as many people as you want. No limits on your play at all! That’s because we believe in the power of play!<br><br>Word Yatzy is a turn-based game where two players compete for the highest score.<br>- Start with 7 letters and use those letters to create words and play them on the gameboard for a ton of points.<br>- Roll your letters like dice to see if you can build those high-scoring words.<br>- Place high scoring letters (hello Z and Q) on tile bonuses for huge rounds!<br>- If you can fill all 5 slots, you’re guaranteed a huge +100 bonus!<br>- No time limit on moves means you can play at your own pace<br>- Games are 5 rounds and quick! Finish a game in minutes and start another one!<br><br>Play with a friend or other Word Yatzy players - people are always ready to play!<br><br>CLASSIC GAMEPLAY WITH A TWIST<br><br>PLAY WITH FRIENDS AND FAMILY<br><br>FIND YOUR MATCH<br><br>This free puzzle word game will be a new anchor in your phone. With quick turns, Word Yatzy is the perfect word game to fill those “waiting for the bus” moments. It’s a great way to sharpen your mind and train your brain. Use all those letter tiles and get them on the board for the highest points. Do you have the skills to compete? We hope you enjoy and relax with Word Yatzy like millions of other players. This game continues to grow - we hope you join our fans and help us keep growing the word community! Come join us!<br><br>Word Yatzy is the most addictive and enjoyable way to train your brain. Yatzy!<br>FunCraft proudly made Word Yatzy. We make daily ritual word games and hope you enjoy your experience!<br><br>Privacy Policy:<br>https://www.funcraft.com/privacy-policy<br><br>Terms of Service:<br>https://www.funcraft.com/terms-of-use","https://play-lh.googleusercontent.com/K0jXi2iCrnxZ-sTAkVfEGQAyhWk8ID0EaakYcPjfBpLxJXCPyNMth9ii5YcCgEk8KA","GAME_WORD"
