Game Name,Package Name,Description,Icon URL,Category
"Live Star: YOYO Doll Dress Up","com.yoyogames.anime.star.princess.doll.dressupgames","Discover the makeover world of fashion and fun in LIVE STAR: YOYO Doll Dress Up Games! 👗 Immerse yourself in an interactive magic princess universe where you can style, makeup, and dress up! <br><br>DRESS UP AND SHOWCASE YOUR STYLE 🎀<br>Dress up your Paper Princess in trendy outfits. Get Creative with Makeup and Personalize Your DIY Paper Doll! Transform the princess doll with a stunning makeover, dress up in fashion, and perfect princess look with exquisite makeup. Flaunt your fashion paper doll sense, snap a photo, and share it with your virtual friends circle!<br><br>INTERACTIVE LIVE BROADCASTS 📺<br>Get your princess paper doll ready to shine in the live room after dressing up! Experience the live makeover of a super idol through interactive streaming, winning the love of fans who like makeup.<br><br>FIERCE FASHION BATTLES 🏆<br>Enter into the makeover world of competitive makeup and dress up! Pick your star idol character and shine in thrilling fashion battles with other stylists! Turn anime princess doll into a idol star and you can become the super stylist everyone admires.<br>With the live idol makeover PK feature, stride confidently on the ramp of fashion in a 2D anime yoyo doll dress up game world with a beauty makeup that leaves spectators awestruck. Transform a Paper Doll with Fashionable Makeup in the Ultimate Style Challenge! Dress up, makeup, and makeover to standout in every outfit makeover clash! Live out your paper doll princess fashion dreams and give your Live Star a makeover! <br><br>VIRTUAL SOCIAL CIRCLE 🤝<br>Our makeup game offers a virtual social platform for players to mingle, meet new friends and share their dress up and makeup styling adventures. Players can share their outfits and makeup experiences here and interact with other players!<br><br>💄 Packed with 2D cartoon princess style makeover girl games, live broadcasting elements, thrilling dress up challenges and a virtual social network, it’s not just a dress up game, it’s your very own fashion runway!<br><br>💃 Step into this fashion paper doll makeover world, download LIVE STAR: YOYO Doll Dress Up Games and let your fashion princess style shine! Become a shining makeover master – the makeup journey starts here!<br><br>✨Contact Us✨<br>– FB Group: https://www.facebook.com/groups/152003920448574<br>– Email: yoyogames.studio@gmail.com<br>– Youtube: https://www.youtube.com/channel/UCSAAS6shg37jLQGd4GhqvAA","https://play-lh.googleusercontent.com/WUCsuIL2G6WP3hfi1TI-J5JTu8zgSAcvrHEvBbcGueZVi7m_BkacCzXlw-R1RDQVAFY","GAME_SIMULATION"
"Ramp Car Games: GT Car Stunts","com.fundrivegames.mega.ramp.ultimate.cars.stunts.impossibletracks","Fun Drive Games presents a mega ramp car game. Immerse yourself in the adrenaline-pumping world of extreme car stunts with the mega ramp car stunt game. Are you ready for the ultimate driving challenge that the mega ramp car stunt game offers? Embark on a journey where precision and skill are your best allies as you navigate through the intricate tracks of the mega ramp car game.<br><br>The mega ramp car game 3D is a true test of your driving prowess. Take control of powerful vehicles and conquer gravity-defying jumps, loops, and twists. With the mega ramp car racing game, every leap is a heart-pounding adventure that pushes the boundaries of possibility. Experience the thrill of speed and precision as you perform jaw-dropping stunts in the mega ramp car stunt game. Each level of the mega ramp car stunt game presents new challenges, demanding strategic planning and split-second decision-making.<br><br>Challenge yourself to reach new heights of excitement with the mega ramp car stunt game. Feel the rush as you launch your vehicle off towering ramps and soar through the skies. The mega ramp car racing game is a symphony of speed and daring maneuvers. The mega ramp car game offers an array of vehicles, each meticulously designed to handle the demanding stunts ahead. From sleek sports cars to rugged off-road machines, the mega ramp racing car game 3D lets you choose your steed for the ultimate adventure.<br><br>Prepare to be captivated by the breathtaking visuals of the mega ramp car racing game. From stunning vistas to intricate track designs, the mega ramp car stunt game is a visual feast that complements its heart-pounding gameplay. The mega ramp car racing game is not just about speed, it&#39;s about mastering the art of control. Develop your driving skills to perfection and show off your prowess as you navigate the complex courses of the mega ramp car stunt game.<br><br>Navigate your way through the challenging levels of the mega ramp car stunt game and unlock new vehicles, tracks, and customization options. The mega ramp car stunt game rewards your progress with thrilling new content that keeps the excitement alive. Get ready to experience the ultimate thrill ride with the mega ramp car stunt game. The ramps are your playground, and the sky&#39;s the limit as you push your skills to the edge in the mega ramp car game.<br><br>Are you up for the challenge? Take on the mega ramp car stunt game and become a master of extreme stunts. The mega ramp car stunt game awaits, offering you an exhilarating adventure like no other. So, gear up, rev your engines, and take the plunge into the world of high-flying, heart-stopping action with the mega ramp car stunt game. The ramps are calling, and the stage is set for you to shine in the mega ramp car game. <br><br>Key features of Mega Ramp Car Game:<br><br>- Numerous luxury racing stunt cars <br>- Multiple car racing tracks with HD graphics<br>- Realistic &amp; smooth controls of the mega ramp car game<br>- Authentic sound effects of the racing car game<br>- Car games simulator challenges with the excitement of car stunts<br>- Perform dangerous stunts in the mega ramp racing game<br>- Multiple camera views <br>- Engaging &amp; challenging levels <br><br>Give your valued feedback so that we can improve your favorite ramp racing car game 3d.","https://play-lh.googleusercontent.com/b-fl7GA2AZhvgf7F0XmsHZfNU9oQHYWrNdsathUs9TONdPIN4rcJe4bMFEKyohUEsHo","GAME_SIMULATION"
"Idle Miner Tycoon: Gold & Cash","com.fluffyfairygames.idleminertycoon","Are you a true gold miner? Become a mine factory tycoon, build an empire, earn money, build a business, level up, make more money and get rich in this idle tycoon simulator game where you can make money by investing!<br>Expand your millionaire mining and increase productivity with gold miner who will automate the workflow of your factory! Discover the manager strategy to invest in and earn as much cash as possible in this idle tycoon simulator - Live as an idle hero millionaire tycoon! Be a gold digger and start digging for gold now! Are you ready to become an idle hero in this epic adventure to become a gold miner?<br><br>Do you like idle clicker tycoon games and earning money simulators? Want to be a gold digger? Idle Miner Tycoon game is a simulation that mixes mining management and earning tons of money to become a rich capitalist millionaire. Unlike other simulator and clicker tycoon games, the aim of this epic miner adventure tap game is to build gold resources and level up to gain as many idle benefits as possible: with the income that you make from the mine, you will have to hire and pay managers, upgrade your factory as well as optimise your miners. It differs from the other idle money tap games because you can become a mine manager capitalist, build a millionaire factory, and earn money by optimizing the workflow with cash inc in this money game like in a clicker simulator. Make more in this idle simulator until you become a rich idle hero capitalist! Enjoy this epic miner tycoon adventure with no adcap, try this tap game and become a gold miner.<br><br>IDLE MINER TYCOON SIMULATOR: MAKE MORE MONEY &amp; GOLD<br>★ Automate your mine to make more idle cash income: No need to tap like in an online clicker simulator! Enjoy this addicting tycoon simulation game and level up!<br>★ Get idle cash inc and earn money &amp; gold: Stay in business when you&#39;re offline!<br>★ Profit from investments and get rich! Taps to riches to become an epic idle hero millionaire among this offline simulator game with no adcap!<br>★ Hire a manager to increase your miners’ motivation for digging! The mining simulator among tap games.<br>★ Build up your idle billionaire empire simulation without the endless clicking you experience in other clicker money games and adventure games!<br>★ Manage and upgrade more than 20 mines like a boss: Become a mining tycoon by managing this miner simulator! Taps to riches for becoming an epic idle hero and upgrade your mine!<br>★ Become a true gold miner! Manage more than 15 resources: coal, gold, and jade, making this different than all other idle tycoon games.<br>★ Collect coal, gold and cash inc in this mine factory simulator like a gold digger! It&#39;s not like other money games with no adcap!<br>★ Increase your money and gold and taps to riches in this offline adventure simulator!<br>★ Make more and upgrade your mine, level up and become the richest factory manager tycoon in this idle miner simulation!<br><br>Unlike other simulator games, you get the chance to become a miner billionaire by automating the mine workflow simulation of your magnate business . Get rich, purchase new mines and buildings, invest cash and taps to riches to become the greatest miner ever in this mining and digging simulator! Try the money games and manager games, unlike other idle tycoon games with adcap!<br>Earn by selling resources in this miner tap game manager simulator. Dig out the gold and get rich! Taps to riches and become a capitalist millionaire tycoon! Enjoy this Idle Miner Tycoon game!<br><br>Like Idle Miner Tycoon on Facebook✔️<br>https://www.facebook.com/idleminertycoon/<br><br>Instagram ✔️<br>https://www.instagram.com/idle_miner_tycoon/<br><br>Twitter ✔️<br>https://twitter.com/idleminer<br><br>Discord ✔️<br>https://discord.gg/h6JkbaK<br><br>Any problems or suggestions?<br>Contact: community@idleminertycoon.com<br><br>❤️ Your Idle Miner Tycoon Team ❤️<br><br>Imprint: https://www.kolibrigames.com/impressum/<br>Privacy Policy: https://www.kolibrigames.com/privacy-policy/<br>Terms and Conditions: https://www.kolibrigames.com/terms-and-conditions/","https://play-lh.googleusercontent.com/QfLR8ihdAADvj2ee2zy1i1Ue58Czb4pIwpF5vi2MrJaB3iKXGcH14xjQY8VpH-TzS38","GAME_SIMULATION"
"Nextbots In Playground mod","com.rimashev.nextbots.sandbox","A simple playground game, where you create your own scenarios. <br>Let your imagination loose with the wide variety of items at your nextbots: weapons, guns, cars and allies!<br>Nextbots follow you. Run and fight trending memes. Complete freedom of action!<br>Garrysmodsandbox is a fast-paced modern FPS shooter against nextbots.<br>Do you like online shooters and multiplayer gun games? This is the best trending 3D real-time first-person shooter. Scary games chasing on the top maps! <br>Unleash your creativity in building games. Craft your own world or construct simple structures online in the physics playground. Become a renowned builder in the world of playground games.<br>Playground - a popular physics simulator playground game. Enjoy playing alone or join your friends for an exciting multiplayer experience, whether online or offline.<br>Experience a 3D physics playground where you have complete control over a wide variety of objects in a virtual world. Explore the limitless possibilities of this playground environment. Whether you choose to play online with friends or offline on your own, Nextbots playground offers an unparalleled playground experience.<br>If you are a fan of such games as Gmod, Garry&#39;s Mod, then this game is definitely for you! All fans Gmod, Garry&#39;s Mod will love it!<br>Play with your friends, you will enjoy PvP shooting on your mobile device! <br>Play in playground mode and realize your craziest ideas!<br>Kill other players and run away from the nextbots in playground.<br>If you&#39;ve always wanted to play a  FPS multiplayer shooter garrys, now your dreams have come true! Scary games in the Horror genre where you play hide and seek granny, or chasing boss Granny. <br>You will appreciate the horror &quot;playground&quot; in Big city! <br>Try to hide in the backroom as long as possible in the match before next boat chases and finds you. New &quot;playground game&quot; nextbots online! <br>&quot;Nextbots in backrooms&quot; contains various types of realistic weapons and cars.  <br>The world of back rooms is a real arms war.  melon playground<br>Open new maps, but be careful, because at every step there could be someone waiting for you:<br>Alternative<br>Amogus<br>&quot;Armstrong&quot;, <br>Avatar<br>Banana<br>Boys<br>Gigachad<br>Hasbik<br>&quot;granny&quot; ,<br>Gru<br>Isaac<br>&quot;Rosalia Bizcochito&quot;, <br>jerma<br>Nerd<br>&quot;melon playground&quot; ,<br>Michael Jackson<br>&quot;people playground&quot; ,<br>Nico&#39;s<br>Shukri<br>Wenomachainsama<br>&quot;Obunga&quot; ,<br>Gorebox<br>Quandale<br>Saul<br>The Rock Dwayne Johnson<br>&quot;Selene Delgado&quot;,<br>Shrek<br>Bop<br>Sidorovich<br>Sanic<br>Wednesday nextbot<br>Scary games and chase backroom - what awaits you! Choose allies super  and win the multiplayer match!<br>Just imagine being chased by granny, or melon playground, or Obunga. You can become yourself and chase People playground.<br>In the shooter, you be presented with a huge arsenal of weapons- gun for every taste!<br>BECOME THE STAR PLAYER: Climb the local and regional leaderboards to prove you’re the greatest gamer of them all! fps counter strike (csgo) multiplayer shooter! Best gun games :)<br>&quot;Nextbots playground&quot; - chase and scary creatures in this free atmospheric horror game. Discover heart-thumping terror, chase and scary creatures in this free atmospheric horror game.  In the playground, you can have fun with other players from all over the world and easily obtain rewards by opening gift boxes and treasure chests. Play as legends of horror and see through their eyes in a variety of Realms and unpredictable Trials. Best scary and horror playground game!","https://play-lh.googleusercontent.com/7m3C35VZ7ScTSgLtThMEN21WrAjy0f6u-h4wVR8ooBmrkSmmryAECG1-iXM5jPwVhg","GAME_SIMULATION"
"Avatar Life World: My Story","com.avatarlife.avatarstory.mystory.myworld.mywonder","🌈 Welcome to &quot;Avatar Life World: My Story&quot; - an open-world game🎮 where creativity knows no bounds, and your story unfolds in diverse locations📍 , featuring a plethora of characters👭 with unique emotions😍 and a treasure trove of cute items❤️ for decoration. Embark on a delightful journey as you design your avatar world, crafting unique narratives that reflect your style🎨️ and personality🤹.<br><br>🎨Most importantly, have fun! &quot;Avatar Life World: My Story&quot; is a platform for creativity and self-expression. Explore, interact, and create your own unique story.<br>Whether you want to design your dream home, socialize with virtual friends🍓🍰, or embark on exciting adventures, &quot;Avatar Life World: My Story&quot; provides a playful and immersive experience where you are the storyteller. No limits, and no boundaries—play at your own pace, and let your creativity soar. 🌟🕹️<br><br>🌟 KEY FEATURES:<br>📍 Diverse Locations: a rich and diverse world with captivating locations, including houses🏡, hospitals🏥, schools🏫,...<br>⚡Multifaceted Characters: Encounter a multitude of characters, each with distinct emotions😜, personalities🎀, and styles🎗️<br>🎀 Cute Art and Decor: an adorable art style with a plethora of cute items for decoration.<br>🙂 Personalized Emotions: Engage with characters who express a wide range of emotions. From happiness😊 and playfulness to crying and anger.<br>🌌 Regular Updates: Stay excited with regular updates that bring new content, features, and possibilities. The evolving nature of Avatar Life World ensures a fresh and dynamic experience for players.<br><br>🎮 HOW TO PLAY:<br>✨Install the game on your device.<br>✨Start by choosing your favorite characters, and customize their skin tone, hairstyle, face👦, and outfit👗 using the available options.<br>✨Exploring different locations within the avatar world, each location offers various opportunities for interaction and creativity.<br>✨Encounter a diverse cast of characters with different emotions😊 and personalities🌟. <br>✨Make friends, engage in conversations, and explore the stories of these characters.<br>✨Personalize your living spaces with cute items and decorations.<br>✨Use emotional expressions to create dynamic and relatable stories within avatar life.<br><br>🚀 Take advantage of the open-ended nature of the game to craft your own stories. Keep an eye out for regular updates from the game developers. Updates may bring new locations, characters, items, and features, keeping the gameplay fresh and exciting. <br>🕹️Download &quot;Avatar Life World: My Story&quot; now and unleash your imagination in an avatar world where every moment is a new chapter in your story! 🚀","https://play-lh.googleusercontent.com/NZv_wzphuU9Dlfb83KFeBF8mV1nUQ9LWoeMMFGfUEL6qonVJD-zR0uh_GpEWKY3jnGU","GAME_SIMULATION"
"Business Empire: RichMan","com.ttterbagames.businesssimulator","<b>Business Empire: RichMan is more than just a passive business game simulation where players make investments and watch their earnings grow. It&#39;s an interactive online or offline business game simulator that allows players to make strategic business decisions and take calculated risks to build their business empire.</b><br><br>Install Business Empire: RichMan and discover a variety of options to build your empire and reach new heights of success. You can choose to <b>open businesses in six different categories, including retail stores, restaurants, and banks. </b>With the ability to hire employees and make strategic decisions, you can grow your businesses and increase profits.<br><br>For those of you who prefer to <b> invest in the stock market</b>, Business Empire: RichMan allows players to buy virtual shares in famous companies and monitor their investments to maximize their virtual earnings. Alternatively, players can invest in real estate in the most elite areas of the world, generating passive income and increasing their net worth. Other than buy and sell stocks, players are welcome to also invest in cryptocurrencies.<br><br><b>Luxury items are also available for purchase in the game, including high-end vehicles and private jets.</b> With the ability to expand your own fleet and hangar, you can travel in style and enhance your status and prestige.<br><br>Overall, Business Empire: RichMan is a highly interactive game that provides players with a realistic and engaging business management experience. <br>Whether you want to open your own business - a store or a bank, become an investor, or purchase luxury items, Business Empire: RichMan has something for everyone. The simulation game&#39;s immersive and interactive gameplay provides endless possibilities for players like you to build your empire and become a true RichMan.","https://play-lh.googleusercontent.com/Qx11fSZl2rs_qTS7OE5V2cSt3tLEh0VFiMaJmovLQkM2j_gx9WCVQreCvUtO5CIzUg","GAME_SIMULATION"
"Rope and Demolish","com.omer.ropeanddemolishhh","You have never played a game like this before!<br>Wire rope and demolish!<br>Lots of different buildings!<br>Addictive gameplay with easy to learn controls!","https://play-lh.googleusercontent.com/FsN6gVmHHp8IfRjbFYyeTJt4XpewT3jipN5EWazkX8E-2CDr6u3lCbH0FK9dH_F1MDt2","GAME_SIMULATION"
"Fidget Toys Trading・Pop It 3D","com.fidgettrading.game","Psst! Wanna some squishy magic? Get into the engrossing world of fun pop it games full of cool fidgets!<br><br>Out of all antistress relaxing games, our fidget toys 3D sim will def let you chill out! You can get into it at home, in a park, at an airport—anywhere you seek stress relief or feel bored. Try yourself at a fidget trade and play with every cool and comforting pop it or squishy!<br><br>Our pop it trading game will become your perfect solution to any situation! Have some sleep problems, or just being overwhelmed and needing anxiety relief? Get into this calm game developed for you to have fun and take a break from the outside world! Find it difficult to concentrate on a task? Try trading fidget toys 3D to refill your attention bar.<br><br>This amusing trade game gets you in the fidget toys trading filled with squishy puppets and bubble pop its of various shapes and colors! Ever tried squishing a unicorn or a pumpkin? Or pop it bat and dinosaur? Believe it or not, this is way more fun than just a spinner. <br><br>The more you swap, the more toys you’ll get. Throw any toy onto a table and wait for your opponent. Accept the offer and finish the fidget trade, or demand more. Reject it if you don’t like the bid. After every completed deal, you’ll also get coins! Upgrade the trading room or get new toys with them.<br><br>Our trade game is better than other antistress relaxing games. Look at it yourself!<br><br>Gripping and bright gameplay. You should see through your opponent to hit the jackpot and master the fidget toys trading!<br>Simple game mechanics. There are three options in this perfect game for stress-relief: swap, reject, or demand more. Don’t you think it’s easier than in any other slime simulator—yes or no?<br>One of the most popular fidget trading games for some stress relief. You can not only join the pop it trading, but also play with various puppets to unwind!<br>Perfect game for concentration. Fidgets help us return our attention. So, to restore your energy, why not play some fidget trading games?<br>Fantabulous toys. This calm game has more than a spinner—a milk bag squishy puppet, a dinosaur simple dimple, and even a jellyfish bubble pop it! Get each of them in your chill games.<br><br>Get every squishy puppet and pop it toy to find anxiety relief in this fascinating game! After all, it’s a unique blend of the fun of any slime simulator and the soothing mechanics of any stress-relief game.<br><br>It’s time you unleashed the squishy magic in one of the most engrossing chill games! Download this trading game now and master every deal with some fun pop it games! Are you ready? Yes or no?","https://play-lh.googleusercontent.com/Uwvq4KeTDcjEBAvz0OkBOcwX4Ps44VIMdElXtDdP7vzxgrj7NGT8SZx2C9hBra6_oQ8","GAME_SIMULATION"
"Makeup Kit - Color Mixing","com.apetrus.makeup","Are you ready to become a dolly makeup artist in this dreamhouse color match makeover studio? Let your creativity soar as you embark on a journey of stylish transformations for a sweet doll. As a makeup stylist in this dreamy studio, your expertise in beauty care will shine through in each makeover you create. This ultimate princess makeup game is here to fulfill your dolly dreams of merging colors in a captivating merge studio.<br><br>Indulge in the joy of color mixing and unleash your inner makeup stylist! Become a graphic designer for the fashion world and create the perfect eye art with a flawless eyeshadow palette in Makeup Kit - Color Mixing game. Experience the excitement of DIY Makeup, but take it a step further in this immersive makeup game.<br><br>With every color match and perfect selection, you&#39;ll unlock new possibilities to elevate your makeup stylist skills. Dive into the world of makeovers and witness the magic of sweet doll transformations. As a makeup artist, your mission is to craft stunning looks and make each doll radiate beauty care.<br><br>In this captivating makeover studio, your creativity knows no bounds. Explore endless combinations, color match with finesse color mix, and discover the true essence of princess makeup. From subtle elegance to bold and glamorous, your doll makeovers will dazzle in every style imaginable.<br><br>So, get ready to embrace your inner makeup artist and create magnificent looks in this beauty care makeover studio. Let your imagination run wild and release your artistic flair with this sensational Makeup Kit - Color Mixing game.<br><br>Unleash your creativity, embrace the joy of color mixing, and paint a world where every girl can be a sweet doll transformed by your magical touch. Indulge in the princess makeup experience you&#39;ve always dreamed of, and let this mesmerizing dolly merge studio be your artistic playground.<br><br>Color mixing is fun like DIY Makeup and making your own eyeshadow palette is just as cool as going to the lash salon! Get ready to embark on an enchanting journey where makeup artistry and imagination merge into a stunning masterpiece!<br><br><br>To opt out of CrazyLabs sales of personal information as a California resident, please visit our Privacy Policy: https://crazylabs.com/app","https://play-lh.googleusercontent.com/0HjD19eHY5BlunqSwovrXE0AJiooVxrGSKx1oT-EyNCwaAoSoQyTDd5EkgPnSI8a_w","GAME_SIMULATION"
