Game Name,Package Name,Description,Icon URL,Category
"Solitaire - Classic Card Games","com.mobilityware.solitaire","<b>Solitaire by MobilityWare is the original &amp; best free Solitaire card game!</b><br><br>Experience the timeless fun of Solitaire with MobilityWare’s Solitaire game, the most popular and original Solitaire card game on the Play Store. Join <b><u>over 100 million players</u></b> who enjoy the ultimate Solitaire card game experience.<br><br>Why You&#39;ll Love Klondike Solitaire:<br><br>Classic Solitaire card game with a Modern Twist:<br>♠ Play the timeless Klondike Solitaire for free, brought to life with stunning graphics, smooth animations, and a classic interface.<br>♠ Regular updates ensure that our free Solitaire card game always offers fresh content and exciting features.<br>♠ Solitaire offers helpful hints and unlimited undos to enhance your card game skills.<br>♠ Klondike Solitaire card game is free. No cash required.<br><br>Daily Challenges &amp; Rewards:<br>♥ Take on unique Daily Challenges and earn crowns.<br>♥ Cash in on the rewards! Collect trophies each month by winning more crowns.<br>♥ Replay daily deals as often as you like for endless fun and rewards!<br>♥ Participate in free weekly Solitaire events to earn badges and unlock exclusive rewards.<br><br>Engaging &amp; Addictive:<br>♦ Choose between Draw 1 card or Draw 3 card modes of Klondike Solitaire.<br>♦ For Solitaire enthusiasts seeking a greater challenge, opt for Draw 3 card game mode.<br>♦ Play winning deals that test your strategy and card skills.<br>♦ Train your brain with new and challenging card puzzles every day.<br><br>Brain-Boosting Fun:<br>♣ Klondike Solitaire is the perfect card game for players of all skill levels, offering strategic and engaging card puzzles.<br>♣ Perfect for fans of brain games and those looking to sharpen their mind.<br>♣ Train your brain with fresh daily challenges and card puzzles, providing a new Solitaire experience every day.<br>♣ Solitaire offers helpful hints and unlimited undos to enhance your card game skills.<br><br>Customizable &amp; Convenient:<br>♠ Track your progress with our comprehensive Statistics Tracker.<br>♠ Personalize cards and tables to match your unique style.<br>♠ Upload custom photos for your playing cards and background.<br>♠ Choose between standard Solitaire or Vegas card scoring.<br>♠ Available in Left-handed Mode for added comfort<br>♠ Enjoy on your phone or tablet, in both portrait or landscape orientations.<br>♠ Unwind with Solitaire in Dark mode.<br>♠ Play classic Solitaire anywhere, anytime – online or offline, no WIFI needed.<br><br>Multiplayer &amp; Leaderboards:<br>♥ Share your victories and compete with friends on the Solitaire leaderboards.<br>♥ Challenge players worldwide in multiplayer mode and see who can achieve the highest scores!<br><br>Solitaire by MobilityWare is crafted by experts, delivering the best and most authentic Klondike Solitaire card game experience for free. As the original developers who brought the classic Solitaire card game to mobile, we continually update our Klondike Solitaire games with the fun-filled features you love. No cash required. Enjoy the ultimate classic Solitaire card experience from the pioneers of mobile Solitaire.<br><br>Is MobilityWare Solitaire for You?<br>If you enjoy free classic card games like Spider Solitaire, FreeCell Solitaire, Spades, and Gin Rummy, or other MobilityWare favorites like Castle Solitaire, Mahjong Solitaire, and Pyramid Solitaire, you’ll fall in love with Klondike Solitaire!<br><br>Join millions of players and enjoy the best free Solitaire experience available on Android. Download now and start playing the ultimate Solitaire card game for free!<br><br>http://www.mobilityware.com<br>http://www.facebook.com/mobilitywaresolitaire<br>http://www.mobilityware.com/support.php<br><br>LIKE US on Facebook<br>http://www.facebook.com/mobilitywaresolitaire","https://play-lh.googleusercontent.com/trsFOWkeuVbmN40ss88nfXDxXcOiH1IF3oJJOueRvcrQEf0gMYsTCzGbC6C-kgqZow","GAME_CARD"
"Vita Solitaire for Seniors","com.vitastudio.solitaire","Vita Solitaire is a groundbreaking new take on the Solitaire Classic Card Games, meticulously crafted for the senior audience. Immerse yourself in timeless card play with an eye-friendly easy-to-use interface that caters to both pad and phone.<br><br>At Vita Studio, we have always been dedicated to crafting classic mobile games designed for seniors that bring back relaxation, fun, and joy. Our repertoire includes popular titles like Vita Solitaire, Vita Color, Vita Jigsaw, Vita Mahjong, Vita Word Search, Vita Block, and more.<br><br>Why Choose Vita Solitaire?<br>•    Large Card Design: Our large fonts and oversized cards ensure that each game is easy on the eyes. This results in an exceptional solitaire game experience, whether you&#39;re using a pad or phone.<br>•    Classic Gameplay: Classic solitaire is one of the most addictive card games. We offer you the most classic rules and an authentic card gaming experience.<br>•    Brain-Training Challenge: Playing our free solitaire card game enhances problem-solving skills, mental alacrity, and can even aids in a getting a better sleep, making it a truly all around beneficial puzzle card game.<br>•    Smooth Interaction: Navigating through our intuitive card game interface is effortless. Whether you&#39;re a beginner or a seasoned veteran of solitaire, you&#39;re guaranteed to have a fantastic time in no time.<br><br>How to Play Vita Solitaire:<br>Playing free classic Vita Solitaire is made simple. Just tap or drag cards to arrange them how you want in descending order, with alternating numbers, colors, and suits. Moving cards to the foundation of the playing area, sorting all suits from Ace to King.  For an added challenge, choose to draw one or three cards in this classic solitaire cards game.<br><br>Exclusive Vita Solitaire Card Game Features:<br>•    Improve Your Skills: Opt for either Draw 1 or Draw 3 modes to experience the classic challenges.<br>•    Unlimited deck of cards: There are always a new patience solitaire card game to play.<br>•    Various Theme: Engage with different styles of cards and backgrounds under the classic gameplay.<br>•    Useful Hint: Endless hints &amp; undo which help you when you get stuck in the card game.<br>•    Daily Card Challenges: Take on daily challenges, collect trophies, and improve your skills.<br>•    Customized Card Play: Choose between portrait or landscape mode and select from a range of styles.<br>•    Rewards for Every Game: Collect suits or numbers to complete game tasks and unlock free rewards.<br>•    Game Statistics: Keep improving and challenging yourself during every free solitaire game.<br>•    Weekly Card Challenges: Participate in weekly solitaire journey to win trophies.<br>•    Multi-device: Optimized the classic games experience for both phone and pad of all shapes.<br>•    Offline Solitaire Card Game Play: Enjoy free solitaire card game offline anytime and anywhere without wifi. <br>•    Dynamic Card Updates: Regular updates ensure that each solitaire game free feels fresh and engaging.<br>•    VIP Solitaire Experience: subscribe for ad-free user experience so you can focus on the classic solitaire.<br>•    Multi-Card Games: Enjoy various card games for free such as Freecell, Spades, Mahjong Solitaire, and more.<br>•   Thoughtful Convenience: We colorblind mode, left-handed mode, and dark mode for solitaire players in need.<br><br>Vita Solitaire is a versatile card game made for those who love classic solitaire and card games. Download this solitaire game and enjoy it now!<br><br>Contact us via: support@vitastudio.ai<br>For more information, you can:<br>Join our Facebook group: https://www.facebook.com/groups/vitastudio<br>Visit our website: https://www.vitastudio.ai/","https://play-lh.googleusercontent.com/g_F_d7EShzH-cTXYnzkyGirHk2FLf4AjQ1uIBNMt48EA8jyw7W5sgFZKJUnx6ZeZlO89","GAME_CARD"
"Spider Solitaire Classic","solitaire.spider.card.free.mania","Spider Solitaire Classic is an addictive and relaxing card game!<br><br>The BEST Spider Solitaire card game is FREE now! Spider Solitaire Classic is the perfect puzzle game that not only kill your spare time but also train your brain! It is an offline game that you can play it anytime and anywhere! <br><br>🌟Highlights🌟<br>♥ Classic gameplay of Spider Solitaire<br>♥ Very Big and Easy-to-see cards<br>♥ Play Spider Solitaire games with any difficulty you like<br>♥ Train your brain by completing fun Daily Challenges &amp; Goals<br><br>🌟Key Features🌟<br>♠ Complete Daily Challenges to collect trophies<br>♠ Play Right or Left-handed<br>♠Customization: Change your background, card backs and card faces for a personalized experience<br>♠ Unlimited hints and Undoes<br>♠ Intelligent hints<br>♠ Auto-collect cards on completion<br>♠ Play offline anytime and anywhere<br><br>If you like Klondike Solitaire, FreeCell Solitaire, Pyramid Solitaire, Blackjack and other card games, which require skill, strategy and a lot of patience, then this spider solitaire is the best choice for you.<br><br>Download this card game for free, and play with your friends now!","https://play-lh.googleusercontent.com/riBVoJ7TlwCYccjdUZE7i6RjHvdJVO-vk74_XpjDR_x94gUXxeg9PmRrrhNFctaVub4","GAME_CARD"
"Spades: Classic Card Games","com.mobilityware.Spades","Play a FREE Spades card game on your Android device, made by MobilityWare!<br><br>This fun trickster cards game is the classic Spades but with a fresh new look on Google Play, featuring brand new goals for you to reach! <br><br>If you enjoy popular free card games like Hearts, Rummy, Euchre, or Pinochle, then you’ll love this spades game. It is often compared to Poker, but instead of betting with chips and bluffing, it&#39;s a trick-taking card game where players rely on their card-playing skills and communication to win tricks and reach their bid with each level. Whether you were taught Spades by a family member or a friend, practice will allow you to develop the best strategy and poker face. <br><br>We’ve also included tutorials to help you learn this fun and free Spades game at your own pace! Relax and train your brain, or go multiplayer with friends online and offline to compete in this classic trickster cards game of Spades! You’ll enjoy it if you’re a fan of popular free card games like Euchre, Pinochle, Rummy, and Hearts. <br><br>Spades adds a new element of strategy to the classic card game space. Play this popular trickster card game to sharpen your brain and relax! Players who love fun free card games like Hearts, Rummy, and Pinochle are sure to have a blast!<br><br>So what are you waiting for? Plan and strategize each move as you compete with a partner or multiplayer with friends to try and outbid and outplay your opponents at each level in this fun and free Spades game. Win the most books and be the first to get 250 points to win! Be careful, though; spade cards can only be played once they’re broken! You’ll need precision and strategy to master this trickster card game!<br><br>SPADES FEATURES:<br>Play the classic and relaxing version of Spades:<br>- Hop into the classic Spades card gameplay you love<br>- Drop-in-drop-out gameplay means Spades is ready to play whenever you are!<br>- Use expressive emojis to let your opponent know you are winning<br>- Play online/offline – bots are available to play whenever and wherever<br>- Need help? Use unlimited hints and undos<br><br>Introducing Special Opponents!<br>- Face off against a colorful new competitor every month and earn unique boosters, hats, emotes, and avatars to show off to your friends<br>- Embrace the rivalry, become the champion you were meant to be, and earn bragging rights<br><br>The classic Spades game, for free and for beginners and Pros alike:<br>- Go multiplayer with friends, over 300 titles to earn and collect throughout levels<br>- Track your high scores across several games<br>- Improve your card play with statistics. Watch as you improve your strategy through each game.<br><br>Play classic Spades online and offline, whenever, wherever you want:<br>- Choose the difficulty of AI and the rules of this popular and free Spades game<br>- Choose either portrait or landscape to play<br>- Never lose a game with save states, even when the app closes<br>- Add in sandbags or jump into hard card playing mode for more challenge<br><br>Train your brain with friends for competitive Spades gameplay and challenges:<br>– For beginners and pros alike! Learn to master the free card games of Spades alone or in multiplayer mode to improve your strategy with each game level<br>- Use Instructions in the app to build your Spades strategy, both in game and with your friends<br>- Sharpen your card skills with online and offline play! Track your multiplayer stats with friends in the app and watch as your Spades game improves with each level<br><br>If playing free card games like Hearts, Rummy, Euchre, Pinochle, or Poker is what you enjoy, then you’ll love the popular trickster card game of Spades. Play this free Spades game on your own or go multiplayer with friends!<br><br>https://www.mobilityware.com/spades<br><br>LIKE US on Facebook<br>http://www.facebook.com/mobilitywaresolitaire<br><br>NEED SUPPORT?<br>Have a question or something to say about your experience with our card games? Lay it on us because we are here to lend a helping hand.<br><br>http://www.mobilityware.com/support.php","https://play-lh.googleusercontent.com/p3h0rlTb0lPvAPoLIK_i-wwGAgmXSlOaDI2CeQo8dC-C1NhFwNZEdnCfyPlZIyHp-OU","GAME_CARD"
"Solitaire, Klondike Card Games","com.solitaire.daily.challenge.card.game","★<b>Do you like playing Classic Solitaire, Klondike solitaire, Spider Solitaire, Tripeaks Solitaire, Pyramid Solitaire, Mahjong Solitaire, FreeCell Solitaire, and any Patience solitaire card game?</b><br>★<b>Are you looking for a better classic solitaire card game to relax your mind and train your brain?</b><br><br><b>Solitaire</b> - <b>Classic Klondike Solitaire Card Game</b> by Solitaire Card Studio is very addicting and challenging. Our classic free solitaire card game with the unique gameplay of “Garden” is a good choice for relaxing and brain-storming!<br><br>&quot;<b>Solitaire</b>&quot; typically refers to <b>Klondike Solitaire</b>. It’s one of the most popular classic card games in the world, and the best-known solitaire card game in the US and Canada. Klondike Solitaire is also known as a Patience card game. People play the Klondike Solitaire card game as an exercise in patience. Klondike Solitaire is played with a standard 52-card deck, from Aces to Kings without Jokers.<br><br>In addition, we offer the unique gameplay -- “Gardens”. Unlock gardens and collect sunshine by completing the solitaire puzzle, grow beautiful flowers, build and decorate your own gorgeous gardens and share with your friends! <br><br><b>How to play</b><br>♠ To solve the Klondike deal, you need to tap, drag or drop to sort cards of 4 suits in ascending order, Ace 2, ... Jack, Queen, King.<br>♠ You will have 7 card column options where you can move one card or consecutive cards from one column to another.<br>♠ King or any consecutive cards starting with K can be moved to the empty columns.<br>♠ Click the draw pile and find the card you want if you get stuck. <br><br><br><b>Highlights</b><br>♣ Unique gameplay -- “Gardens”<br>♣ Customizable themes, card faces, card backgrounds, wallpapers and table design.<br>♣ Tons of colorful themes with great design: undersea, pets, seasons, moon, butterfly, horse, jellyfish, beautiful sceneries, cute animals, aquarium, waterfall, ocean fish and so on.<br>♣ Multiple, changeable and artistic card faces: Fish, pets, birds, food, diamonds and so on.<br>♣ Variety of beautiful card backgrounds: Birds, pets, flowers, plants, festivals, fruits and so on.<br>♣ Fantastic and stunning game win animations<br>♣ Level up, gain medals and show off to your friends<br>♣ Unlimited random decks<br>♣ Addictive, challenging and good brain training<br><br><b>KEY FEATURES</b><br>♥ Draw 1 card or 3 cards<br>♥ Winnable deck &amp; Random deck<br>♥ Daily challenges<br>♥ Daily tasks: Keep you busy and train your brain<br>♥ Unlimited free Hints and Undos<br>♥ Useful tools: Hint, Undo, Magic Wand<br>♥ Left-hand mode and right-hand mode available<br>♥ Timer, moves &amp; score<br>♥ Statistics tracker: Record your game statistics, your best time of a deal, victories and the highest score<br>♥ More than 150 solitaire deck backgrounds: The backgrounds make your solitaire game more beautiful and interesting, including beautiful scenery, cute animals, pretty flowers, live fish, birds, and so on.<br>♥ More than 100 solitaire card backs<br>♥ More than 10 solitaire card faces<br>♥ Changeable and creative animations of victory<br>♥ Customizable game theme, card faces and card backgrounds<br>♥ Offline available: You can play it anytime, anywhere.<br>♥ Auto-complete available<br><br>Come and play this popular free classic solitaire card game in the world! Our Klondike Solitaire game will bring you lots of fun and challenges, and also train your brain!! You will be the next Klondike master!","https://play-lh.googleusercontent.com/wzhD7O_yIyiEU9pQERkEuU2OythrWZRgKsbDdzyIi78V9M04qJdbFB5Vr5yzIFT9wR5t","GAME_CARD"
"Solitaire","com.solitaire.klondike.patience.ocean.aquarium","<b>Solitaire</b> is the great <b>CREATIVE</b> solitaire card games for you with an <b>AMAZING</b> ocean theme. Based on the solitaire gameplay, it is totally true to the spirit of the classic solitaire (also known as Patience) and it will help you to keep your brain smart &amp; sharp.<br><br>Besides the classic solitaire games, you can create your <b>UNIQUE</b> aquarium of the undersea world by collecting dozens of cute creatures, such as Clownfish, Rainbowfish, Bannerfish, Globefish, Butterflyfish, and Anglerfish, etc. More fishes are waiting for you to explore. Solitaire is the great popular solitaire card games for you. Come and Try the <b>FREE</b> solitaire game NOW!<br><br><br>- <b>CREATIVE SOLITAIRE GAME</b><br>Based on the classic solitaire (also known as Patience), we&#39;ve added a CREATIVE aquarium world with different sea fishes for you.<br><br>- <b>BEAUTIFULLY DESIGNED THEMES</b><br>While enjoying the classic solitaire games, you will totally immerse yourself in an amazing unique aquarium world with delicate undersea surroundings and creatures.<br><br>- <b>SURPRISING GOALS FOR YOU</b><br>When you pass a deal, you will get coins and stars as rewards. And when you collect enough stars, you can open a Star Chest. And you can finish the Daily Task to get surprises. What&#39;s more, don&#39;t forget to try the Lucky Spin for more surprises.<br><br>- <b>THOUSANDS OF CHALLENGES</b><br>Together with Daily Challenges, there are over tens of thousands of classic solitaire challenges for you to play anytime and anywhere! <br><br><br><b>HOW TO PLAY</b><br>-  Daily challenges with different levels<br>-  Up to 10 top records<br>-  Solitaire Draw 1 card or 3 cards <br>- Timer mode<br>-  Left-handed mode<br>-  Single tap or drag&amp;drop to move cards<br>-  Auto-collect cards on completion<br>-  Feature to Undo moves<br>-  Feature to use Hints<br>-  Play offline! No wifi required<br><br><br><br>If you like playing Patience classic solitaire games on laptops or webs, it is definitely the <b>GREAT</b> classic solitaire games for you on mobile devices! You can train your brain or kill time with friends together. <br><br><b>Solitaire</b> is currently the popular solitaire and the free solitaire game with <b>AMAZING</b> ocean theme in the world. And if you also like cute fishes, don&#39;t hesitate to download and play this classic solitaire game <b>NOW</b>! <br><br>Welcome to the POPULAR classic solitaire card game!","https://play-lh.googleusercontent.com/PjevxQppsS4JsR9k8t7OKSOK9e0-Lken0cdu7PsZZx5e3ImVpmJGkGSWf5yrXwSCqq4","GAME_CARD"
"Solitaire Classic","com.mintgames.solitaire.classic.card.game.free","Solitaire Classic from Mint Games is a classic solitaire card game.<br> <br>classic Solitaire is a puzzle game, and playing classic solitaire can train your brain. It is just an offline game that can be played anytime and anywhere. Download now to play the best classic Solitaire card game for free!<br><br>Solitaire Card Game, enjoy your time and train your brain in this card game!<br><br>🌟How to Play🌟<br>There are seven piles of cards. The top card in each pile is visible with its suit facing up. If the card you want is hidden, you can move cards around until finding the wanted one. Then you drag the card and put it into the desired card slot. If one of the seven piles is cleared, you can place a K card in this empty pile.<br><br> <br> If you have a solitaire card that&#39;s hidden, you can move solitaire cards around until you find places that you can hold and grab the desired solitaire card and, eventually, put it in the desired slot.<br><br> If you use all the solitaire cards in one of the seven piles, you may place a king in the empty space.<br> <br> 🌟Highlights🌟<br>♠ Easy mode (turning 1 card at a time) or hard mode (turning 3 cards at a time). If you get stuck in a game, try starting a new one!<br>♠ Different levels of daily challenges<br>♠ Standard scoring system<br>♠ Timer, moves and statistics<br>♠ Smart hints show potentially useful moves<br>♠ Unlimited undos<br>♠ Auto-complete option helps you finish a solved game<br>♠ Interesting and challenging achievements<br>♠ Play a random game, or restart a game that you have won before<br>♠ Left-handed option and right-handed option<br>♠ Play games offline anytime and anywhere<br><br>With many exquisite designs added, Solitaire Classic from Mint Games will give you a great solitaire experience!<br><br>🌟Key Features🌟 <br>♠ 14 kinds of game backgrounds<br> ♠ 31 kinds of card backgrounds<br> ♠ Simple, beautiful and easy-to-read cards<br> ♠ Portrait or landscape mode<br> ♠ Efficient, fast, and sensible card game interface<br> ♠ Use your photos to customize game background and card background<br><br>Now comes this popular card game for players of any age! Solitaire Classic from Mint Games does not require Wi-Fi, and you can play it whenever and wherever you want.<br><br>Download and try out this card game for free, and play with your friends now!<br><br>🌟More card games from Mint Games🌟<br>♠ Spider Solitaire<br>♦ Solitaire Card Game<br>♣ Solitaire Journey<br>♥ Freecell Solitaire<br><br><br>Contact Mint Games：<br>mimintgames@gmail.com","https://play-lh.googleusercontent.com/0MyhwY-DkBL4VrI4zzQkvYshSp23cu7RZ6NfTv2r8bI0IbCFBrdBMOApHKZpDOJKvyvM","GAME_CARD"
